[
  {
    "catagory_index": "8",
    "category_index": 1,
    "date": "1905-06-08T08:00:00.000Z",
    "gender": "female",
    "hundredths_under_barrier": 610,
    "index": 0,
    "location": "Nice",
    "name": "Sue Addison",
    "readable_date": "6/8/1905",
    "result": "4:23.9"
  },
  {
    "catagory_index": "1",
    "category_index": 1,
    "date": "1957-06-01T07:00:00.000Z",
    "gender": "male",
    "hundredths_under_barrier": 130,
    "index": 1,
    "location": "Stockton",
    "name": "Don Bowden",
    "readable_date": "6/1/1957",
    "result": "3:58.7"
  },
  {
    "catagory_index": "2",
    "category_index": 2,
    "date": "1960-04-23T08:00:00.000Z",
    "gender": "male",
    "hundredths_under_barrier": 140,
    "index": 2,
    "location": "Eugene",
    "name": "Dyrol Burleson",
    "readable_date": "4/23/1960",
    "result": "3:58.6"
  },
  {
    "catagory_index": "3",
    "category_index": 3,
    "date": "1960-05-28T07:00:00.000Z",
    "gender": "male",
    "hundredths_under_barrier": 200,
    "index": 3,
    "location": "Modesto",
    "name": "Jim Beatty",
    "readable_date": "5/28/1960",
    "result": "3:58.0"
  },
  {
    "catagory_index": "4",
    "category_index": 4,
    "date": "1962-04-28T08:00:00.000Z",
    "gender": "male",
    "hundredths_under_barrier": 10,
    "index": 4,
    "location": "Walnut",
    "name": "Jim Grelle",
    "readable_date": "4/28/1962",
    "result": "3:59.9"
  },
  {
    "catagory_index": "5",
    "category_index": 5,
    "date": "1962-05-26T07:00:00.000Z",
    "gender": "male",
    "hundredths_under_barrier": 170,
    "index": 5,
    "location": "Modesto",
    "name": "Keith Forman",
    "readable_date": "5/26/1962",
    "result": "3:58.3"
  },
  {
    "catagory_index": "6",
    "category_index": 6,
    "date": "1962-05-26T07:00:00.000Z",
    "gender": "male",
    "hundredths_under_barrier": 70,
    "index": 6,
    "location": "Modesto",
    "name": "Cary Weisiger",
    "readable_date": "5/26/1962",
    "result": "3:59.3"
  },
  {
    "catagory_index": "7",
    "category_index": 7,
    "date": "1962-06-23T07:00:00.000Z",
    "gender": "male",
    "hundredths_under_barrier": 100,
    "index": 7,
    "location": "Walnut",
    "name": "Bill Dotson",
    "readable_date": "6/23/1962",
    "result": "3:59.0"
  },
  {
    "catagory_index": "8",
    "category_index": 8,
    "date": "1962-08-18T07:00:00.000Z",
    "gender": "male",
    "hundredths_under_barrier": 200,
    "index": 8,
    "location": "London",
    "name": "Bob Seaman",
    "readable_date": "8/18/1962",
    "result": "3:58.0"
  },
  {
    "catagory_index": "9",
    "category_index": 9,
    "date": "1963-02-15T08:00:00.000Z",
    "gender": "male",
    "hundredths_under_barrier": 80,
    "index": 9,
    "location": "New York",
    "name": "Tom O’Hara",
    "readable_date": "2/15/1963",
    "result": "3:59.2"
  },
  {
    "catagory_index": "10",
    "category_index": 10,
    "date": "1964-06-05T07:00:00.000Z",
    "gender": "male",
    "hundredths_under_barrier": 240,
    "index": 10,
    "location": "Compton",
    "name": "Archie San Romani Jr.",
    "readable_date": "6/5/1964",
    "result": "3:57.6"
  },
  {
    "catagory_index": "11",
    "category_index": 11,
    "date": "1964-06-05T07:00:00.000Z",
    "gender": "male",
    "hundredths_under_barrier": 210,
    "index": 11,
    "location": "Compton",
    "name": "Morgan Groth",
    "readable_date": "6/5/1964",
    "result": "3:57.9"
  },
  {
    "catagory_index": "12",
    "category_index": 12,
    "date": "1964-06-05T07:00:00.000Z",
    "gender": "male",
    "hundredths_under_barrier": 110,
    "index": 12,
    "location": "Compton",
    "name": "Bob Day",
    "readable_date": "6/5/1964",
    "result": "3:58.9"
  },
  {
    "catagory_index": "13",
    "category_index": 13,
    "date": "1964-06-05T07:00:00.000Z",
    "gender": "male",
    "hundredths_under_barrier": 100,
    "index": 13,
    "location": "Compton",
    "name": "Jim Ryun",
    "readable_date": "6/5/1964",
    "result": "3:59.0"
  },
  {
    "catagory_index": "14",
    "category_index": 14,
    "date": "1964-06-13T07:00:00.000Z",
    "gender": "male",
    "hundredths_under_barrier": 90,
    "index": 14,
    "location": "San Diego",
    "name": "Bob Schul",
    "readable_date": "6/13/1964",
    "result": "3:59.1"
  },
  {
    "catagory_index": "15",
    "category_index": 15,
    "date": "1965-05-29T07:00:00.000Z",
    "gender": "male",
    "hundredths_under_barrier": 190,
    "index": 15,
    "location": "Modesto",
    "name": "John Garrison",
    "readable_date": "5/29/1965",
    "result": "3:58.1"
  },
  {
    "catagory_index": "16",
    "category_index": 16,
    "date": "1966-06-02T07:00:00.000Z",
    "gender": "male",
    "hundredths_under_barrier": 90,
    "index": 16,
    "location": "Eugene",
    "name": "Roscoe Divine",
    "readable_date": "6/2/1966",
    "result": "3:59.1"
  },
  {
    "catagory_index": "17",
    "category_index": 17,
    "date": "1966-06-02T07:00:00.000Z",
    "gender": "male",
    "hundredths_under_barrier": 20,
    "index": 17,
    "location": "Eugene",
    "name": "Wade Bell",
    "readable_date": "6/2/1966",
    "result": "3:59.8"
  },
  {
    "catagory_index": "18",
    "category_index": 18,
    "date": "1966-06-11T07:00:00.000Z",
    "gender": "male",
    "hundredths_under_barrier": 60,
    "index": 18,
    "location": "San Diego",
    "name": "Tim Danielson",
    "readable_date": "6/11/1966",
    "result": "3:59.4"
  },
  {
    "catagory_index": "19",
    "category_index": 19,
    "date": "1966-08-10T07:00:00.000Z",
    "gender": "male",
    "hundredths_under_barrier": 120,
    "index": 19,
    "location": "Woodland Hills",
    "name": "Richard Romo",
    "readable_date": "8/10/1966",
    "result": "3:58.8"
  },
  {
    "catagory_index": "20",
    "category_index": 20,
    "date": "1966-08-10T07:00:00.000Z",
    "gender": "male",
    "hundredths_under_barrier": 60,
    "index": 20,
    "location": "Woodland Hills",
    "name": "Ted Nelson",
    "readable_date": "8/10/1966",
    "result": "3:59.4"
  },
  {
    "catagory_index": "21",
    "category_index": 21,
    "date": "1967-02-17T08:00:00.000Z",
    "gender": "male",
    "hundredths_under_barrier": 70,
    "index": 21,
    "location": "New York",
    "name": "Dave Patrick",
    "readable_date": "2/17/1967",
    "result": "3:59.3"
  },
  {
    "catagory_index": "22",
    "category_index": 22,
    "date": "1967-06-23T07:00:00.000Z",
    "gender": "male",
    "hundredths_under_barrier": 380,
    "index": 22,
    "location": "Bakersfield",
    "name": "Dave Wilborn",
    "readable_date": "6/23/1967",
    "result": "3:56.2"
  },
  {
    "catagory_index": "23",
    "category_index": 23,
    "date": "1967-06-23T07:00:00.000Z",
    "gender": "male",
    "hundredths_under_barrier": 310,
    "index": 23,
    "location": "Bakersfield",
    "name": "Tom Von Ruden",
    "readable_date": "6/23/1967",
    "result": "3:56.9"
  },
  {
    "catagory_index": "24",
    "category_index": 24,
    "date": "1967-06-23T07:00:00.000Z",
    "gender": "male",
    "hundredths_under_barrier": 130,
    "index": 24,
    "location": "Bakersfield",
    "name": "Sam Bair",
    "readable_date": "6/23/1967",
    "result": "3:58.7"
  },
  {
    "catagory_index": "25",
    "category_index": 25,
    "date": "1967-06-23T07:00:00.000Z",
    "gender": "male",
    "hundredths_under_barrier": 20,
    "index": 25,
    "location": "Bakersfield",
    "name": "Marty Liquori",
    "readable_date": "6/23/1967",
    "result": "3:59.8"
  },
  {
    "catagory_index": "26",
    "category_index": 26,
    "date": "1968-06-01T07:00:00.000Z",
    "gender": "male",
    "hundredths_under_barrier": 260,
    "index": 26,
    "location": "Philadelphia",
    "name": "Brian Kivlan",
    "readable_date": "6/1/1968",
    "result": "3:57.4"
  },
  {
    "catagory_index": "27",
    "category_index": 27,
    "date": "1968-06-01T07:00:00.000Z",
    "gender": "male",
    "hundredths_under_barrier": 140,
    "index": 27,
    "location": "Philadelphia",
    "name": "Jerry Richey",
    "readable_date": "6/1/1968",
    "result": "3:58.6"
  },
  {
    "catagory_index": "28",
    "category_index": 28,
    "date": "1968-06-01T07:00:00.000Z",
    "gender": "male",
    "hundredths_under_barrier": 50,
    "index": 28,
    "location": "Philadelphia",
    "name": "Jack Fath",
    "readable_date": "6/1/1968",
    "result": "3:59.5"
  },
  {
    "catagory_index": "29",
    "category_index": 29,
    "date": "1968-08-10T07:00:00.000Z",
    "gender": "male",
    "hundredths_under_barrier": 100,
    "index": 29,
    "location": "Walnut",
    "name": "Pat Traynor",
    "readable_date": "8/10/1968",
    "result": "3:59.0"
  },
  {
    "catagory_index": "30",
    "category_index": 30,
    "date": "1969-05-31T07:00:00.000Z",
    "gender": "male",
    "hundredths_under_barrier": 160,
    "index": 30,
    "location": "Berkeley",
    "name": "Chuck LaBenz",
    "readable_date": "5/31/1969",
    "result": "3:58.4"
  },
  {
    "catagory_index": "31",
    "category_index": 31,
    "date": "1969-05-31T07:00:00.000Z",
    "gender": "male",
    "hundredths_under_barrier": 50,
    "index": 31,
    "location": "Berkeley",
    "name": "John Lawson",
    "readable_date": "5/31/1969",
    "result": "3:59.5"
  },
  {
    "catagory_index": "32",
    "category_index": 32,
    "date": "1970-05-16T07:00:00.000Z",
    "gender": "male",
    "hundredths_under_barrier": 80,
    "index": 32,
    "location": "Westwood",
    "name": "Rick Riley",
    "readable_date": "5/16/1970",
    "result": "3:59.2"
  },
  {
    "catagory_index": "33",
    "category_index": 33,
    "date": "1970-05-16T07:00:00.000Z",
    "gender": "male",
    "hundredths_under_barrier": 40,
    "index": 33,
    "location": "Westwood",
    "name": "Duncan Macdonald",
    "readable_date": "5/16/1970",
    "result": "3:59.6"
  },
  {
    "catagory_index": "34",
    "category_index": 34,
    "date": "1970-05-23T07:00:00.000Z",
    "gender": "male",
    "hundredths_under_barrier": 40,
    "index": 34,
    "location": "Modesto",
    "name": "Jim Crawford",
    "readable_date": "5/23/1970",
    "result": "3:59.6"
  },
  {
    "catagory_index": "35",
    "category_index": 35,
    "date": "1970-05-30T07:00:00.000Z",
    "gender": "male",
    "hundredths_under_barrier": 100,
    "index": 35,
    "location": "Philadelphia",
    "name": "Howell Michael",
    "readable_date": "5/30/1970",
    "result": "3:59.0"
  },
  {
    "catagory_index": "36",
    "category_index": 36,
    "date": "1970-05-30T07:00:00.000Z",
    "gender": "male",
    "hundredths_under_barrier": 160,
    "index": 36,
    "location": "Berkeley",
    "name": "John Mason",
    "readable_date": "5/30/1970",
    "result": "3:58.4"
  },
  {
    "catagory_index": "37",
    "category_index": 37,
    "date": "1970-06-05T07:00:00.000Z",
    "gender": "male",
    "hundredths_under_barrier": 260,
    "index": 37,
    "location": "Eugene",
    "name": "Steve Prefontaine",
    "readable_date": "6/5/1970",
    "result": "3:57.4"
  },
  {
    "catagory_index": "38",
    "category_index": 38,
    "date": "1970-06-05T07:00:00.000Z",
    "gender": "male",
    "hundredths_under_barrier": 80,
    "index": 38,
    "location": "Eugene",
    "name": "Steve Savage",
    "readable_date": "6/5/1970",
    "result": "3:59.2"
  },
  {
    "catagory_index": "39",
    "category_index": 39,
    "date": "1970-06-06T07:00:00.000Z",
    "gender": "male",
    "hundredths_under_barrier": 100,
    "index": 39,
    "location": "Bloomington",
    "name": "Dave Wottle",
    "readable_date": "6/6/1970",
    "result": "3:59.0"
  },
  {
    "catagory_index": "40",
    "category_index": 40,
    "date": "1971-02-13T08:00:00.000Z",
    "gender": "male",
    "hundredths_under_barrier": 90,
    "index": 40,
    "location": "Houston",
    "name": "Len Hilton",
    "readable_date": "2/13/1971",
    "result": "3:59.1"
  },
  {
    "catagory_index": "41",
    "category_index": 41,
    "date": "1971-02-13T08:00:00.000Z",
    "gender": "male",
    "hundredths_under_barrier": 40,
    "index": 41,
    "location": "Houston",
    "name": "Greg Carlberg",
    "readable_date": "2/13/1971",
    "result": "3:59.6"
  },
  {
    "catagory_index": "42",
    "category_index": 42,
    "date": "1971-04-16T08:00:00.000Z",
    "gender": "male",
    "hundredths_under_barrier": 50,
    "index": 42,
    "location": "Lawrence",
    "name": "Larry Rose",
    "readable_date": "4/16/1971",
    "result": "3:59.5"
  },
  {
    "catagory_index": "43",
    "category_index": 43,
    "date": "1971-05-11T07:00:00.000Z",
    "gender": "male",
    "hundredths_under_barrier": 120,
    "index": 43,
    "location": "Carbondale",
    "name": "Lee LaBadie",
    "readable_date": "5/11/1971",
    "result": "3:58.8"
  },
  {
    "catagory_index": "44",
    "category_index": 44,
    "date": "1971-05-29T07:00:00.000Z",
    "gender": "male",
    "hundredths_under_barrier": 60,
    "index": 44,
    "location": "Modesto",
    "name": "Jerome Howe",
    "readable_date": "5/29/1971",
    "result": "3:59.4"
  },
  {
    "catagory_index": "45",
    "category_index": 45,
    "date": "1971-06-19T07:00:00.000Z",
    "gender": "male",
    "hundredths_under_barrier": 10,
    "index": 45,
    "location": "Seattle",
    "name": "Bob Wheeler",
    "readable_date": "6/19/1971",
    "result": "3:59.9"
  },
  {
    "catagory_index": "46",
    "category_index": 46,
    "date": "1971-06-26T07:00:00.000Z",
    "gender": "male",
    "hundredths_under_barrier": 20,
    "index": 46,
    "location": "Eugene",
    "name": "John Baker",
    "readable_date": "6/26/1971",
    "result": "3:59.8"
  },
  {
    "catagory_index": "47",
    "category_index": 47,
    "date": "1972-03-04T08:00:00.000Z",
    "gender": "male",
    "hundredths_under_barrier": 50,
    "index": 47,
    "location": "Los Angeles",
    "name": "Mark Winzenried",
    "readable_date": "3/4/1972",
    "result": "3:59.5"
  },
  {
    "catagory_index": "48",
    "category_index": 48,
    "date": "1972-03-04T08:00:00.000Z",
    "gender": "male",
    "hundredths_under_barrier": 40,
    "index": 48,
    "location": "Los Angeles",
    "name": "George Young",
    "readable_date": "3/4/1972",
    "result": "3:59.6"
  },
  {
    "catagory_index": "49",
    "category_index": 49,
    "date": "1972-05-27T07:00:00.000Z",
    "gender": "male",
    "hundredths_under_barrier": 180,
    "index": 49,
    "location": "Modesto",
    "name": "Juris Luzins",
    "readable_date": "5/27/1972",
    "result": "3:58.2"
  },
  {
    "catagory_index": "50",
    "category_index": 50,
    "date": "1972-06-09T07:00:00.000Z",
    "gender": "male",
    "hundredths_under_barrier": 30,
    "index": 50,
    "location": "Los Angeles",
    "name": "Ken Popejoy",
    "readable_date": "6/9/1972",
    "result": "3:59.7"
  },
  {
    "catagory_index": "51",
    "category_index": 51,
    "date": "1973-04-21T08:00:00.000Z",
    "gender": "male",
    "hundredths_under_barrier": 160,
    "index": 51,
    "location": "Raleigh",
    "name": "Tony Waldrop",
    "readable_date": "4/21/1973",
    "result": "3:58.4"
  },
  {
    "catagory_index": "52",
    "category_index": 52,
    "date": "1973-04-21T08:00:00.000Z",
    "gender": "male",
    "hundredths_under_barrier": 70,
    "index": 52,
    "location": "Raleigh",
    "name": "Reggie McAfee",
    "readable_date": "4/21/1973",
    "result": "3:59.3"
  },
  {
    "catagory_index": "53",
    "category_index": 53,
    "date": "1973-05-13T07:00:00.000Z",
    "gender": "male",
    "hundredths_under_barrier": 120,
    "index": 53,
    "location": "Gainesville",
    "name": "Barry Brown",
    "readable_date": "5/13/1973",
    "result": "3:58.8"
  },
  {
    "catagory_index": "54",
    "category_index": 54,
    "date": "1973-05-19T07:00:00.000Z",
    "gender": "male",
    "hundredths_under_barrier": 50,
    "index": 54,
    "location": "Eugene",
    "name": "Mark Feig",
    "readable_date": "5/19/1973",
    "result": "3:59.5"
  },
  {
    "catagory_index": "55",
    "category_index": 55,
    "date": "1973-05-25T07:00:00.000Z",
    "gender": "male",
    "hundredths_under_barrier": 220,
    "index": 55,
    "location": "Arkadelphia",
    "name": "Tommy Fulton",
    "readable_date": "5/25/1973",
    "result": "3:57.8"
  },
  {
    "catagory_index": "56",
    "category_index": 56,
    "date": "1973-05-26T07:00:00.000Z",
    "gender": "male",
    "hundredths_under_barrier": 30,
    "index": 56,
    "location": "East Lansing",
    "name": "Charlie McMullen",
    "readable_date": "5/26/1973",
    "result": "3:59.7"
  },
  {
    "catagory_index": "57",
    "category_index": 57,
    "date": "1973-06-02T07:00:00.000Z",
    "gender": "male",
    "hundredths_under_barrier": 120,
    "index": 57,
    "location": "Wichita",
    "name": "Rick Wohlhuter",
    "readable_date": "6/2/1973",
    "result": "3:58.8"
  },
  {
    "catagory_index": "58",
    "category_index": 58,
    "date": "1973-06-04T07:00:00.000Z",
    "gender": "male",
    "hundredths_under_barrier": 200,
    "index": 58,
    "location": "Gainesville",
    "name": "Dick Buerkle",
    "readable_date": "6/4/1973",
    "result": "3:58.0"
  },
  {
    "catagory_index": "59",
    "category_index": 59,
    "date": "1973-06-09T07:00:00.000Z",
    "gender": "male",
    "hundredths_under_barrier": 140,
    "index": 59,
    "location": "Baton Rouge",
    "name": "Mark Schilling",
    "readable_date": "6/9/1973",
    "result": "3:58.6"
  },
  {
    "catagory_index": "60",
    "category_index": 60,
    "date": "1973-06-20T07:00:00.000Z",
    "gender": "male",
    "hundredths_under_barrier": 200,
    "index": 60,
    "location": "Eugene",
    "name": "Paul Geis",
    "readable_date": "6/20/1973",
    "result": "3:58.0"
  },
  {
    "catagory_index": "61",
    "category_index": 61,
    "date": "1973-06-20T07:00:00.000Z",
    "gender": "male",
    "hundredths_under_barrier": 120,
    "index": 61,
    "location": "Eugene",
    "name": "Jim Johnson",
    "readable_date": "6/20/1973",
    "result": "3:58.8"
  },
  {
    "catagory_index": "62",
    "category_index": 62,
    "date": "1973-06-20T07:00:00.000Z",
    "gender": "male",
    "hundredths_under_barrier": 40,
    "index": 62,
    "location": "Eugene",
    "name": "Scott Daggatt",
    "readable_date": "6/20/1973",
    "result": "3:59.6"
  },
  {
    "catagory_index": "63",
    "category_index": 63,
    "date": "1974-01-26T07:00:00.000Z",
    "gender": "male",
    "hundredths_under_barrier": 30,
    "index": 63,
    "location": "Fargo",
    "name": "Mike Slack",
    "readable_date": "1/26/1974",
    "result": "3:59.7"
  },
  {
    "catagory_index": "64",
    "category_index": 64,
    "date": "1974-02-09T07:00:00.000Z",
    "gender": "male",
    "hundredths_under_barrier": 10,
    "index": 64,
    "location": "Houston",
    "name": "Reed Fischer",
    "readable_date": "2/9/1974",
    "result": "3:59.9"
  },
  {
    "catagory_index": "65",
    "category_index": 65,
    "date": "1974-02-16T07:00:00.000Z",
    "gender": "male",
    "hundredths_under_barrier": 90,
    "index": 65,
    "location": "San Diego",
    "name": "Greg Gibson",
    "readable_date": "2/16/1974",
    "result": "3:59.1"
  },
  {
    "catagory_index": "66",
    "category_index": 66,
    "date": "1974-03-16T07:00:00.000Z",
    "gender": "male",
    "hundredths_under_barrier": 360,
    "index": 66,
    "location": "Tempe",
    "name": "Paul Cummings",
    "readable_date": "3/16/1974",
    "result": "3:56.4"
  },
  {
    "catagory_index": "67",
    "category_index": 67,
    "date": "1974-04-20T07:00:00.000Z",
    "gender": "male",
    "hundredths_under_barrier": 60,
    "index": 67,
    "location": "Raleigh",
    "name": "Steve Wheeler",
    "readable_date": "4/20/1974",
    "result": "3:59.4"
  },
  {
    "catagory_index": "68",
    "category_index": 68,
    "date": "1974-04-27T07:00:00.000Z",
    "gender": "male",
    "hundredths_under_barrier": 500,
    "index": 68,
    "location": "Philadelphia",
    "name": "Denis Fikes",
    "readable_date": "4/27/1974",
    "result": "3:55.0"
  },
  {
    "catagory_index": "69",
    "category_index": 69,
    "date": "1974-04-27T07:00:00.000Z",
    "gender": "male",
    "hundredths_under_barrier": 210,
    "index": 69,
    "location": "Philadelphia",
    "name": "Karl Thornton",
    "readable_date": "4/27/1974",
    "result": "3:57.9"
  },
  {
    "catagory_index": "70",
    "category_index": 70,
    "date": "1974-06-01T07:00:00.000Z",
    "gender": "male",
    "hundredths_under_barrier": 150,
    "index": 70,
    "location": "Wichita",
    "name": "Bruce Fischer",
    "readable_date": "6/1/1974",
    "result": "3:58.5"
  },
  {
    "catagory_index": "71",
    "category_index": 71,
    "date": "1974-06-01T07:00:00.000Z",
    "gender": "male",
    "hundredths_under_barrier": 150,
    "index": 71,
    "location": "Wichita",
    "name": "Ted Castaneda",
    "readable_date": "6/1/1974",
    "result": "3:58.5"
  },
  {
    "catagory_index": "72",
    "category_index": 72,
    "date": "1974-06-01T07:00:00.000Z",
    "gender": "male",
    "hundredths_under_barrier": 80,
    "index": 72,
    "location": "Wichita",
    "name": "Keith Palmer",
    "readable_date": "6/1/1974",
    "result": "3:59.2"
  },
  {
    "catagory_index": "73",
    "category_index": 73,
    "date": "1974-06-01T07:00:00.000Z",
    "gender": "male",
    "hundredths_under_barrier": 60,
    "index": 73,
    "location": "Wichita",
    "name": "Jeff Schemmel",
    "readable_date": "6/1/1974",
    "result": "3:59.4"
  },
  {
    "catagory_index": "1",
    "category_index": 2,
    "date": "1975-02-15T08:00:00.000Z",
    "gender": "female",
    "hundredths_under_barrier": 100,
    "index": 74,
    "location": "San Diego",
    "name": "Francie Larrieu",
    "readable_date": "2/15/1975",
    "result": "4:29.0"
  },
  {
    "catagory_index": "74",
    "category_index": 74,
    "date": "1975-03-22T07:00:00.000Z",
    "gender": "male",
    "hundredths_under_barrier": 150,
    "index": 75,
    "location": "Los Angeles",
    "name": "Keith Munson",
    "readable_date": "3/22/1975",
    "result": "3:58.5"
  },
  {
    "catagory_index": "75",
    "category_index": 75,
    "date": "1975-05-03T07:00:00.000Z",
    "gender": "male",
    "hundredths_under_barrier": 90,
    "index": 76,
    "location": "Durham",
    "name": "Ken Swenson",
    "readable_date": "5/3/1975",
    "result": "3:59.1"
  },
  {
    "catagory_index": "76",
    "category_index": 76,
    "date": "1975-05-06T07:00:00.000Z",
    "gender": "male",
    "hundredths_under_barrier": 150,
    "index": 77,
    "location": "Gainesville",
    "name": "Steve Foster",
    "readable_date": "5/6/1975",
    "result": "3:58.5"
  },
  {
    "catagory_index": "77",
    "category_index": 77,
    "date": "1975-05-10T07:00:00.000Z",
    "gender": "male",
    "hundredths_under_barrier": 40,
    "index": 78,
    "location": "Bowling Green",
    "name": "Steve Heidenreich",
    "readable_date": "5/10/1975",
    "result": "3:59.6"
  },
  {
    "catagory_index": "78",
    "category_index": 78,
    "date": "1975-05-24T07:00:00.000Z",
    "gender": "male",
    "hundredths_under_barrier": 80,
    "index": 79,
    "location": "Modesto",
    "name": "Matt Centrowitz",
    "readable_date": "5/24/1975",
    "result": "3:59.2"
  },
  {
    "catagory_index": "79",
    "category_index": 79,
    "date": "1975-05-29T07:00:00.000Z",
    "gender": "male",
    "hundredths_under_barrier": 120,
    "index": 80,
    "location": "Eugene",
    "name": "Gary Barger",
    "readable_date": "5/29/1975",
    "result": "3:58.8"
  },
  {
    "catagory_index": "80",
    "category_index": 80,
    "date": "1975-05-31T07:00:00.000Z",
    "gender": "male",
    "hundredths_under_barrier": 330,
    "index": 81,
    "location": "Wichita",
    "name": "Mike Durkin",
    "readable_date": "5/31/1975",
    "result": "3:56.7"
  },
  {
    "catagory_index": "81",
    "category_index": 81,
    "date": "1976-02-28T08:00:00.000Z",
    "gender": "male",
    "hundredths_under_barrier": 60,
    "index": 82,
    "location": "Baton Rouge",
    "name": "Steve Bolt",
    "readable_date": "2/28/1976",
    "result": "3:59.4"
  },
  {
    "catagory_index": "82",
    "category_index": 82,
    "date": "1976-05-29T07:00:00.000Z",
    "gender": "male",
    "hundredths_under_barrier": 70,
    "index": 83,
    "location": "Wichita",
    "name": "Rick Musgrave",
    "readable_date": "5/29/1976",
    "result": "3:59.3"
  },
  {
    "catagory_index": "83",
    "category_index": 83,
    "date": "1977-01-15T08:00:00.000Z",
    "gender": "male",
    "hundredths_under_barrier": 30,
    "index": 84,
    "location": "Los Angeles",
    "name": "Steve Scott",
    "readable_date": "1/15/1977",
    "result": "3:59.7"
  },
  {
    "catagory_index": "84",
    "category_index": 84,
    "date": "1977-04-30T07:00:00.000Z",
    "gender": "male",
    "hundredths_under_barrier": 310,
    "index": 85,
    "location": "Philadelphia",
    "name": "Ron Speirs",
    "readable_date": "4/30/1977",
    "result": "3:56.9"
  },
  {
    "catagory_index": "85",
    "category_index": 85,
    "date": "1977-05-27T07:00:00.000Z",
    "gender": "male",
    "hundredths_under_barrier": 40,
    "index": 86,
    "location": "Wichita",
    "name": "Steve Lacy",
    "readable_date": "5/27/1977",
    "result": "3:59.6"
  },
  {
    "catagory_index": "86",
    "category_index": 86,
    "date": "1977-06-14T07:00:00.000Z",
    "gender": "male",
    "hundredths_under_barrier": 70,
    "index": 87,
    "location": "Eugene",
    "name": "Ed Arriola",
    "readable_date": "6/14/1977",
    "result": "3:59.3"
  },
  {
    "catagory_index": "87",
    "category_index": 87,
    "date": "1978-01-28T08:00:00.000Z",
    "gender": "male",
    "hundredths_under_barrier": 90,
    "index": 88,
    "location": "Ann Arbor",
    "name": "Greg Meyer",
    "readable_date": "1/28/1978",
    "result": "3:59.1"
  },
  {
    "catagory_index": "88",
    "category_index": 88,
    "date": "1978-04-29T08:00:00.000Z",
    "gender": "male",
    "hundredths_under_barrier": 80,
    "index": 89,
    "location": "Philadelphia",
    "name": "Tom Duits",
    "readable_date": "4/29/1978",
    "result": "3:59.2"
  },
  {
    "catagory_index": "89",
    "category_index": 89,
    "date": "1978-05-07T07:00:00.000Z",
    "gender": "male",
    "hundredths_under_barrier": 190,
    "index": 90,
    "location": "Westwood",
    "name": "Don Paige",
    "readable_date": "5/7/1978",
    "result": "3:58.1"
  },
  {
    "catagory_index": "90",
    "category_index": 90,
    "date": "1978-06-17T07:00:00.000Z",
    "gender": "male",
    "hundredths_under_barrier": 40,
    "index": 91,
    "location": "Oxford",
    "name": "Craig Masback",
    "readable_date": "6/17/1978",
    "result": "3:59.6"
  },
  {
    "catagory_index": "91",
    "category_index": 91,
    "date": "1978-06-27T07:00:00.000Z",
    "gender": "male",
    "hundredths_under_barrier": 210,
    "index": 92,
    "location": "Oslo",
    "name": "Jerald Jones",
    "readable_date": "6/27/1978",
    "result": "3:57.9"
  },
  {
    "catagory_index": "92",
    "category_index": 92,
    "date": "1978-07-03T07:00:00.000Z",
    "gender": "male",
    "hundredths_under_barrier": 170,
    "index": 93,
    "location": "Stockholm",
    "name": "Jeff Jirele",
    "readable_date": "7/3/1978",
    "result": "3:58.3"
  },
  {
    "catagory_index": "93",
    "category_index": 93,
    "date": "1978-07-03T07:00:00.000Z",
    "gender": "male",
    "hundredths_under_barrier": 60,
    "index": 94,
    "location": "Stockholm",
    "name": "Phil Kane",
    "readable_date": "7/3/1978",
    "result": "3:59.4"
  },
  {
    "catagory_index": "94",
    "category_index": 94,
    "date": "1978-08-05T07:00:00.000Z",
    "gender": "male",
    "hundredths_under_barrier": 30,
    "index": 95,
    "location": "University Park",
    "name": "Greg Fredericks",
    "readable_date": "8/5/1978",
    "result": "3:59.7"
  },
  {
    "catagory_index": "95",
    "category_index": 95,
    "date": "1978-08-18T07:00:00.000Z",
    "gender": "male",
    "hundredths_under_barrier": 120,
    "index": 96,
    "location": "Berlin",
    "name": "Mike Manke",
    "readable_date": "8/18/1978",
    "result": "3:58.8"
  },
  {
    "catagory_index": "96",
    "category_index": 96,
    "date": "1979-06-09T07:00:00.000Z",
    "gender": "male",
    "hundredths_under_barrier": 160,
    "index": 97,
    "location": "Berkeley",
    "name": "Mark Belger",
    "readable_date": "6/9/1979",
    "result": "3:58.4"
  },
  {
    "catagory_index": "97",
    "category_index": 97,
    "date": "1979-06-23T07:00:00.000Z",
    "gender": "male",
    "hundredths_under_barrier": 200,
    "index": 98,
    "location": "Piscataway",
    "name": "Ross Donoghue",
    "readable_date": "6/23/1979",
    "result": "3:58.0"
  },
  {
    "catagory_index": "2",
    "category_index": 3,
    "date": "1979-06-30T07:00:00.000Z",
    "gender": "female",
    "hundredths_under_barrier": 650,
    "index": 99,
    "location": "Philadelphia",
    "name": "Mary Decker",
    "readable_date": "6/30/1979",
    "result": "4:23.5"
  },
  {
    "catagory_index": "3",
    "category_index": 4,
    "date": "1979-06-30T07:00:00.000Z",
    "gender": "female",
    "hundredths_under_barrier": 180,
    "index": 100,
    "location": "Philadelphia",
    "name": "Jan Merrill",
    "readable_date": "6/30/1979",
    "result": "4:28.2"
  },
  {
    "catagory_index": "98",
    "category_index": 98,
    "date": "1979-07-04T07:00:00.000Z",
    "gender": "male",
    "hundredths_under_barrier": 170,
    "index": 101,
    "location": "Tillsonburg",
    "name": "Tom Smith",
    "readable_date": "7/4/1979",
    "result": "3:58.3"
  },
  {
    "catagory_index": "99",
    "category_index": 99,
    "date": "1979-07-08T07:00:00.000Z",
    "gender": "male",
    "hundredths_under_barrier": 50,
    "index": 102,
    "location": "Gateshead",
    "name": "Andy Clifford",
    "readable_date": "7/8/1979",
    "result": "3:59.5"
  },
  {
    "catagory_index": "100",
    "category_index": 100,
    "date": "1980-02-09T08:00:00.000Z",
    "gender": "male",
    "hundredths_under_barrier": 110,
    "index": 103,
    "location": "Louisville",
    "name": "Jim Spivey",
    "readable_date": "2/9/1980",
    "result": "3:58.9"
  },
  {
    "catagory_index": "101",
    "category_index": 101,
    "date": "1980-03-22T08:00:00.000Z",
    "gender": "male",
    "hundredths_under_barrier": 30,
    "index": 104,
    "location": "Stanford",
    "name": "Ray Wicksell",
    "readable_date": "3/22/1980",
    "result": "3:59.7"
  },
  {
    "catagory_index": "102",
    "category_index": 102,
    "date": "1980-05-11T07:00:00.000Z",
    "gender": "male",
    "hundredths_under_barrier": 230,
    "index": 105,
    "location": "Westwood",
    "name": "Ron Cornell",
    "readable_date": "5/11/1980",
    "result": "3:57.7"
  },
  {
    "catagory_index": "103",
    "category_index": 103,
    "date": "1980-05-16T07:00:00.000Z",
    "gender": "male",
    "hundredths_under_barrier": 160,
    "index": 106,
    "location": "University Park",
    "name": "Larry Mangan",
    "readable_date": "5/16/1980",
    "result": "3:58.4"
  },
  {
    "catagory_index": "104",
    "category_index": 104,
    "date": "1980-05-18T07:00:00.000Z",
    "gender": "male",
    "hundredths_under_barrier": 200,
    "index": 107,
    "location": "Philadelphia",
    "name": "Mike Wyatt",
    "readable_date": "5/18/1980",
    "result": "3:58.0"
  },
  {
    "catagory_index": "105",
    "category_index": 105,
    "date": "1980-07-04T07:00:00.000Z",
    "gender": "male",
    "hundredths_under_barrier": 170,
    "index": 108,
    "location": "Tillsonburg",
    "name": "Richie Harris",
    "readable_date": "7/4/1980",
    "result": "3:58.3"
  },
  {
    "catagory_index": "106",
    "category_index": 106,
    "date": "1980-07-07T07:00:00.000Z",
    "gender": "male",
    "hundredths_under_barrier": 160,
    "index": 109,
    "location": "Stockholm",
    "name": "Todd Harbour",
    "readable_date": "7/7/1980",
    "result": "3:58.4"
  },
  {
    "catagory_index": "107",
    "category_index": 107,
    "date": "1980-07-26T07:00:00.000Z",
    "gender": "male",
    "hundredths_under_barrier": 90,
    "index": 110,
    "location": "Eugene",
    "name": "Bill McChesney",
    "readable_date": "7/26/1980",
    "result": "3:59.1"
  },
  {
    "catagory_index": "108",
    "category_index": 108,
    "date": "1981-02-13T08:00:00.000Z",
    "gender": "male",
    "hundredths_under_barrier": 400,
    "index": 111,
    "location": "Inglewood",
    "name": "Tom Byers",
    "readable_date": "2/13/1981",
    "result": "3:56.0"
  },
  {
    "catagory_index": "109",
    "category_index": 109,
    "date": "1981-02-21T08:00:00.000Z",
    "gender": "male",
    "hundredths_under_barrier": 340,
    "index": 112,
    "location": "Daly City",
    "name": "Doug Padilla",
    "readable_date": "2/21/1981",
    "result": "3:56.6"
  },
  {
    "catagory_index": "110",
    "category_index": 110,
    "date": "1981-02-28T08:00:00.000Z",
    "gender": "male",
    "hundredths_under_barrier": 10,
    "index": 113,
    "location": "Champaign",
    "name": "Chuck Aragon",
    "readable_date": "2/28/1981",
    "result": "3:59.9"
  },
  {
    "catagory_index": "111",
    "category_index": 111,
    "date": "1981-04-11T08:00:00.000Z",
    "gender": "male",
    "hundredths_under_barrier": 10,
    "index": 114,
    "location": "San José",
    "name": "Dan Aldridge",
    "readable_date": "4/11/1981",
    "result": "3:59.9"
  },
  {
    "catagory_index": "112",
    "category_index": 112,
    "date": "1981-05-28T07:00:00.000Z",
    "gender": "male",
    "hundredths_under_barrier": 300,
    "index": 115,
    "location": "Eugene",
    "name": "Rudy Chapa",
    "readable_date": "5/28/1981",
    "result": "3:57.0"
  },
  {
    "catagory_index": "113",
    "category_index": 113,
    "date": "1981-05-28T07:00:00.000Z",
    "gender": "male",
    "hundredths_under_barrier": 270,
    "index": 116,
    "location": "Eugene",
    "name": "Ed Spinney",
    "readable_date": "5/28/1981",
    "result": "3:57.3"
  },
  {
    "catagory_index": "114",
    "category_index": 114,
    "date": "1981-05-28T07:00:00.000Z",
    "gender": "male",
    "hundredths_under_barrier": 220,
    "index": 117,
    "location": "Eugene",
    "name": "Ken Martin",
    "readable_date": "5/28/1981",
    "result": "3:57.8"
  },
  {
    "catagory_index": "115",
    "category_index": 115,
    "date": "1981-05-30T07:00:00.000Z",
    "gender": "male",
    "hundredths_under_barrier": 290,
    "index": 118,
    "location": "Villanova",
    "name": "John Gregorek",
    "readable_date": "5/30/1981",
    "result": "3:57.1"
  },
  {
    "catagory_index": "116",
    "category_index": 116,
    "date": "1981-09-09T07:00:00.000Z",
    "gender": "male",
    "hundredths_under_barrier": 1120,
    "index": 119,
    "location": "Rieti",
    "name": "Sydney Maree",
    "readable_date": "9/9/1981",
    "result": "3:48.8"
  },
  {
    "catagory_index": "117",
    "category_index": 117,
    "date": "1982-01-22T08:00:00.000Z",
    "gender": "male",
    "hundredths_under_barrier": 270,
    "index": 120,
    "location": "Los Angeles",
    "name": "Frank Assumma",
    "readable_date": "1/22/1982",
    "result": "3:57.3"
  },
  {
    "catagory_index": "118",
    "category_index": 118,
    "date": "1982-01-23T08:00:00.000Z",
    "gender": "male",
    "hundredths_under_barrier": 90,
    "index": 121,
    "location": "Ann Arbor",
    "name": "Dan Heikkinen",
    "readable_date": "1/23/1982",
    "result": "3:59.1"
  },
  {
    "catagory_index": "119",
    "category_index": 119,
    "date": "1982-02-13T08:00:00.000Z",
    "gender": "male",
    "hundredths_under_barrier": 180,
    "index": 122,
    "location": "Boston",
    "name": "Vince Draddy",
    "readable_date": "2/13/1982",
    "result": "3:58.2"
  },
  {
    "catagory_index": "120",
    "category_index": 120,
    "date": "1982-02-13T08:00:00.000Z",
    "gender": "male",
    "hundredths_under_barrier": 160,
    "index": 123,
    "location": "Boston",
    "name": "Roger Jones",
    "readable_date": "2/13/1982",
    "result": "3:58.4"
  },
  {
    "catagory_index": "121",
    "category_index": 121,
    "date": "1982-02-13T08:00:00.000Z",
    "gender": "male",
    "hundredths_under_barrier": 50,
    "index": 124,
    "location": "Boston",
    "name": "Thom Hunt",
    "readable_date": "2/13/1982",
    "result": "3:59.5"
  },
  {
    "catagory_index": "122",
    "category_index": 122,
    "date": "1982-05-08T07:00:00.000Z",
    "gender": "male",
    "hundredths_under_barrier": 170,
    "index": 125,
    "location": "Corvallis",
    "name": "Mark Fricker",
    "readable_date": "5/8/1982",
    "result": "3:58.3"
  },
  {
    "catagory_index": "123",
    "category_index": 123,
    "date": "1982-05-15T07:00:00.000Z",
    "gender": "male",
    "hundredths_under_barrier": 360,
    "index": 126,
    "location": "Eugene",
    "name": "Jim Hill",
    "readable_date": "5/15/1982",
    "result": "3:56.4"
  },
  {
    "catagory_index": "4",
    "category_index": 5,
    "date": "1982-05-16T07:00:00.000Z",
    "gender": "female",
    "hundredths_under_barrier": 80,
    "index": 127,
    "location": "Westwood",
    "name": "Cindy Bremser",
    "readable_date": "5/16/1982",
    "result": "4:29.2"
  },
  {
    "catagory_index": "124",
    "category_index": 124,
    "date": "1982-06-05T07:00:00.000Z",
    "gender": "male",
    "hundredths_under_barrier": 170,
    "index": 128,
    "location": "Eugene",
    "name": "Joe Fabris",
    "readable_date": "6/5/1982",
    "result": "3:58.3"
  },
  {
    "catagory_index": "125",
    "category_index": 125,
    "date": "1982-07-17T07:00:00.000Z",
    "gender": "male",
    "hundredths_under_barrier": 170,
    "index": 129,
    "location": "London",
    "name": "Steve Plasencia",
    "readable_date": "7/17/1982",
    "result": "3:58.3"
  },
  {
    "catagory_index": "126",
    "category_index": 126,
    "date": "1983-01-15T08:00:00.000Z",
    "gender": "male",
    "hundredths_under_barrier": 100,
    "index": 130,
    "location": "Johnson City",
    "name": "Chris Fox",
    "readable_date": "1/15/1983",
    "result": "3:59.0"
  },
  {
    "catagory_index": "127",
    "category_index": 127,
    "date": "1983-01-15T08:00:00.000Z",
    "gender": "male",
    "hundredths_under_barrier": 90,
    "index": 131,
    "location": "Johnson City",
    "name": "Kevin Johnson",
    "readable_date": "1/15/1983",
    "result": "3:59.1"
  },
  {
    "catagory_index": "128",
    "category_index": 128,
    "date": "1983-02-11T08:00:00.000Z",
    "gender": "male",
    "hundredths_under_barrier": 180,
    "index": 132,
    "location": "Daly City",
    "name": "Jay Woods",
    "readable_date": "2/11/1983",
    "result": "3:58.2"
  },
  {
    "catagory_index": "129",
    "category_index": 129,
    "date": "1983-02-12T08:00:00.000Z",
    "gender": "male",
    "hundredths_under_barrier": 10,
    "index": 133,
    "location": "Ann Arbor",
    "name": "Brian Diemer",
    "readable_date": "2/12/1983",
    "result": "3:59.9"
  },
  {
    "catagory_index": "130",
    "category_index": 130,
    "date": "1983-05-14T07:00:00.000Z",
    "gender": "male",
    "hundredths_under_barrier": 290,
    "index": 134,
    "location": "Eugene",
    "name": "Dub Myers",
    "readable_date": "5/14/1983",
    "result": "3:57.1"
  },
  {
    "catagory_index": "131",
    "category_index": 131,
    "date": "1983-06-01T07:00:00.000Z",
    "gender": "male",
    "hundredths_under_barrier": 160,
    "index": 135,
    "location": "Vancouver",
    "name": "Gary Gustafson",
    "readable_date": "6/1/1983",
    "result": "3:58.4"
  },
  {
    "catagory_index": "132",
    "category_index": 132,
    "date": "1983-06-04T07:00:00.000Z",
    "gender": "male",
    "hundredths_under_barrier": 240,
    "index": 136,
    "location": "Eugene",
    "name": "Kevin Ryan",
    "readable_date": "6/4/1983",
    "result": "3:57.6"
  },
  {
    "catagory_index": "133",
    "category_index": 133,
    "date": "1983-07-20T07:00:00.000Z",
    "gender": "male",
    "hundredths_under_barrier": 60,
    "index": 137,
    "location": "Luxembourg",
    "name": "Adam Dixon",
    "readable_date": "7/20/1983",
    "result": "3:59.4"
  },
  {
    "catagory_index": "134",
    "category_index": 134,
    "date": "1984-05-12T07:00:00.000Z",
    "gender": "male",
    "hundredths_under_barrier": 130,
    "index": 138,
    "location": "Eugene",
    "name": "Randy Wilson",
    "readable_date": "5/12/1984",
    "result": "3:58.7"
  },
  {
    "catagory_index": "135",
    "category_index": 135,
    "date": "1984-05-12T07:00:00.000Z",
    "gender": "male",
    "hundredths_under_barrier": 20,
    "index": 139,
    "location": "Eugene",
    "name": "Mike Blackmore",
    "readable_date": "5/12/1984",
    "result": "3:59.8"
  },
  {
    "catagory_index": "136",
    "category_index": 136,
    "date": "1984-07-07T07:00:00.000Z",
    "gender": "male",
    "hundredths_under_barrier": 60,
    "index": 140,
    "location": "Tillsonburg",
    "name": "Terry Brahm",
    "readable_date": "7/7/1984",
    "result": "3:59.4"
  },
  {
    "catagory_index": "137",
    "category_index": 137,
    "date": "1984-07-21T07:00:00.000Z",
    "gender": "male",
    "hundredths_under_barrier": 390,
    "index": 141,
    "location": "Oslo",
    "name": "Brian Theriot",
    "readable_date": "7/21/1984",
    "result": "3:56.1"
  },
  {
    "catagory_index": "5",
    "category_index": 6,
    "date": "1984-09-07T07:00:00.000Z",
    "gender": "female",
    "hundredths_under_barrier": 820,
    "index": 142,
    "location": "London",
    "name": "Ruth Wysocki",
    "readable_date": "9/7/1984",
    "result": "4:21.8"
  },
  {
    "catagory_index": "138",
    "category_index": 138,
    "date": "1985-01-19T08:00:00.000Z",
    "gender": "male",
    "hundredths_under_barrier": 140,
    "index": 143,
    "location": "Johnson City",
    "name": "Jim McKeon",
    "readable_date": "1/19/1985",
    "result": "3:58.6"
  },
  {
    "catagory_index": "139",
    "category_index": 139,
    "date": "1985-04-27T08:00:00.000Z",
    "gender": "male",
    "hundredths_under_barrier": 80,
    "index": 144,
    "location": "Philadelphia",
    "name": "Cliff Sheehan",
    "readable_date": "4/27/1985",
    "result": "3:59.2"
  },
  {
    "catagory_index": "140",
    "category_index": 140,
    "date": "1985-05-25T07:00:00.000Z",
    "gender": "male",
    "hundredths_under_barrier": 140,
    "index": 145,
    "location": "San José",
    "name": "Gary Lewis",
    "readable_date": "5/25/1985",
    "result": "3:58.6"
  },
  {
    "catagory_index": "141",
    "category_index": 141,
    "date": "1985-06-29T07:00:00.000Z",
    "gender": "male",
    "hundredths_under_barrier": 20,
    "index": 146,
    "location": "Tillsonburg",
    "name": "Richard Block",
    "readable_date": "6/29/1985",
    "result": "3:59.8"
  },
  {
    "catagory_index": "6",
    "category_index": 7,
    "date": "1985-07-23T07:00:00.000Z",
    "gender": "female",
    "hundredths_under_barrier": 130,
    "index": 147,
    "location": "Edinburgh",
    "name": "Suzanne Girard",
    "readable_date": "7/23/1985",
    "result": "4:28.7"
  },
  {
    "catagory_index": "7",
    "category_index": 8,
    "date": "1985-07-27T07:00:00.000Z",
    "gender": "female",
    "hundredths_under_barrier": 100,
    "index": 148,
    "location": "Oslo",
    "name": "Chris Gregorek",
    "readable_date": "7/27/1985",
    "result": "4:29.0"
  },
  {
    "catagory_index": "142",
    "category_index": 142,
    "date": "1985-08-16T07:00:00.000Z",
    "gender": "male",
    "hundredths_under_barrier": 70,
    "index": 149,
    "location": "Bern",
    "name": "Henry Marsh",
    "readable_date": "8/16/1985",
    "result": "3:59.3"
  },
  {
    "catagory_index": "143",
    "category_index": 143,
    "date": "1986-01-26T08:00:00.000Z",
    "gender": "male",
    "hundredths_under_barrier": 120,
    "index": 150,
    "location": "Allston",
    "name": "Mike Stahr",
    "readable_date": "1/26/1986",
    "result": "3:58.8"
  },
  {
    "catagory_index": "144",
    "category_index": 144,
    "date": "1986-05-10T07:00:00.000Z",
    "gender": "male",
    "hundredths_under_barrier": 10,
    "index": 151,
    "location": "Modesto",
    "name": "Jeff Atkinson",
    "readable_date": "5/10/1986",
    "result": "3:59.9"
  },
  {
    "catagory_index": "145",
    "category_index": 145,
    "date": "1986-05-17T07:00:00.000Z",
    "gender": "male",
    "hundredths_under_barrier": 120,
    "index": 152,
    "location": "Westwood",
    "name": "Earl Jones",
    "readable_date": "5/17/1986",
    "result": "3:58.8"
  },
  {
    "catagory_index": "146",
    "category_index": 146,
    "date": "1986-05-17T07:00:00.000Z",
    "gender": "male",
    "hundredths_under_barrier": 30,
    "index": 153,
    "location": "Eugene",
    "name": "Marty Hemsley",
    "readable_date": "5/17/1986",
    "result": "3:59.7"
  },
  {
    "catagory_index": "147",
    "category_index": 147,
    "date": "1986-06-14T07:00:00.000Z",
    "gender": "male",
    "hundredths_under_barrier": 170,
    "index": 154,
    "location": "Villanova",
    "name": "Kevin King",
    "readable_date": "6/14/1986",
    "result": "3:58.3"
  },
  {
    "catagory_index": "148",
    "category_index": 148,
    "date": "1986-06-30T07:00:00.000Z",
    "gender": "male",
    "hundredths_under_barrier": 30,
    "index": 155,
    "location": "Belfast",
    "name": "Maurice Smith",
    "readable_date": "6/30/1986",
    "result": "3:59.7"
  },
  {
    "catagory_index": "9",
    "category_index": 9,
    "date": "1986-09-05T07:00:00.000Z",
    "gender": "female",
    "hundredths_under_barrier": 470,
    "index": 156,
    "location": "Brussels",
    "name": "Claudette Groenendaal",
    "readable_date": "9/5/1986",
    "result": "4:25.3"
  },
  {
    "catagory_index": "149",
    "category_index": 149,
    "date": "1987-01-16T08:00:00.000Z",
    "gender": "male",
    "hundredths_under_barrier": 10,
    "index": 157,
    "location": "Indanapolis",
    "name": "James Murphy",
    "readable_date": "1/16/1987",
    "result": "3:59.9"
  },
  {
    "catagory_index": "150",
    "category_index": 150,
    "date": "1987-01-31T08:00:00.000Z",
    "gender": "male",
    "hundredths_under_barrier": 320,
    "index": 158,
    "location": "Fayetteville",
    "name": "Joe Falcon",
    "readable_date": "1/31/1987",
    "result": "3:56.8"
  },
  {
    "catagory_index": "151",
    "category_index": 151,
    "date": "1987-05-09T07:00:00.000Z",
    "gender": "male",
    "hundredths_under_barrier": 140,
    "index": 159,
    "location": "Modesto",
    "name": "Gawain Guy",
    "readable_date": "5/9/1987",
    "result": "3:58.6"
  },
  {
    "catagory_index": "152",
    "category_index": 152,
    "date": "1987-05-16T07:00:00.000Z",
    "gender": "male",
    "hundredths_under_barrier": 30,
    "index": 160,
    "location": "Eugene",
    "name": "Harold Kuphaldt",
    "readable_date": "5/16/1987",
    "result": "3:59.7"
  },
  {
    "catagory_index": "153",
    "category_index": 153,
    "date": "1987-05-16T07:00:00.000Z",
    "gender": "male",
    "hundredths_under_barrier": 20,
    "index": 161,
    "location": "Eugene",
    "name": "Rich Bergesen",
    "readable_date": "5/16/1987",
    "result": "3:59.8"
  },
  {
    "catagory_index": "10",
    "category_index": 10,
    "date": "1987-06-06T07:00:00.000Z",
    "gender": "female",
    "hundredths_under_barrier": 90,
    "index": 162,
    "location": "Eugene",
    "name": "Linda Sheskey",
    "readable_date": "6/6/1987",
    "result": "4:29.1"
  },
  {
    "catagory_index": "11",
    "category_index": 11,
    "date": "1987-07-10T07:00:00.000Z",
    "gender": "female",
    "hundredths_under_barrier": 420,
    "index": 163,
    "location": "London",
    "name": "Diana Richburg",
    "readable_date": "7/10/1987",
    "result": "4:25.8"
  },
  {
    "catagory_index": "12",
    "category_index": 12,
    "date": "1987-07-10T07:00:00.000Z",
    "gender": "female",
    "hundredths_under_barrier": 150,
    "index": 164,
    "location": "London",
    "name": "Mary Knisely",
    "readable_date": "7/10/1987",
    "result": "4:28.5"
  },
  {
    "catagory_index": "154",
    "category_index": 154,
    "date": "1988-01-22T08:00:00.000Z",
    "gender": "male",
    "hundredths_under_barrier": 140,
    "index": 165,
    "location": "Johnson City",
    "name": "Brian Abshire",
    "readable_date": "1/22/1988",
    "result": "3:58.6"
  },
  {
    "catagory_index": "155",
    "category_index": 155,
    "date": "1988-01-31T08:00:00.000Z",
    "gender": "male",
    "hundredths_under_barrier": 90,
    "index": 166,
    "location": "Allston",
    "name": "Steve Ave",
    "readable_date": "1/31/1988",
    "result": "3:59.1"
  },
  {
    "catagory_index": "156",
    "category_index": 156,
    "date": "1988-02-05T08:00:00.000Z",
    "gender": "male",
    "hundredths_under_barrier": 60,
    "index": 167,
    "location": "New York",
    "name": "Roosevelt Jackson",
    "readable_date": "2/5/1988",
    "result": "3:59.4"
  },
  {
    "catagory_index": "13",
    "category_index": 13,
    "date": "1988-02-05T08:00:00.000Z",
    "gender": "female",
    "hundredths_under_barrier": 170,
    "index": 168,
    "location": "New York",
    "name": "Vicki Huber",
    "readable_date": "2/5/1988",
    "result": "4:28.3"
  },
  {
    "catagory_index": "157",
    "category_index": 157,
    "date": "1988-02-06T08:00:00.000Z",
    "gender": "male",
    "hundredths_under_barrier": 270,
    "index": 169,
    "location": "Notre Dame",
    "name": "John Quade",
    "readable_date": "2/6/1988",
    "result": "3:57.3"
  },
  {
    "catagory_index": "158",
    "category_index": 158,
    "date": "1988-02-06T08:00:00.000Z",
    "gender": "male",
    "hundredths_under_barrier": 190,
    "index": 170,
    "location": "Notr eDame",
    "name": "Darryl Frerker",
    "readable_date": "2/6/1988",
    "result": "3:58.1"
  },
  {
    "catagory_index": "159",
    "category_index": 159,
    "date": "1988-05-07T07:00:00.000Z",
    "gender": "male",
    "hundredths_under_barrier": 60,
    "index": 171,
    "location": "Corvallis",
    "name": "Karl Van Calcar",
    "readable_date": "5/7/1988",
    "result": "3:59.4"
  },
  {
    "catagory_index": "160",
    "category_index": 160,
    "date": "1988-06-05T07:00:00.000Z",
    "gender": "male",
    "hundredths_under_barrier": 430,
    "index": 172,
    "location": "Westwood",
    "name": "Tim Hacker",
    "readable_date": "6/5/1988",
    "result": "3:55.7"
  },
  {
    "catagory_index": "161",
    "category_index": 161,
    "date": "1988-07-02T07:00:00.000Z",
    "gender": "male",
    "hundredths_under_barrier": 90,
    "index": 173,
    "location": "Eugene",
    "name": "Bruce Stirling",
    "readable_date": "7/2/1988",
    "result": "3:59.1"
  },
  {
    "catagory_index": "162",
    "category_index": 162,
    "date": "1989-01-27T08:00:00.000Z",
    "gender": "male",
    "hundredths_under_barrier": 50,
    "index": 174,
    "location": "Johnson City",
    "name": "Brian Jaeger",
    "readable_date": "1/27/1989",
    "result": "3:59.5"
  },
  {
    "catagory_index": "163",
    "category_index": 163,
    "date": "1989-02-18T08:00:00.000Z",
    "gender": "male",
    "hundredths_under_barrier": 110,
    "index": 175,
    "location": "Ft. Worth",
    "name": "Reuben Reina",
    "readable_date": "2/18/1989",
    "result": "3:58.9"
  },
  {
    "catagory_index": "164",
    "category_index": 164,
    "date": "1989-03-11T08:00:00.000Z",
    "gender": "male",
    "hundredths_under_barrier": 120,
    "index": 176,
    "location": "Indianapolis",
    "name": "Bob Whelan",
    "readable_date": "3/11/1989",
    "result": "3:58.8"
  },
  {
    "catagory_index": "165",
    "category_index": 165,
    "date": "1989-06-10T07:00:00.000Z",
    "gender": "male",
    "hundredths_under_barrier": 120,
    "index": 177,
    "location": "Dedham",
    "name": "Mark Coogan",
    "readable_date": "6/10/1989",
    "result": "3:58.8"
  },
  {
    "catagory_index": "166",
    "category_index": 166,
    "date": "1989-06-10T07:00:00.000Z",
    "gender": "male",
    "hundredths_under_barrier": 10,
    "index": 178,
    "location": "Dedham",
    "name": "Brad Schlapak",
    "readable_date": "6/10/1989",
    "result": "3:59.9"
  },
  {
    "catagory_index": "167",
    "category_index": 167,
    "date": "1989-06-10T07:00:00.000Z",
    "gender": "male",
    "hundredths_under_barrier": 80,
    "index": 179,
    "location": "Westwood",
    "name": "Greg Whiteley",
    "readable_date": "6/10/1989",
    "result": "3:59.2"
  },
  {
    "catagory_index": "168",
    "category_index": 168,
    "date": "1989-06-10T07:00:00.000Z",
    "gender": "male",
    "hundredths_under_barrier": 20,
    "index": 180,
    "location": "Westwood",
    "name": "Paul Greer",
    "readable_date": "6/10/1989",
    "result": "3:59.8"
  },
  {
    "catagory_index": "14",
    "category_index": 14,
    "date": "1989-08-06T07:00:00.000Z",
    "gender": "female",
    "hundredths_under_barrier": 270,
    "index": 181,
    "location": "Westwood",
    "name": "Suzy Favor",
    "readable_date": "8/6/1989",
    "result": "4:27.3"
  },
  {
    "catagory_index": "15",
    "category_index": 15,
    "date": "1989-08-06T07:00:00.000Z",
    "gender": "female",
    "hundredths_under_barrier": 80,
    "index": 182,
    "location": "Westwood",
    "name": "PattiSue Plumer",
    "readable_date": "8/6/1989",
    "result": "4:29.2"
  },
  {
    "catagory_index": "169",
    "category_index": 169,
    "date": "1990-02-18T08:00:00.000Z",
    "gender": "male",
    "hundredths_under_barrier": 60,
    "index": 183,
    "location": "Boston",
    "name": "Eddie Slowikowski",
    "readable_date": "2/18/1990",
    "result": "3:59.4"
  },
  {
    "catagory_index": "170",
    "category_index": 170,
    "date": "1990-03-10T08:00:00.000Z",
    "gender": "male",
    "hundredths_under_barrier": 80,
    "index": 184,
    "location": "Indianapolis",
    "name": "Eric Henry",
    "readable_date": "3/10/1990",
    "result": "3:59.2"
  },
  {
    "catagory_index": "171",
    "category_index": 171,
    "date": "1990-06-23T07:00:00.000Z",
    "gender": "male",
    "hundredths_under_barrier": 50,
    "index": 185,
    "location": "Holmdel",
    "name": "Jim Norris",
    "readable_date": "6/23/1990",
    "result": "3:59.5"
  },
  {
    "catagory_index": "16",
    "category_index": 16,
    "date": "1990-07-14T07:00:00.000Z",
    "gender": "female",
    "hundredths_under_barrier": 590,
    "index": 186,
    "location": "Oslo",
    "name": "Lynn Jennings",
    "readable_date": "7/14/1990",
    "result": "4:24.1"
  },
  {
    "catagory_index": "17",
    "category_index": 17,
    "date": "1990-07-14T07:00:00.000Z",
    "gender": "female",
    "hundredths_under_barrier": 510,
    "index": 187,
    "location": "Oslo",
    "name": "Gina Procaccio",
    "readable_date": "7/14/1990",
    "result": "4:24.9"
  },
  {
    "catagory_index": "172",
    "category_index": 172,
    "date": "1991-01-25T08:00:00.000Z",
    "gender": "male",
    "hundredths_under_barrier": 220,
    "index": 188,
    "location": "Fayetteville",
    "name": "Matt Taylor",
    "readable_date": "1/25/1991",
    "result": "3:57.8"
  },
  {
    "catagory_index": "173",
    "category_index": 173,
    "date": "1991-02-01T08:00:00.000Z",
    "gender": "male",
    "hundredths_under_barrier": 130,
    "index": 189,
    "location": "New York",
    "name": "Bill Burke",
    "readable_date": "2/1/1991",
    "result": "3:58.7"
  },
  {
    "catagory_index": "174",
    "category_index": 174,
    "date": "1991-02-16T08:00:00.000Z",
    "gender": "male",
    "hundredths_under_barrier": 130,
    "index": 190,
    "location": "Boston",
    "name": "Mark Deady",
    "readable_date": "2/16/1991",
    "result": "3:58.7"
  },
  {
    "catagory_index": "175",
    "category_index": 175,
    "date": "1991-02-16T08:00:00.000Z",
    "gender": "male",
    "hundredths_under_barrier": 130,
    "index": 191,
    "location": "Boston",
    "name": "Charles Marsala",
    "readable_date": "2/16/1991",
    "result": "3:58.7"
  },
  {
    "catagory_index": "176",
    "category_index": 176,
    "date": "1991-02-16T08:00:00.000Z",
    "gender": "male",
    "hundredths_under_barrier": 110,
    "index": 192,
    "location": "Boston",
    "name": "Mike Michno",
    "readable_date": "2/16/1991",
    "result": "3:58.9"
  },
  {
    "catagory_index": "177",
    "category_index": 177,
    "date": "1991-02-16T08:00:00.000Z",
    "gender": "male",
    "hundredths_under_barrier": 10,
    "index": 193,
    "location": "Boston",
    "name": "Bill Rathbun",
    "readable_date": "2/16/1991",
    "result": "3:59.9"
  },
  {
    "catagory_index": "178",
    "category_index": 178,
    "date": "1991-03-09T08:00:00.000Z",
    "gender": "male",
    "hundredths_under_barrier": 190,
    "index": 194,
    "location": "Indianapolis",
    "name": "Bob Kennedy",
    "readable_date": "3/9/1991",
    "result": "3:58.1"
  },
  {
    "catagory_index": "179",
    "category_index": 179,
    "date": "1991-03-09T08:00:00.000Z",
    "gender": "male",
    "hundredths_under_barrier": 150,
    "index": 195,
    "location": "Indianapolis",
    "name": "John Trautmann",
    "readable_date": "3/9/1991",
    "result": "3:58.5"
  },
  {
    "catagory_index": "180",
    "category_index": 180,
    "date": "1991-03-30T08:00:00.000Z",
    "gender": "male",
    "hundredths_under_barrier": 80,
    "index": 196,
    "location": "Stanford",
    "name": "Matt Giusto",
    "readable_date": "3/30/1991",
    "result": "3:59.2"
  },
  {
    "catagory_index": "181",
    "category_index": 181,
    "date": "1991-06-09T07:00:00.000Z",
    "gender": "male",
    "hundredths_under_barrier": 90,
    "index": 197,
    "location": "Dedham",
    "name": "Gerry Donakowski",
    "readable_date": "6/9/1991",
    "result": "3:59.1"
  },
  {
    "catagory_index": "182",
    "category_index": 182,
    "date": "1991-07-01T07:00:00.000Z",
    "gender": "male",
    "hundredths_under_barrier": 440,
    "index": 198,
    "location": "Villeneuve-d’Ascq",
    "name": "Terrance Herrington",
    "readable_date": "7/1/1991",
    "result": "3:55.6"
  },
  {
    "catagory_index": "183",
    "category_index": 183,
    "date": "1991-07-01T07:00:00.000Z",
    "gender": "male",
    "hundredths_under_barrier": 230,
    "index": 199,
    "location": "Villeneuve-d’Ascq",
    "name": "Christian Cushing-Murray",
    "readable_date": "7/1/1991",
    "result": "3:57.7"
  },
  {
    "catagory_index": "18",
    "category_index": 18,
    "date": "1991-07-06T07:00:00.000Z",
    "gender": "female",
    "hundredths_under_barrier": 40,
    "index": 200,
    "location": "Oslo",
    "name": "Annette Peters",
    "readable_date": "7/6/1991",
    "result": "4:29.6"
  },
  {
    "catagory_index": "184",
    "category_index": 184,
    "date": "1992-03-14T08:00:00.000Z",
    "gender": "male",
    "hundredths_under_barrier": 70,
    "index": 201,
    "location": "Birmingham",
    "name": "Len Sitko",
    "readable_date": "3/14/1992",
    "result": "3:59.3"
  },
  {
    "catagory_index": "185",
    "category_index": 185,
    "date": "1992-04-04T08:00:00.000Z",
    "gender": "male",
    "hundredths_under_barrier": 100,
    "index": 202,
    "location": "Fresno",
    "name": "Ernie Freer",
    "readable_date": "4/4/1992",
    "result": "3:59.0"
  },
  {
    "catagory_index": "186",
    "category_index": 186,
    "date": "1992-07-04T07:00:00.000Z",
    "gender": "male",
    "hundredths_under_barrier": 670,
    "index": 203,
    "location": "Oslo",
    "name": "Steve Holman",
    "readable_date": "7/4/1992",
    "result": "3:53.3"
  },
  {
    "catagory_index": "19",
    "category_index": 19,
    "date": "1992-08-14T07:00:00.000Z",
    "gender": "female",
    "hundredths_under_barrier": 450,
    "index": 204,
    "location": "Sheffield",
    "name": "Shelly Steely",
    "readable_date": "8/14/1992",
    "result": "4:25.5"
  },
  {
    "catagory_index": "187",
    "category_index": 187,
    "date": "1992-08-31T07:00:00.000Z",
    "gender": "male",
    "hundredths_under_barrier": 40,
    "index": 205,
    "location": "Belfast",
    "name": "Paul Vandegrift",
    "readable_date": "8/31/1992",
    "result": "3:59.6"
  },
  {
    "catagory_index": "188",
    "category_index": 188,
    "date": "1993-02-27T08:00:00.000Z",
    "gender": "male",
    "hundredths_under_barrier": 30,
    "index": 206,
    "location": "Boston",
    "name": "Erik Nedeau",
    "readable_date": "2/27/1993",
    "result": "3:59.7"
  },
  {
    "catagory_index": "189",
    "category_index": 189,
    "date": "1993-05-15T07:00:00.000Z",
    "gender": "male",
    "hundredths_under_barrier": 40,
    "index": 207,
    "location": "San Francisco",
    "name": "Aaron Ramirez",
    "readable_date": "5/15/1993",
    "result": "3:59.6"
  },
  {
    "catagory_index": "190",
    "category_index": 190,
    "date": "1993-05-15T07:00:00.000Z",
    "gender": "male",
    "hundredths_under_barrier": 30,
    "index": 208,
    "location": "San Francisco",
    "name": "Jim Sorensen",
    "readable_date": "5/15/1993",
    "result": "3:59.7"
  },
  {
    "catagory_index": "191",
    "category_index": 191,
    "date": "1993-06-05T07:00:00.000Z",
    "gender": "male",
    "hundredths_under_barrier": 200,
    "index": 209,
    "location": "Eugene",
    "name": "Ronnie Harris",
    "readable_date": "6/5/1993",
    "result": "3:58.0"
  },
  {
    "catagory_index": "192",
    "category_index": 192,
    "date": "1993-06-05T07:00:00.000Z",
    "gender": "male",
    "hundredths_under_barrier": 180,
    "index": 210,
    "location": "Eugene",
    "name": "Bob Lesko",
    "readable_date": "6/5/1993",
    "result": "3:58.2"
  },
  {
    "catagory_index": "193",
    "category_index": 193,
    "date": "1993-06-05T07:00:00.000Z",
    "gender": "male",
    "hundredths_under_barrier": 120,
    "index": 211,
    "location": "Eugene",
    "name": "Danny Maas",
    "readable_date": "6/5/1993",
    "result": "3:58.8"
  },
  {
    "catagory_index": "20",
    "category_index": 20,
    "date": "1993-06-24T07:00:00.000Z",
    "gender": "female",
    "hundredths_under_barrier": 300,
    "index": 212,
    "location": "Los Gatos",
    "name": "Ceci St. Geme",
    "readable_date": "6/24/1993",
    "result": "4:27.0"
  },
  {
    "catagory_index": "194",
    "category_index": 194,
    "date": "1993-07-10T07:00:00.000Z",
    "gender": "male",
    "hundredths_under_barrier": 280,
    "index": 213,
    "location": "Oslo",
    "name": "Mark Dailey",
    "readable_date": "7/10/1993",
    "result": "3:57.2"
  },
  {
    "catagory_index": "195",
    "category_index": 195,
    "date": "1994-01-28T08:00:00.000Z",
    "gender": "male",
    "hundredths_under_barrier": 10,
    "index": 214,
    "location": "Boston",
    "name": "Mark Sivieri",
    "readable_date": "1/28/1994",
    "result": "3:59.9"
  },
  {
    "catagory_index": "196",
    "category_index": 196,
    "date": "1994-02-05T08:00:00.000Z",
    "gender": "male",
    "hundredths_under_barrier": 70,
    "index": 215,
    "location": "Notre Dame",
    "name": "Dave Wittman",
    "readable_date": "2/5/1994",
    "result": "3:59.3"
  },
  {
    "catagory_index": "197",
    "category_index": 197,
    "date": "1994-06-04T07:00:00.000Z",
    "gender": "male",
    "hundredths_under_barrier": 260,
    "index": 216,
    "location": "Eugene",
    "name": "Buck Jones",
    "readable_date": "6/4/1994",
    "result": "3:57.4"
  },
  {
    "catagory_index": "198",
    "category_index": 198,
    "date": "1994-06-04T07:00:00.000Z",
    "gender": "male",
    "hundredths_under_barrier": 250,
    "index": 217,
    "location": "Eugene",
    "name": "Shannon Lemora",
    "readable_date": "6/4/1994",
    "result": "3:57.5"
  },
  {
    "catagory_index": "199",
    "category_index": 199,
    "date": "1994-06-04T07:00:00.000Z",
    "gender": "male",
    "hundredths_under_barrier": 170,
    "index": 218,
    "location": "Eugene",
    "name": "Benny McIntosh",
    "readable_date": "6/4/1994",
    "result": "3:58.3"
  },
  {
    "catagory_index": "200",
    "category_index": 200,
    "date": "1994-06-04T07:00:00.000Z",
    "gender": "male",
    "hundredths_under_barrier": 80,
    "index": 219,
    "location": "Eugene",
    "name": "Chris Katon",
    "readable_date": "6/4/1994",
    "result": "3:59.2"
  },
  {
    "catagory_index": "201",
    "category_index": 201,
    "date": "1994-06-04T07:00:00.000Z",
    "gender": "male",
    "hundredths_under_barrier": 70,
    "index": 220,
    "location": "Eugene",
    "name": "Jon Warren",
    "readable_date": "6/4/1994",
    "result": "3:59.3"
  },
  {
    "catagory_index": "202",
    "category_index": 202,
    "date": "1994-06-04T07:00:00.000Z",
    "gender": "male",
    "hundredths_under_barrier": 20,
    "index": 221,
    "location": "Eugene",
    "name": "Jim Howarth",
    "readable_date": "6/4/1994",
    "result": "3:59.8"
  },
  {
    "catagory_index": "203",
    "category_index": 203,
    "date": "1994-06-25T07:00:00.000Z",
    "gender": "male",
    "hundredths_under_barrier": 80,
    "index": 222,
    "location": "Cork",
    "name": "Shane Healy",
    "readable_date": "6/25/1994",
    "result": "3:59.2"
  },
  {
    "catagory_index": "204",
    "category_index": 204,
    "date": "1995-01-28T08:00:00.000Z",
    "gender": "male",
    "hundredths_under_barrier": 10,
    "index": 223,
    "location": "Johnson City",
    "name": "Brian Hyde",
    "readable_date": "1/28/1995",
    "result": "3:59.9"
  },
  {
    "catagory_index": "205",
    "category_index": 205,
    "date": "1995-02-04T08:00:00.000Z",
    "gender": "male",
    "hundredths_under_barrier": 270,
    "index": 224,
    "location": "Notre Dame",
    "name": "Paul McMullen",
    "readable_date": "2/4/1995",
    "result": "3:57.3"
  },
  {
    "catagory_index": "206",
    "category_index": 206,
    "date": "1995-02-11T08:00:00.000Z",
    "gender": "male",
    "hundredths_under_barrier": 160,
    "index": 225,
    "location": "Los Angeles",
    "name": "Jason Pyrah",
    "readable_date": "2/11/1995",
    "result": "3:58.4"
  },
  {
    "catagory_index": "21",
    "category_index": 21,
    "date": "1995-04-03T07:00:00.000Z",
    "gender": "female",
    "hundredths_under_barrier": 350,
    "index": 226,
    "location": "Atlanta",
    "name": "Regina Jacobs",
    "readable_date": "4/3/1995",
    "result": "4:26.5"
  },
  {
    "catagory_index": "207",
    "category_index": 207,
    "date": "1995-04-29T07:00:00.000Z",
    "gender": "male",
    "hundredths_under_barrier": 90,
    "index": 227,
    "location": "Philadelphia",
    "name": "Brad Sumner",
    "readable_date": "4/29/1995",
    "result": "3:59.1"
  },
  {
    "catagory_index": "208",
    "category_index": 208,
    "date": "1995-04-29T07:00:00.000Z",
    "gender": "male",
    "hundredths_under_barrier": 20,
    "index": 228,
    "location": "Philadelphia",
    "name": "Tom Nohilly",
    "readable_date": "4/29/1995",
    "result": "3:59.8"
  },
  {
    "catagory_index": "209",
    "category_index": 209,
    "date": "1995-06-04T07:00:00.000Z",
    "gender": "male",
    "hundredths_under_barrier": 380,
    "index": 229,
    "location": "Eugene",
    "name": "Gordon Johnson",
    "readable_date": "6/4/1995",
    "result": "3:56.2"
  },
  {
    "catagory_index": "210",
    "category_index": 210,
    "date": "1996-02-10T08:00:00.000Z",
    "gender": "male",
    "hundredths_under_barrier": 120,
    "index": 230,
    "location": "Allston",
    "name": "Matt Holthaus",
    "readable_date": "2/10/1996",
    "result": "3:58.8"
  },
  {
    "catagory_index": "211",
    "category_index": 211,
    "date": "1996-04-20T07:00:00.000Z",
    "gender": "male",
    "hundredths_under_barrier": 80,
    "index": 231,
    "location": "Lawrence",
    "name": "Michael Cox",
    "readable_date": "4/20/1996",
    "result": "3:59.2"
  },
  {
    "catagory_index": "212",
    "category_index": 212,
    "date": "1997-02-01T08:00:00.000Z",
    "gender": "male",
    "hundredths_under_barrier": 60,
    "index": 232,
    "location": "Annapolis",
    "name": "Dan Browne",
    "readable_date": "2/1/1997",
    "result": "3:59.4"
  },
  {
    "catagory_index": "213",
    "category_index": 213,
    "date": "1997-03-07T08:00:00.000Z",
    "gender": "male",
    "hundredths_under_barrier": 30,
    "index": 233,
    "location": "Indianapolis",
    "name": "Corey Ihmels",
    "readable_date": "3/7/1997",
    "result": "3:59.7"
  },
  {
    "catagory_index": "214",
    "category_index": 214,
    "date": "1997-05-11T07:00:00.000Z",
    "gender": "male",
    "hundredths_under_barrier": 180,
    "index": 234,
    "location": "Portland",
    "name": "Alan Culpepper",
    "readable_date": "5/11/1997",
    "result": "3:58.2"
  },
  {
    "catagory_index": "215",
    "category_index": 215,
    "date": "1997-05-11T07:00:00.000Z",
    "gender": "male",
    "hundredths_under_barrier": 140,
    "index": 235,
    "location": "Portland",
    "name": "Richie Boulet",
    "readable_date": "5/11/1997",
    "result": "3:58.6"
  },
  {
    "catagory_index": "216",
    "category_index": 216,
    "date": "1997-05-14T07:00:00.000Z",
    "gender": "male",
    "hundredths_under_barrier": 240,
    "index": 236,
    "location": "Haverford",
    "name": "Karl Paranya",
    "readable_date": "5/14/1997",
    "result": "3:57.6"
  },
  {
    "catagory_index": "217",
    "category_index": 217,
    "date": "1997-05-27T07:00:00.000Z",
    "gender": "male",
    "hundredths_under_barrier": 80,
    "index": 237,
    "location": "Stanford",
    "name": "Jamey Harris",
    "readable_date": "5/27/1997",
    "result": "3:59.2"
  },
  {
    "catagory_index": "22",
    "category_index": 22,
    "date": "1997-07-09T07:00:00.000Z",
    "gender": "female",
    "hundredths_under_barrier": 310,
    "index": 238,
    "location": "Linz",
    "name": "Juli Henner",
    "readable_date": "7/9/1997",
    "result": "4:26.9"
  },
  {
    "catagory_index": "23",
    "category_index": 23,
    "date": "1997-07-09T07:00:00.000Z",
    "gender": "female",
    "hundredths_under_barrier": 230,
    "index": 239,
    "location": "Linz",
    "name": "Amy Wickus",
    "readable_date": "7/9/1997",
    "result": "4:27.7"
  },
  {
    "catagory_index": "218",
    "category_index": 218,
    "date": "1997-07-16T07:00:00.000Z",
    "gender": "male",
    "hundredths_under_barrier": 570,
    "index": 240,
    "location": "Nice",
    "name": "Marc Davis",
    "readable_date": "7/16/1997",
    "result": "3:54.3"
  },
  {
    "catagory_index": "219",
    "category_index": 219,
    "date": "1997-08-16T07:00:00.000Z",
    "gender": "male",
    "hundredths_under_barrier": 20,
    "index": 241,
    "location": "Falmouth",
    "name": "Darin Shearer",
    "readable_date": "8/16/1997",
    "result": "3:59.8"
  },
  {
    "catagory_index": "220",
    "category_index": 220,
    "date": "1998-02-07T08:00:00.000Z",
    "gender": "male",
    "hundredths_under_barrier": 140,
    "index": 242,
    "location": "Gainesville",
    "name": "David Krummenacker",
    "readable_date": "2/7/1998",
    "result": "3:58.6"
  },
  {
    "catagory_index": "221",
    "category_index": 221,
    "date": "1998-02-07T08:00:00.000Z",
    "gender": "male",
    "hundredths_under_barrier": 30,
    "index": 243,
    "location": "Ames",
    "name": "Ryan Travis",
    "readable_date": "2/7/1998",
    "result": "3:59.7"
  },
  {
    "catagory_index": "222",
    "category_index": 222,
    "date": "1998-02-13T08:00:00.000Z",
    "gender": "male",
    "hundredths_under_barrier": 40,
    "index": 244,
    "location": "New York",
    "name": "Seneca Lassiter",
    "readable_date": "2/13/1998",
    "result": "3:59.6"
  },
  {
    "catagory_index": "223",
    "category_index": 223,
    "date": "1998-02-14T08:00:00.000Z",
    "gender": "male",
    "hundredths_under_barrier": 10,
    "index": 245,
    "location": "Boston",
    "name": "Brian Gallagher",
    "readable_date": "2/14/1998",
    "result": "3:59.9"
  },
  {
    "catagory_index": "224",
    "category_index": 224,
    "date": "1998-04-19T07:00:00.000Z",
    "gender": "male",
    "hundredths_under_barrier": 70,
    "index": 246,
    "location": "Walnut",
    "name": "Gabe Jennings",
    "readable_date": "4/19/1998",
    "result": "3:59.3"
  },
  {
    "catagory_index": "225",
    "category_index": 225,
    "date": "1998-07-04T07:00:00.000Z",
    "gender": "male",
    "hundredths_under_barrier": 120,
    "index": 247,
    "location": "Brunswick",
    "name": "Brian Baker",
    "readable_date": "7/4/1998",
    "result": "3:58.8"
  },
  {
    "catagory_index": "226",
    "category_index": 226,
    "date": "1998-07-04T07:00:00.000Z",
    "gender": "male",
    "hundredths_under_barrier": 70,
    "index": 248,
    "location": "Brunswick",
    "name": "Michael Stember",
    "readable_date": "7/4/1998",
    "result": "3:59.3"
  },
  {
    "catagory_index": "227",
    "category_index": 227,
    "date": "1998-07-04T07:00:00.000Z",
    "gender": "male",
    "hundredths_under_barrier": 20,
    "index": 249,
    "location": "Brunswick",
    "name": "Scott Anderson",
    "readable_date": "7/4/1998",
    "result": "3:59.8"
  },
  {
    "catagory_index": "24",
    "category_index": 24,
    "date": "1998-07-20T07:00:00.000Z",
    "gender": "female",
    "hundredths_under_barrier": 30,
    "index": 250,
    "location": "Uniondale",
    "name": "Alisa Harvey",
    "readable_date": "7/20/1998",
    "result": "4:29.7"
  },
  {
    "catagory_index": "228",
    "category_index": 228,
    "date": "1999-01-16T08:00:00.000Z",
    "gender": "male",
    "hundredths_under_barrier": 350,
    "index": 251,
    "location": "Wanganui",
    "name": "Bryan Berryhill",
    "readable_date": "1/16/1999",
    "result": "3:56.5"
  },
  {
    "catagory_index": "229",
    "category_index": 229,
    "date": "1999-02-06T08:00:00.000Z",
    "gender": "male",
    "hundredths_under_barrier": 60,
    "index": 252,
    "location": "Notre Dame",
    "name": "Tim Broe",
    "readable_date": "2/6/1999",
    "result": "3:59.4"
  },
  {
    "catagory_index": "230",
    "category_index": 230,
    "date": "1999-02-06T08:00:00.000Z",
    "gender": "male",
    "hundredths_under_barrier": 130,
    "index": 253,
    "location": "Ames",
    "name": "Jonathon Riley",
    "readable_date": "2/6/1999",
    "result": "3:58.7"
  },
  {
    "catagory_index": "231",
    "category_index": 231,
    "date": "1999-05-15T07:00:00.000Z",
    "gender": "male",
    "hundredths_under_barrier": 240,
    "index": 254,
    "location": "Eugene",
    "name": "Adam Goucher",
    "readable_date": "5/15/1999",
    "result": "3:57.6"
  },
  {
    "catagory_index": "25",
    "category_index": 25,
    "date": "1999-07-17T07:00:00.000Z",
    "gender": "female",
    "hundredths_under_barrier": 230,
    "index": 255,
    "location": "Nice",
    "name": "Amy Rudolph",
    "readable_date": "7/17/1999",
    "result": "4:27.7"
  },
  {
    "catagory_index": "26",
    "category_index": 26,
    "date": "1999-07-17T07:00:00.000Z",
    "gender": "female",
    "hundredths_under_barrier": 160,
    "index": 256,
    "location": "Nice",
    "name": "Sarah Thorsett",
    "readable_date": "7/17/1999",
    "result": "4:28.4"
  },
  {
    "catagory_index": "232",
    "category_index": 232,
    "date": "2000-01-29T08:00:00.000Z",
    "gender": "male",
    "hundredths_under_barrier": 160,
    "index": 257,
    "location": "Boston",
    "name": "Jason Lunn",
    "readable_date": "1/29/2000",
    "result": "3:58.4"
  },
  {
    "catagory_index": "233",
    "category_index": 233,
    "date": "2000-02-12T08:00:00.000Z",
    "gender": "male",
    "hundredths_under_barrier": 60,
    "index": 258,
    "location": "Fayetteville",
    "name": "Rich Kenah",
    "readable_date": "2/12/2000",
    "result": "3:59.4"
  },
  {
    "catagory_index": "234",
    "category_index": 234,
    "date": "2000-04-16T07:00:00.000Z",
    "gender": "male",
    "hundredths_under_barrier": 70,
    "index": 259,
    "location": "Walnut",
    "name": "Dwight Davis",
    "readable_date": "4/16/2000",
    "result": "3:59.3"
  },
  {
    "catagory_index": "235",
    "category_index": 235,
    "date": "2000-04-29T07:00:00.000Z",
    "gender": "male",
    "hundredths_under_barrier": 80,
    "index": 260,
    "location": "Philadelphia",
    "name": "Sam Gabremariam",
    "readable_date": "4/29/2000",
    "result": "3:59.2"
  },
  {
    "catagory_index": "236",
    "category_index": 236,
    "date": "2000-05-13T07:00:00.000Z",
    "gender": "male",
    "hundredths_under_barrier": 60,
    "index": 261,
    "location": "Eugene",
    "name": "Steve Fein",
    "readable_date": "5/13/2000",
    "result": "3:59.4"
  },
  {
    "catagory_index": "237",
    "category_index": 237,
    "date": "2000-05-13T07:00:00.000Z",
    "gender": "male",
    "hundredths_under_barrier": 10,
    "index": 262,
    "location": "Eugene",
    "name": "Mike Miller",
    "readable_date": "5/13/2000",
    "result": "3:59.9"
  },
  {
    "catagory_index": "238",
    "category_index": 238,
    "date": "2001-01-20T08:00:00.000Z",
    "gender": "male",
    "hundredths_under_barrier": 10,
    "index": 263,
    "location": "New York City",
    "name": "Alan Webb",
    "readable_date": "1/20/2001",
    "result": "3:59.9"
  },
  {
    "catagory_index": "239",
    "category_index": 239,
    "date": "2001-02-04T08:00:00.000Z",
    "gender": "male",
    "hundredths_under_barrier": 90,
    "index": 264,
    "location": "Roxbury Crossing",
    "name": "Dan Wilson",
    "readable_date": "2/4/2001",
    "result": "3:59.1"
  },
  {
    "catagory_index": "240",
    "category_index": 240,
    "date": "2001-02-10T08:00:00.000Z",
    "gender": "male",
    "hundredths_under_barrier": 40,
    "index": 265,
    "location": "Fayetteville",
    "name": "Sharif Karie",
    "readable_date": "2/10/2001",
    "result": "3:59.6"
  },
  {
    "catagory_index": "241",
    "category_index": 241,
    "date": "2001-03-10T08:00:00.000Z",
    "gender": "male",
    "hundredths_under_barrier": 150,
    "index": 266,
    "location": "Fayetteville",
    "name": "Charlie Gruber",
    "readable_date": "3/10/2001",
    "result": "3:58.5"
  },
  {
    "catagory_index": "242",
    "category_index": 242,
    "date": "2001-03-10T08:00:00.000Z",
    "gender": "male",
    "hundredths_under_barrier": 10,
    "index": 267,
    "location": "Fayetteville",
    "name": "Jeremy Tolman",
    "readable_date": "3/10/2001",
    "result": "3:59.9"
  },
  {
    "catagory_index": "243",
    "category_index": 243,
    "date": "2001-04-28T07:00:00.000Z",
    "gender": "male",
    "hundredths_under_barrier": 60,
    "index": 268,
    "location": "Des Moines",
    "name": "Andy Downin",
    "readable_date": "4/28/2001",
    "result": "3:59.4"
  },
  {
    "catagory_index": "244",
    "category_index": 244,
    "date": "2001-05-12T07:00:00.000Z",
    "gender": "male",
    "hundredths_under_barrier": 60,
    "index": 269,
    "location": "Princeton",
    "name": "Clay Schwabe",
    "readable_date": "5/12/2001",
    "result": "3:59.4"
  },
  {
    "catagory_index": "245",
    "category_index": 245,
    "date": "2001-06-03T07:00:00.000Z",
    "gender": "male",
    "hundredths_under_barrier": 300,
    "index": 270,
    "location": "Portland",
    "name": "Ibrahim Aden",
    "readable_date": "6/3/2001",
    "result": "3:57.0"
  },
  {
    "catagory_index": "246",
    "category_index": 246,
    "date": "2002-03-01T08:00:00.000Z",
    "gender": "male",
    "hundredths_under_barrier": 20,
    "index": 271,
    "location": "New York City",
    "name": "Jeremy Huffman",
    "readable_date": "3/1/2002",
    "result": "3:59.8"
  },
  {
    "catagory_index": "247",
    "category_index": 247,
    "date": "2002-03-02T08:00:00.000Z",
    "gender": "male",
    "hundredths_under_barrier": 110,
    "index": 272,
    "location": "Seattle",
    "name": "Eric Garner",
    "readable_date": "3/2/2002",
    "result": "3:58.9"
  },
  {
    "catagory_index": "248",
    "category_index": 248,
    "date": "2002-03-02T08:00:00.000Z",
    "gender": "male",
    "hundredths_under_barrier": 50,
    "index": 273,
    "location": "Seattle",
    "name": "Donald Sage",
    "readable_date": "3/2/2002",
    "result": "3:59.5"
  },
  {
    "catagory_index": "249",
    "category_index": 249,
    "date": "2002-03-02T08:00:00.000Z",
    "gender": "male",
    "hundredths_under_barrier": 40,
    "index": 274,
    "location": "Seattle",
    "name": "Brandon Strong",
    "readable_date": "3/2/2002",
    "result": "3:59.6"
  },
  {
    "catagory_index": "250",
    "category_index": 250,
    "date": "2002-03-02T08:00:00.000Z",
    "gender": "male",
    "hundredths_under_barrier": 20,
    "index": 275,
    "location": "Seattle",
    "name": "Ray Hughes",
    "readable_date": "3/2/2002",
    "result": "3:59.8"
  },
  {
    "catagory_index": "251",
    "category_index": 251,
    "date": "2002-05-26T07:00:00.000Z",
    "gender": "male",
    "hundredths_under_barrier": 240,
    "index": 276,
    "location": "Eugene",
    "name": "Matt Lane",
    "readable_date": "5/26/2002",
    "result": "3:57.6"
  },
  {
    "catagory_index": "252",
    "category_index": 252,
    "date": "2002-06-08T07:00:00.000Z",
    "gender": "male",
    "hundredths_under_barrier": 10,
    "index": 277,
    "location": "Stanford",
    "name": "Bolota Asmerom",
    "readable_date": "6/8/2002",
    "result": "3:59.9"
  },
  {
    "catagory_index": "253",
    "category_index": 253,
    "date": "2003-02-08T08:00:00.000Z",
    "gender": "male",
    "hundredths_under_barrier": 140,
    "index": 278,
    "location": "Lexington",
    "name": "Rob Myers",
    "readable_date": "2/8/2003",
    "result": "3:58.6"
  },
  {
    "catagory_index": "254",
    "category_index": 254,
    "date": "2003-02-08T08:00:00.000Z",
    "gender": "male",
    "hundredths_under_barrier": 220,
    "index": 279,
    "location": "Notre Dame",
    "name": "Luke Watson",
    "readable_date": "2/8/2003",
    "result": "3:57.8"
  },
  {
    "catagory_index": "255",
    "category_index": 255,
    "date": "2003-02-08T08:00:00.000Z",
    "gender": "male",
    "hundredths_under_barrier": 180,
    "index": 280,
    "location": "Notre Dame",
    "name": "Ian Connor",
    "readable_date": "2/8/2003",
    "result": "3:58.2"
  },
  {
    "catagory_index": "256",
    "category_index": 256,
    "date": "2003-02-15T08:00:00.000Z",
    "gender": "male",
    "hundredths_under_barrier": 10,
    "index": 281,
    "location": "New York City",
    "name": "Jason Long",
    "readable_date": "2/15/2003",
    "result": "3:59.9"
  },
  {
    "catagory_index": "257",
    "category_index": 257,
    "date": "2003-03-08T08:00:00.000Z",
    "gender": "male",
    "hundredths_under_barrier": 100,
    "index": 282,
    "location": "Seattle",
    "name": "Grant Robison",
    "readable_date": "3/8/2003",
    "result": "3:59.0"
  },
  {
    "catagory_index": "27",
    "category_index": 27,
    "date": "2003-08-09T07:00:00.000Z",
    "gender": "female",
    "hundredths_under_barrier": 90,
    "index": 283,
    "location": "Falmouth",
    "name": "Mary Jane Harrelson",
    "readable_date": "8/9/2003",
    "result": "4:29.1"
  },
  {
    "catagory_index": "258",
    "category_index": 258,
    "date": "2004-02-07T08:00:00.000Z",
    "gender": "male",
    "hundredths_under_barrier": 20,
    "index": 284,
    "location": "Notre Dame",
    "name": "Jordan Desilets",
    "readable_date": "2/7/2004",
    "result": "3:59.8"
  },
  {
    "catagory_index": "259",
    "category_index": 259,
    "date": "2004-02-14T08:00:00.000Z",
    "gender": "male",
    "hundredths_under_barrier": 10,
    "index": 285,
    "location": "Seattle",
    "name": "Nathan Robison",
    "readable_date": "2/14/2004",
    "result": "3:59.9"
  },
  {
    "catagory_index": "260",
    "category_index": 260,
    "date": "2004-06-19T07:00:00.000Z",
    "gender": "male",
    "hundredths_under_barrier": 20,
    "index": 286,
    "location": "Eugene",
    "name": "Steve Slattery",
    "readable_date": "6/19/2004",
    "result": "3:59.8"
  },
  {
    "catagory_index": "261",
    "category_index": 261,
    "date": "2004-06-19T07:00:00.000Z",
    "gender": "male",
    "hundredths_under_barrier": 10,
    "index": 287,
    "location": "Eugene",
    "name": "Aaron Lanzel",
    "readable_date": "6/19/2004",
    "result": "3:59.9"
  },
  {
    "catagory_index": "262",
    "category_index": 262,
    "date": "2004-07-01T07:00:00.000Z",
    "gender": "male",
    "hundredths_under_barrier": 270,
    "index": 288,
    "location": "Burnaby",
    "name": "Said Ahmed",
    "readable_date": "7/1/2004",
    "result": "3:57.3"
  },
  {
    "catagory_index": "263",
    "category_index": 263,
    "date": "2004-07-01T07:00:00.000Z",
    "gender": "male",
    "hundredths_under_barrier": 180,
    "index": 289,
    "location": "Burnaby",
    "name": "Chris Estwanik",
    "readable_date": "7/1/2004",
    "result": "3:58.2"
  },
  {
    "catagory_index": "264",
    "category_index": 264,
    "date": "2004-07-30T07:00:00.000Z",
    "gender": "male",
    "hundredths_under_barrier": 230,
    "index": 290,
    "location": "London",
    "name": "Daniel Lincoln",
    "readable_date": "7/30/2004",
    "result": "3:57.7"
  },
  {
    "catagory_index": "265",
    "category_index": 265,
    "date": "2005-01-29T08:00:00.000Z",
    "gender": "male",
    "hundredths_under_barrier": 640,
    "index": 291,
    "location": "Roxbury Crossing",
    "name": "Bernard Lagat",
    "readable_date": "1/29/2005",
    "result": "3:53.6"
  },
  {
    "catagory_index": "266",
    "category_index": 266,
    "date": "2005-01-29T08:00:00.000Z",
    "gender": "male",
    "hundredths_under_barrier": 110,
    "index": 292,
    "location": "Roxbury Crossing",
    "name": "Scott McGowan",
    "readable_date": "1/29/2005",
    "result": "3:58.9"
  },
  {
    "catagory_index": "267",
    "category_index": 267,
    "date": "2005-02-05T08:00:00.000Z",
    "gender": "male",
    "hundredths_under_barrier": 360,
    "index": 293,
    "location": "Notre Dame",
    "name": "Sean Jefferson",
    "readable_date": "2/5/2005",
    "result": "3:56.4"
  },
  {
    "catagory_index": "268",
    "category_index": 268,
    "date": "2005-02-05T08:00:00.000Z",
    "gender": "male",
    "hundredths_under_barrier": 210,
    "index": 294,
    "location": "Notre Dame",
    "name": "John Jefferson",
    "readable_date": "2/5/2005",
    "result": "3:57.9"
  },
  {
    "catagory_index": "269",
    "category_index": 269,
    "date": "2005-02-26T08:00:00.000Z",
    "gender": "male",
    "hundredths_under_barrier": 10,
    "index": 295,
    "location": "Lincoln",
    "name": "Leo Manzano",
    "readable_date": "2/26/2005",
    "result": "3:59.9"
  },
  {
    "catagory_index": "270",
    "category_index": 270,
    "date": "2005-04-09T07:00:00.000Z",
    "gender": "male",
    "hundredths_under_barrier": 210,
    "index": 296,
    "location": "Westwood",
    "name": "Jon Rankin",
    "readable_date": "4/9/2005",
    "result": "3:57.9"
  },
  {
    "catagory_index": "271",
    "category_index": 271,
    "date": "2005-04-09T07:00:00.000Z",
    "gender": "male",
    "hundredths_under_barrier": 80,
    "index": 297,
    "location": "Westwood",
    "name": "Bryan Lindsay",
    "readable_date": "4/9/2005",
    "result": "3:59.2"
  },
  {
    "catagory_index": "272",
    "category_index": 272,
    "date": "2005-06-04T07:00:00.000Z",
    "gender": "male",
    "hundredths_under_barrier": 180,
    "index": 298,
    "location": "Nashville",
    "name": "Anthony Famiglietti",
    "readable_date": "6/4/2005",
    "result": "3:58.2"
  },
  {
    "catagory_index": "273",
    "category_index": 273,
    "date": "2006-01-14T08:00:00.000Z",
    "gender": "male",
    "hundredths_under_barrier": 90,
    "index": 299,
    "location": "Seattle",
    "name": "Sean O’Brien",
    "readable_date": "1/14/2006",
    "result": "3:59.1"
  },
  {
    "catagory_index": "274",
    "category_index": 274,
    "date": "2006-01-14T08:00:00.000Z",
    "gender": "male",
    "hundredths_under_barrier": 40,
    "index": 300,
    "location": "Seattle",
    "name": "Elliott Blount",
    "readable_date": "1/14/2006",
    "result": "3:59.6"
  },
  {
    "catagory_index": "275",
    "category_index": 275,
    "date": "2006-01-28T08:00:00.000Z",
    "gender": "male",
    "hundredths_under_barrier": 150,
    "index": 301,
    "location": "Roxbury Crossing",
    "name": "Chris Lukezic",
    "readable_date": "1/28/2006",
    "result": "3:58.5"
  },
  {
    "catagory_index": "276",
    "category_index": 276,
    "date": "2006-01-28T08:00:00.000Z",
    "gender": "male",
    "hundredths_under_barrier": 100,
    "index": 302,
    "location": "Roxbury Crossing",
    "name": "Ryan Kleimenhagen",
    "readable_date": "1/28/2006",
    "result": "3:59.0"
  },
  {
    "catagory_index": "28",
    "category_index": 28,
    "date": "2006-01-29T08:00:00.000Z",
    "gender": "female",
    "hundredths_under_barrier": 10,
    "index": 303,
    "location": "Boston",
    "name": "Treniere Clement",
    "readable_date": "1/29/2006",
    "result": "4:29.9"
  },
  {
    "catagory_index": "277",
    "category_index": 277,
    "date": "2006-02-10T08:00:00.000Z",
    "gender": "male",
    "hundredths_under_barrier": 30,
    "index": 304,
    "location": "Fayetteville",
    "name": "Russell Brown",
    "readable_date": "2/10/2006",
    "result": "3:59.7"
  },
  {
    "catagory_index": "278",
    "category_index": 278,
    "date": "2006-02-11T08:00:00.000Z",
    "gender": "male",
    "hundredths_under_barrier": 50,
    "index": 305,
    "location": "Seattle",
    "name": "Austin Abbott",
    "readable_date": "2/11/2006",
    "result": "3:59.5"
  },
  {
    "catagory_index": "279",
    "category_index": 279,
    "date": "2006-02-11T08:00:00.000Z",
    "gender": "male",
    "hundredths_under_barrier": 40,
    "index": 306,
    "location": "Seattle",
    "name": "Stephen Pifer",
    "readable_date": "2/11/2006",
    "result": "3:59.6"
  },
  {
    "catagory_index": "280",
    "category_index": 280,
    "date": "2006-03-04T08:00:00.000Z",
    "gender": "male",
    "hundredths_under_barrier": 40,
    "index": 307,
    "location": "Ames",
    "name": "Christian Smith",
    "readable_date": "3/4/2006",
    "result": "3:59.6"
  },
  {
    "catagory_index": "281",
    "category_index": 281,
    "date": "2006-03-04T08:00:00.000Z",
    "gender": "male",
    "hundredths_under_barrier": 70,
    "index": 308,
    "location": "Seattle",
    "name": "Michael McGrath",
    "readable_date": "3/4/2006",
    "result": "3:59.3"
  },
  {
    "catagory_index": "282",
    "category_index": 282,
    "date": "2006-05-04T07:00:00.000Z",
    "gender": "male",
    "hundredths_under_barrier": 90,
    "index": 309,
    "location": "Beaverton",
    "name": "Jason Jabaut",
    "readable_date": "5/4/2006",
    "result": "3:59.1"
  },
  {
    "catagory_index": "283",
    "category_index": 283,
    "date": "2006-05-06T07:00:00.000Z",
    "gender": "male",
    "hundredths_under_barrier": 360,
    "index": 310,
    "location": "Madison",
    "name": "Matt Tegenkamp",
    "readable_date": "5/6/2006",
    "result": "3:56.4"
  },
  {
    "catagory_index": "284",
    "category_index": 284,
    "date": "2006-05-06T07:00:00.000Z",
    "gender": "male",
    "hundredths_under_barrier": 220,
    "index": 311,
    "location": "Madison",
    "name": "Chris Solinsky",
    "readable_date": "5/6/2006",
    "result": "3:57.8"
  },
  {
    "catagory_index": "29",
    "category_index": 29,
    "date": "2006-08-12T07:00:00.000Z",
    "gender": "female",
    "hundredths_under_barrier": 200,
    "index": 312,
    "location": "Falmouth",
    "name": "Carrie Tollefson",
    "readable_date": "8/12/2006",
    "result": "4:28.0"
  },
  {
    "catagory_index": "30",
    "category_index": 30,
    "date": "2006-08-12T07:00:00.000Z",
    "gender": "female",
    "hundredths_under_barrier": 100,
    "index": 313,
    "location": "Falmouth",
    "name": "Erin Donohue",
    "readable_date": "8/12/2006",
    "result": "4:29.0"
  },
  {
    "catagory_index": "31",
    "category_index": 31,
    "date": "2006-08-12T07:00:00.000Z",
    "gender": "female",
    "hundredths_under_barrier": 40,
    "index": 314,
    "location": "Falmouth",
    "name": "Tiffany McWilliams",
    "readable_date": "8/12/2006",
    "result": "4:29.6"
  },
  {
    "catagory_index": "285",
    "category_index": 285,
    "date": "2007-01-13T08:00:00.000Z",
    "gender": "male",
    "hundredths_under_barrier": 330,
    "index": 315,
    "location": "Seattle",
    "name": "Nick Symmonds",
    "readable_date": "1/13/2007",
    "result": "3:56.7"
  },
  {
    "catagory_index": "286",
    "category_index": 286,
    "date": "2007-02-10T08:00:00.000Z",
    "gender": "male",
    "hundredths_under_barrier": 40,
    "index": 316,
    "location": "Seattle",
    "name": "Garrett Heath",
    "readable_date": "2/10/2007",
    "result": "3:59.6"
  },
  {
    "catagory_index": "287",
    "category_index": 287,
    "date": "2007-03-03T08:00:00.000Z",
    "gender": "male",
    "hundredths_under_barrier": 80,
    "index": 317,
    "location": "Ames",
    "name": "Blake Boldon",
    "readable_date": "3/3/2007",
    "result": "3:59.2"
  },
  {
    "catagory_index": "288",
    "category_index": 288,
    "date": "2007-03-31T07:00:00.000Z",
    "gender": "male",
    "hundredths_under_barrier": 250,
    "index": 318,
    "location": "Lynchburg",
    "name": "Josh McDougal",
    "readable_date": "3/31/2007",
    "result": "3:57.5"
  },
  {
    "catagory_index": "289",
    "category_index": 289,
    "date": "2007-04-28T07:00:00.000Z",
    "gender": "male",
    "hundredths_under_barrier": 140,
    "index": 319,
    "location": "Berkeley",
    "name": "David Torrence",
    "readable_date": "4/28/2007",
    "result": "3:58.6"
  },
  {
    "catagory_index": "290",
    "category_index": 290,
    "date": "2007-05-14T07:00:00.000Z",
    "gender": "male",
    "hundredths_under_barrier": 280,
    "index": 320,
    "location": "Swarthmore",
    "name": "Bobby Curtis",
    "readable_date": "5/14/2007",
    "result": "3:57.2"
  },
  {
    "catagory_index": "291",
    "category_index": 291,
    "date": "2007-05-14T07:00:00.000Z",
    "gender": "male",
    "hundredths_under_barrier": 40,
    "index": 321,
    "location": "Swarthmore",
    "name": "Michael Kerrigan",
    "readable_date": "5/14/2007",
    "result": "3:59.6"
  },
  {
    "catagory_index": "292",
    "category_index": 292,
    "date": "2007-06-02T07:00:00.000Z",
    "gender": "male",
    "hundredths_under_barrier": 130,
    "index": 322,
    "location": "Nashville",
    "name": "Jeff See",
    "readable_date": "6/2/2007",
    "result": "3:58.7"
  },
  {
    "catagory_index": "293",
    "category_index": 293,
    "date": "2007-06-02T07:00:00.000Z",
    "gender": "male",
    "hundredths_under_barrier": 60,
    "index": 323,
    "location": "Nashville",
    "name": "Jake Watson",
    "readable_date": "6/2/2007",
    "result": "3:59.4"
  },
  {
    "catagory_index": "294",
    "category_index": 294,
    "date": "2007-06-02T07:00:00.000Z",
    "gender": "male",
    "hundredths_under_barrier": 30,
    "index": 324,
    "location": "Nashville",
    "name": "Ben Gregory",
    "readable_date": "6/2/2007",
    "result": "3:59.7"
  },
  {
    "catagory_index": "295",
    "category_index": 295,
    "date": "2007-06-10T07:00:00.000Z",
    "gender": "male",
    "hundredths_under_barrier": 160,
    "index": 325,
    "location": "Beaverton",
    "name": "Sean Graham",
    "readable_date": "6/10/2007",
    "result": "3:58.4"
  },
  {
    "catagory_index": "296",
    "category_index": 296,
    "date": "2007-06-17T07:00:00.000Z",
    "gender": "male",
    "hundredths_under_barrier": 10,
    "index": 326,
    "location": "Cambridge",
    "name": "Ben True",
    "readable_date": "6/17/2007",
    "result": "3:59.9"
  },
  {
    "catagory_index": "297",
    "category_index": 297,
    "date": "2007-07-21T07:00:00.000Z",
    "gender": "male",
    "hundredths_under_barrier": 220,
    "index": 327,
    "location": "Brasschaat",
    "name": "Seth Summerside",
    "readable_date": "7/21/2007",
    "result": "3:57.8"
  },
  {
    "catagory_index": "298",
    "category_index": 298,
    "date": "2008-01-19T08:00:00.000Z",
    "gender": "male",
    "hundredths_under_barrier": 20,
    "index": 328,
    "location": "Seattle",
    "name": "Will Leer",
    "readable_date": "1/19/2008",
    "result": "3:59.8"
  },
  {
    "catagory_index": "299",
    "category_index": 299,
    "date": "2008-02-02T08:00:00.000Z",
    "gender": "male",
    "hundredths_under_barrier": 150,
    "index": 329,
    "location": "New Haven",
    "name": "Andrew Bumbalough",
    "readable_date": "2/2/2008",
    "result": "3:58.5"
  },
  {
    "catagory_index": "300",
    "category_index": 300,
    "date": "2008-02-02T08:00:00.000Z",
    "gender": "male",
    "hundredths_under_barrier": 60,
    "index": 330,
    "location": "Lexington",
    "name": "John Richardson",
    "readable_date": "2/2/2008",
    "result": "3:59.4"
  },
  {
    "catagory_index": "301",
    "category_index": 301,
    "date": "2008-02-02T08:00:00.000Z",
    "gender": "male",
    "hundredths_under_barrier": 400,
    "index": 331,
    "location": "Seattle",
    "name": "Steve Sherer",
    "readable_date": "2/2/2008",
    "result": "3:56.0"
  },
  {
    "catagory_index": "302",
    "category_index": 302,
    "date": "2008-02-02T08:00:00.000Z",
    "gender": "male",
    "hundredths_under_barrier": 80,
    "index": 332,
    "location": "Seattle",
    "name": "Kyle Perry",
    "readable_date": "2/2/2008",
    "result": "3:59.2"
  },
  {
    "catagory_index": "303",
    "category_index": 303,
    "date": "2008-02-02T08:00:00.000Z",
    "gender": "male",
    "hundredths_under_barrier": 20,
    "index": 333,
    "location": "Seattle",
    "name": "Kyle Alcorn",
    "readable_date": "2/2/2008",
    "result": "3:59.8"
  },
  {
    "catagory_index": "304",
    "category_index": 304,
    "date": "2008-02-09T08:00:00.000Z",
    "gender": "male",
    "hundredths_under_barrier": 60,
    "index": 334,
    "location": "Notre Dame",
    "name": "Jack Bolas",
    "readable_date": "2/9/2008",
    "result": "3:59.4"
  },
  {
    "catagory_index": "305",
    "category_index": 305,
    "date": "2008-02-09T08:00:00.000Z",
    "gender": "male",
    "hundredths_under_barrier": 20,
    "index": 335,
    "location": "Notre Dame",
    "name": "Jordan Fife",
    "readable_date": "2/9/2008",
    "result": "3:59.8"
  },
  {
    "catagory_index": "306",
    "category_index": 306,
    "date": "2008-02-09T08:00:00.000Z",
    "gender": "male",
    "hundredths_under_barrier": 10,
    "index": 336,
    "location": "Notre Dame",
    "name": "Brandon Bethke",
    "readable_date": "2/9/2008",
    "result": "3:59.9"
  },
  {
    "catagory_index": "32",
    "category_index": 32,
    "date": "2008-02-15T08:00:00.000Z",
    "gender": "female",
    "hundredths_under_barrier": 280,
    "index": 337,
    "location": "Fayetteville",
    "name": "Christin Wurth-Thomas",
    "readable_date": "2/15/2008",
    "result": "4:27.2"
  },
  {
    "catagory_index": "307",
    "category_index": 307,
    "date": "2008-03-08T08:00:00.000Z",
    "gender": "male",
    "hundredths_under_barrier": 150,
    "index": 338,
    "location": "Seattle",
    "name": "A.J. Acosta",
    "readable_date": "3/8/2008",
    "result": "3:58.5"
  },
  {
    "catagory_index": "308",
    "category_index": 308,
    "date": "2008-04-05T07:00:00.000Z",
    "gender": "male",
    "hundredths_under_barrier": 10,
    "index": 339,
    "location": "Austin",
    "name": "Darren Brown",
    "readable_date": "4/5/2008",
    "result": "3:59.9"
  },
  {
    "catagory_index": "309",
    "category_index": 309,
    "date": "2008-04-12T07:00:00.000Z",
    "gender": "male",
    "hundredths_under_barrier": 10,
    "index": 340,
    "location": "Westwood",
    "name": "Laef Barnes",
    "readable_date": "4/12/2008",
    "result": "3:59.9"
  },
  {
    "catagory_index": "310",
    "category_index": 310,
    "date": "2008-04-12T07:00:00.000Z",
    "gender": "male",
    "hundredths_under_barrier": 20,
    "index": 341,
    "location": "Chico",
    "name": "Scott Bauhs",
    "readable_date": "4/12/2008",
    "result": "3:59.8"
  },
  {
    "catagory_index": "311",
    "category_index": 311,
    "date": "2008-04-26T07:00:00.000Z",
    "gender": "male",
    "hundredths_under_barrier": 180,
    "index": 342,
    "location": "Eugene",
    "name": "Andrew Wheating",
    "readable_date": "4/26/2008",
    "result": "3:58.2"
  },
  {
    "catagory_index": "312",
    "category_index": 312,
    "date": "2008-06-08T07:00:00.000Z",
    "gender": "male",
    "hundredths_under_barrier": 600,
    "index": 343,
    "location": "Eugene",
    "name": "Lopez Lomong",
    "readable_date": "6/8/2008",
    "result": "3:54.0"
  },
  {
    "catagory_index": "33",
    "category_index": 33,
    "date": "2008-09-07T07:00:00.000Z",
    "gender": "female",
    "hundredths_under_barrier": 970,
    "index": 344,
    "location": "Rieti",
    "name": "Shannon Rowbury",
    "readable_date": "9/7/2008",
    "result": "4:20.3"
  },
  {
    "catagory_index": "34",
    "category_index": 34,
    "date": "2008-09-07T07:00:00.000Z",
    "gender": "female",
    "hundredths_under_barrier": 160,
    "index": 345,
    "location": "Rieti",
    "name": "Anna Willard",
    "readable_date": "9/7/2008",
    "result": "4:28.4"
  },
  {
    "catagory_index": "35",
    "category_index": 35,
    "date": "2008-09-07T07:00:00.000Z",
    "gender": "female",
    "hundredths_under_barrier": 110,
    "index": 346,
    "location": "Rieti",
    "name": "Lindsay Gallo",
    "readable_date": "9/7/2008",
    "result": "4:28.9"
  },
  {
    "catagory_index": "313",
    "category_index": 313,
    "date": "2009-01-24T08:00:00.000Z",
    "gender": "male",
    "hundredths_under_barrier": 350,
    "index": 347,
    "location": "Fayetteville",
    "name": "German Fernandez",
    "readable_date": "1/24/2009",
    "result": "3:56.5"
  },
  {
    "catagory_index": "314",
    "category_index": 314,
    "date": "2009-01-24T08:00:00.000Z",
    "gender": "male",
    "hundredths_under_barrier": 240,
    "index": 348,
    "location": "Fayetteville",
    "name": "Dorian Ulrey",
    "readable_date": "1/24/2009",
    "result": "3:57.6"
  },
  {
    "catagory_index": "315",
    "category_index": 315,
    "date": "2009-01-31T08:00:00.000Z",
    "gender": "male",
    "hundredths_under_barrier": 60,
    "index": 349,
    "location": "University Park",
    "name": "Liam Boylan-Pett",
    "readable_date": "1/31/2009",
    "result": "3:59.4"
  },
  {
    "catagory_index": "316",
    "category_index": 316,
    "date": "2009-02-07T08:00:00.000Z",
    "gender": "male",
    "hundredths_under_barrier": 260,
    "index": 350,
    "location": "Notre Dame",
    "name": "Shane Knoll",
    "readable_date": "2/7/2009",
    "result": "3:57.4"
  },
  {
    "catagory_index": "317",
    "category_index": 317,
    "date": "2009-02-07T08:00:00.000Z",
    "gender": "male",
    "hundredths_under_barrier": 110,
    "index": 351,
    "location": "Notre Dame",
    "name": "Justin Switzer",
    "readable_date": "2/7/2009",
    "result": "3:58.9"
  },
  {
    "catagory_index": "318",
    "category_index": 318,
    "date": "2009-02-07T08:00:00.000Z",
    "gender": "male",
    "hundredths_under_barrier": 90,
    "index": 352,
    "location": "Notre Dame",
    "name": "Jacob Boone",
    "readable_date": "2/7/2009",
    "result": "3:59.1"
  },
  {
    "catagory_index": "319",
    "category_index": 319,
    "date": "2009-02-14T08:00:00.000Z",
    "gender": "male",
    "hundredths_under_barrier": 210,
    "index": 353,
    "location": "Seattle",
    "name": "Matthew Centrowitz",
    "readable_date": "2/14/2009",
    "result": "3:57.9"
  },
  {
    "catagory_index": "36",
    "category_index": 36,
    "date": "2009-02-28T08:00:00.000Z",
    "gender": "female",
    "hundredths_under_barrier": 410,
    "index": 354,
    "location": "College Station",
    "name": "Jenny Barringer",
    "readable_date": "2/28/2009",
    "result": "4:25.9"
  },
  {
    "catagory_index": "320",
    "category_index": 320,
    "date": "2009-03-07T08:00:00.000Z",
    "gender": "male",
    "hundredths_under_barrier": 90,
    "index": 355,
    "location": "Notre Dame",
    "name": "Craig Miller",
    "readable_date": "3/7/2009",
    "result": "3:59.1"
  },
  {
    "catagory_index": "321",
    "category_index": 321,
    "date": "2009-03-07T08:00:00.000Z",
    "gender": "male",
    "hundredths_under_barrier": 210,
    "index": 356,
    "location": "Seattle",
    "name": "Galen Rupp",
    "readable_date": "3/7/2009",
    "result": "3:57.9"
  },
  {
    "catagory_index": "37",
    "category_index": 37,
    "date": "2009-03-14T07:00:00.000Z",
    "gender": "female",
    "hundredths_under_barrier": 30,
    "index": 357,
    "location": "College Station",
    "name": "Sarah Bowman",
    "readable_date": "3/14/2009",
    "result": "4:29.7"
  },
  {
    "catagory_index": "322",
    "category_index": 322,
    "date": "2009-04-25T07:00:00.000Z",
    "gender": "male",
    "hundredths_under_barrier": 380,
    "index": 358,
    "location": "Berkeley",
    "name": "Michael Coe",
    "readable_date": "4/25/2009",
    "result": "3:56.2"
  },
  {
    "catagory_index": "323",
    "category_index": 323,
    "date": "2009-04-25T07:00:00.000Z",
    "gender": "male",
    "hundredths_under_barrier": 110,
    "index": 359,
    "location": "Berkeley",
    "name": "Tommy Schmitz",
    "readable_date": "4/25/2009",
    "result": "3:58.9"
  },
  {
    "catagory_index": "324",
    "category_index": 324,
    "date": "2009-05-23T07:00:00.000Z",
    "gender": "male",
    "hundredths_under_barrier": 210,
    "index": 360,
    "location": "St. Louis",
    "name": "Derek Scott",
    "readable_date": "5/23/2009",
    "result": "3:57.9"
  },
  {
    "catagory_index": "325",
    "category_index": 325,
    "date": "2009-05-28T07:00:00.000Z",
    "gender": "male",
    "hundredths_under_barrier": 70,
    "index": 361,
    "location": "Beaverton",
    "name": "Tom Brooks",
    "readable_date": "5/28/2009",
    "result": "3:59.3"
  },
  {
    "catagory_index": "326",
    "category_index": 326,
    "date": "2009-06-06T07:00:00.000Z",
    "gender": "male",
    "hundredths_under_barrier": 20,
    "index": 362,
    "location": "Murfreesboro",
    "name": "Dan Strackeljahn",
    "readable_date": "6/6/2009",
    "result": "3:59.8"
  },
  {
    "catagory_index": "327",
    "category_index": 327,
    "date": "2009-06-07T07:00:00.000Z",
    "gender": "male",
    "hundredths_under_barrier": 560,
    "index": 363,
    "location": "Eugene",
    "name": "Evan Jager",
    "readable_date": "6/7/2009",
    "result": "3:54.4"
  },
  {
    "catagory_index": "328",
    "category_index": 328,
    "date": "2009-07-16T07:00:00.000Z",
    "gender": "male",
    "hundredths_under_barrier": 10,
    "index": 364,
    "location": "Eugene",
    "name": "Jordan McNamara",
    "readable_date": "7/16/2009",
    "result": "3:59.9"
  },
  {
    "catagory_index": "329",
    "category_index": 329,
    "date": "2009-07-26T07:00:00.000Z",
    "gender": "male",
    "hundredths_under_barrier": 70,
    "index": 365,
    "location": "Brasschaat",
    "name": "Mark Thompson",
    "readable_date": "7/26/2009",
    "result": "3:59.3"
  },
  {
    "catagory_index": "330",
    "category_index": 330,
    "date": "2010-01-29T08:00:00.000Z",
    "gender": "male",
    "hundredths_under_barrier": 100,
    "index": 366,
    "location": "Bloomington",
    "name": "Andrew Bayer",
    "readable_date": "1/29/2010",
    "result": "3:59.0"
  },
  {
    "catagory_index": "331",
    "category_index": 331,
    "date": "2010-01-30T08:00:00.000Z",
    "gender": "male",
    "hundredths_under_barrier": 40,
    "index": 367,
    "location": "University Park",
    "name": "Erik van Ingen",
    "readable_date": "1/30/2010",
    "result": "3:59.6"
  },
  {
    "catagory_index": "332",
    "category_index": 332,
    "date": "2010-01-30T08:00:00.000Z",
    "gender": "male",
    "hundredths_under_barrier": 20,
    "index": 368,
    "location": "Seattle",
    "name": "Abdi Hassan",
    "readable_date": "1/30/2010",
    "result": "3:59.8"
  },
  {
    "catagory_index": "333",
    "category_index": 333,
    "date": "2010-02-12T08:00:00.000Z",
    "gender": "male",
    "hundredths_under_barrier": 270,
    "index": 369,
    "location": "Fayetteville",
    "name": "Alex McClary",
    "readable_date": "2/12/2010",
    "result": "3:57.3"
  },
  {
    "catagory_index": "334",
    "category_index": 334,
    "date": "2010-02-12T08:00:00.000Z",
    "gender": "male",
    "hundredths_under_barrier": 100,
    "index": 370,
    "location": "Fayetteville",
    "name": "Andy McClary",
    "readable_date": "2/12/2010",
    "result": "3:59.0"
  },
  {
    "catagory_index": "335",
    "category_index": 335,
    "date": "2010-02-13T08:00:00.000Z",
    "gender": "male",
    "hundredths_under_barrier": 10,
    "index": 371,
    "location": "Allston",
    "name": "Riley Masters",
    "readable_date": "2/13/2010",
    "result": "3:59.9"
  },
  {
    "catagory_index": "336",
    "category_index": 336,
    "date": "2010-02-13T08:00:00.000Z",
    "gender": "male",
    "hundredths_under_barrier": 110,
    "index": 372,
    "location": "Seattle",
    "name": "Dylan Ferris",
    "readable_date": "2/13/2010",
    "result": "3:58.9"
  },
  {
    "catagory_index": "337",
    "category_index": 337,
    "date": "2010-02-13T08:00:00.000Z",
    "gender": "male",
    "hundredths_under_barrier": 10,
    "index": 373,
    "location": "Seattle",
    "name": "Eric Harasyn",
    "readable_date": "2/13/2010",
    "result": "3:59.9"
  },
  {
    "catagory_index": "338",
    "category_index": 338,
    "date": "2010-02-13T08:00:00.000Z",
    "gender": "male",
    "hundredths_under_barrier": 230,
    "index": 374,
    "location": "Seattle",
    "name": "Mac Fleet",
    "readable_date": "2/13/2010",
    "result": "3:57.7"
  },
  {
    "catagory_index": "339",
    "category_index": 339,
    "date": "2010-02-13T08:00:00.000Z",
    "gender": "male",
    "hundredths_under_barrier": 160,
    "index": 375,
    "location": "Seattle",
    "name": "Mark Matusak",
    "readable_date": "2/13/2010",
    "result": "3:58.4"
  },
  {
    "catagory_index": "340",
    "category_index": 340,
    "date": "2010-02-13T08:00:00.000Z",
    "gender": "male",
    "hundredths_under_barrier": 130,
    "index": 376,
    "location": "Seattle",
    "name": "Jordan Horn",
    "readable_date": "2/13/2010",
    "result": "3:58.7"
  },
  {
    "catagory_index": "341",
    "category_index": 341,
    "date": "2010-02-13T08:00:00.000Z",
    "gender": "male",
    "hundredths_under_barrier": 110,
    "index": 377,
    "location": "Seattle",
    "name": "Andrew Jesien",
    "readable_date": "2/13/2010",
    "result": "3:58.9"
  },
  {
    "catagory_index": "342",
    "category_index": 342,
    "date": "2010-02-13T08:00:00.000Z",
    "gender": "male",
    "hundredths_under_barrier": 30,
    "index": 378,
    "location": "Seattle",
    "name": "Sam Bair Jr.",
    "readable_date": "2/13/2010",
    "result": "3:59.7"
  },
  {
    "catagory_index": "343",
    "category_index": 343,
    "date": "2010-03-05T08:00:00.000Z",
    "gender": "male",
    "hundredths_under_barrier": 150,
    "index": 379,
    "location": "New York",
    "name": "Kyle Merber",
    "readable_date": "3/5/2010",
    "result": "3:58.5"
  },
  {
    "catagory_index": "344",
    "category_index": 344,
    "date": "2010-03-05T08:00:00.000Z",
    "gender": "male",
    "hundredths_under_barrier": 120,
    "index": 380,
    "location": "New York",
    "name": "Tony Jordanek",
    "readable_date": "3/5/2010",
    "result": "3:58.8"
  },
  {
    "catagory_index": "345",
    "category_index": 345,
    "date": "2010-03-05T08:00:00.000Z",
    "gender": "male",
    "hundredths_under_barrier": 20,
    "index": 381,
    "location": "New York",
    "name": "Kyle Heath",
    "readable_date": "3/5/2010",
    "result": "3:59.8"
  },
  {
    "catagory_index": "346",
    "category_index": 346,
    "date": "2010-03-06T08:00:00.000Z",
    "gender": "male",
    "hundredths_under_barrier": 210,
    "index": 382,
    "location": "Seattle",
    "name": "Ben Blankenship",
    "readable_date": "3/6/2010",
    "result": "3:57.9"
  },
  {
    "catagory_index": "347",
    "category_index": 347,
    "date": "2010-03-06T08:00:00.000Z",
    "gender": "male",
    "hundredths_under_barrier": 10,
    "index": 383,
    "location": "Seattle",
    "name": "Blake Shaw",
    "readable_date": "3/6/2010",
    "result": "3:59.9"
  },
  {
    "catagory_index": "348",
    "category_index": 348,
    "date": "2010-04-24T07:00:00.000Z",
    "gender": "male",
    "hundredths_under_barrier": 60,
    "index": 384,
    "location": "Berkeley",
    "name": "Steve Sodaro",
    "readable_date": "4/24/2010",
    "result": "3:59.4"
  },
  {
    "catagory_index": "349",
    "category_index": 349,
    "date": "2010-06-05T07:00:00.000Z",
    "gender": "male",
    "hundredths_under_barrier": 20,
    "index": 385,
    "location": "Nashville",
    "name": "Kyle King",
    "readable_date": "6/5/2010",
    "result": "3:59.8"
  },
  {
    "catagory_index": "350",
    "category_index": 350,
    "date": "2011-01-22T08:00:00.000Z",
    "gender": "male",
    "hundredths_under_barrier": 30,
    "index": 386,
    "location": "New York",
    "name": "Rob Novak",
    "readable_date": "1/22/2011",
    "result": "3:59.7"
  },
  {
    "catagory_index": "351",
    "category_index": 351,
    "date": "2011-01-29T08:00:00.000Z",
    "gender": "male",
    "hundredths_under_barrier": 200,
    "index": 387,
    "location": "University Park",
    "name": "Cory Leslie",
    "readable_date": "1/29/2011",
    "result": "3:58.0"
  },
  {
    "catagory_index": "352",
    "category_index": 352,
    "date": "2011-02-04T08:00:00.000Z",
    "gender": "male",
    "hundredths_under_barrier": 20,
    "index": 388,
    "location": "Bozeman",
    "name": "Patrick Casey",
    "readable_date": "2/4/2011",
    "result": "3:59.8"
  },
  {
    "catagory_index": "353",
    "category_index": 353,
    "date": "2011-02-12T08:00:00.000Z",
    "gender": "male",
    "hundredths_under_barrier": 120,
    "index": 389,
    "location": "Boston",
    "name": "Mack Chaffee",
    "readable_date": "2/12/2011",
    "result": "3:58.8"
  },
  {
    "catagory_index": "354",
    "category_index": 354,
    "date": "2011-02-12T08:00:00.000Z",
    "gender": "male",
    "hundredths_under_barrier": 420,
    "index": 390,
    "location": "Seattle",
    "name": "Miles Batty",
    "readable_date": "2/12/2011",
    "result": "3:55.8"
  },
  {
    "catagory_index": "355",
    "category_index": 355,
    "date": "2011-02-12T08:00:00.000Z",
    "gender": "male",
    "hundredths_under_barrier": 120,
    "index": 391,
    "location": "Seattle",
    "name": "Duncan Phillips",
    "readable_date": "2/12/2011",
    "result": "3:58.8"
  },
  {
    "catagory_index": "356",
    "category_index": 356,
    "date": "2011-03-05T08:00:00.000Z",
    "gender": "male",
    "hundredths_under_barrier": 160,
    "index": 392,
    "location": "Notre Dame",
    "name": "Michael Hammond",
    "readable_date": "3/5/2011",
    "result": "3:58.4"
  },
  {
    "catagory_index": "357",
    "category_index": 357,
    "date": "2011-03-05T08:00:00.000Z",
    "gender": "male",
    "hundredths_under_barrier": 130,
    "index": 393,
    "location": "Notre Dame",
    "name": "Jeff Thode",
    "readable_date": "3/5/2011",
    "result": "3:58.7"
  },
  {
    "catagory_index": "358",
    "category_index": 358,
    "date": "2011-03-05T08:00:00.000Z",
    "gender": "male",
    "hundredths_under_barrier": 150,
    "index": 394,
    "location": "Seattle",
    "name": "James Cameron",
    "readable_date": "3/5/2011",
    "result": "3:58.5"
  },
  {
    "catagory_index": "359",
    "category_index": 359,
    "date": "2011-06-04T07:00:00.000Z",
    "gender": "male",
    "hundredths_under_barrier": 100,
    "index": 395,
    "location": "Nashville",
    "name": "Matt Elliott",
    "readable_date": "6/4/2011",
    "result": "3:59.0"
  },
  {
    "catagory_index": "360",
    "category_index": 360,
    "date": "2011-06-04T07:00:00.000Z",
    "gender": "male",
    "hundredths_under_barrier": 20,
    "index": 396,
    "location": "Nashville",
    "name": "Patrick Todd",
    "readable_date": "6/4/2011",
    "result": "3:59.8"
  },
  {
    "catagory_index": "361",
    "category_index": 361,
    "date": "2011-06-04T07:00:00.000Z",
    "gender": "male",
    "hundredths_under_barrier": 460,
    "index": 397,
    "location": "Eugene",
    "name": "Kyle Miller",
    "readable_date": "6/4/2011",
    "result": "3:55.4"
  },
  {
    "catagory_index": "362",
    "category_index": 362,
    "date": "2012-01-28T08:00:00.000Z",
    "gender": "male",
    "hundredths_under_barrier": 150,
    "index": 398,
    "location": "Boston",
    "name": "Timothy Ritchie",
    "readable_date": "1/28/2012",
    "result": "3:58.5"
  },
  {
    "catagory_index": "363",
    "category_index": 363,
    "date": "2012-01-28T08:00:00.000Z",
    "gender": "male",
    "hundredths_under_barrier": 10,
    "index": 399,
    "location": "Boston",
    "name": "Christian Gonzalez",
    "readable_date": "1/28/2012",
    "result": "3:59.9"
  },
  {
    "catagory_index": "364",
    "category_index": 364,
    "date": "2012-02-03T08:00:00.000Z",
    "gender": "male",
    "hundredths_under_barrier": 170,
    "index": 400,
    "location": "Blacksburg",
    "name": "Ryan Hill",
    "readable_date": "2/3/2012",
    "result": "3:58.3"
  },
  {
    "catagory_index": "365",
    "category_index": 365,
    "date": "2012-02-04T08:00:00.000Z",
    "gender": "male",
    "hundredths_under_barrier": 110,
    "index": 401,
    "location": "University Park",
    "name": "Peter Callahan",
    "readable_date": "2/4/2012",
    "result": "3:58.9"
  },
  {
    "catagory_index": "366",
    "category_index": 366,
    "date": "2012-02-11T08:00:00.000Z",
    "gender": "male",
    "hundredths_under_barrier": 210,
    "index": 402,
    "location": "Boston",
    "name": "Brian Gagnon",
    "readable_date": "2/11/2012",
    "result": "3:57.9"
  },
  {
    "catagory_index": "367",
    "category_index": 367,
    "date": "2012-02-11T08:00:00.000Z",
    "gender": "male",
    "hundredths_under_barrier": 80,
    "index": 403,
    "location": "Boston",
    "name": "Eric Jenkins",
    "readable_date": "2/11/2012",
    "result": "3:59.2"
  },
  {
    "catagory_index": "368",
    "category_index": 368,
    "date": "2012-02-11T08:00:00.000Z",
    "gender": "male",
    "hundredths_under_barrier": 130,
    "index": 404,
    "location": "Fayetteville",
    "name": "Alex Hatz",
    "readable_date": "2/11/2012",
    "result": "3:58.7"
  },
  {
    "catagory_index": "369",
    "category_index": 369,
    "date": "2012-02-11T08:00:00.000Z",
    "gender": "male",
    "hundredths_under_barrier": 120,
    "index": 405,
    "location": "Fayetteville",
    "name": "George Alex",
    "readable_date": "2/11/2012",
    "result": "3:58.8"
  },
  {
    "catagory_index": "370",
    "category_index": 370,
    "date": "2012-02-11T08:00:00.000Z",
    "gender": "male",
    "hundredths_under_barrier": 100,
    "index": 406,
    "location": "Fayetteville",
    "name": "Frezer Legesse",
    "readable_date": "2/11/2012",
    "result": "3:59.0"
  },
  {
    "catagory_index": "371",
    "category_index": 371,
    "date": "2012-02-11T08:00:00.000Z",
    "gender": "male",
    "hundredths_under_barrier": 10,
    "index": 407,
    "location": "Seattle",
    "name": "Michael Atchoo",
    "readable_date": "2/11/2012",
    "result": "3:59.9"
  },
  {
    "catagory_index": "372",
    "category_index": 372,
    "date": "2012-02-11T08:00:00.000Z",
    "gender": "male",
    "hundredths_under_barrier": 50,
    "index": 408,
    "location": "Seattle",
    "name": "Robby Creese",
    "readable_date": "2/11/2012",
    "result": "3:59.5"
  },
  {
    "catagory_index": "38",
    "category_index": 38,
    "date": "2012-02-11T08:00:00.000Z",
    "gender": "female",
    "hundredths_under_barrier": 150,
    "index": 409,
    "location": "Seattle",
    "name": "Katie Flood",
    "readable_date": "2/11/2012",
    "result": "4:28.5"
  },
  {
    "catagory_index": "373",
    "category_index": 373,
    "date": "2012-02-25T08:00:00.000Z",
    "gender": "male",
    "hundredths_under_barrier": 90,
    "index": 410,
    "location": "Seattle",
    "name": "Matt Maldonado",
    "readable_date": "2/25/2012",
    "result": "3:59.1"
  },
  {
    "catagory_index": "374",
    "category_index": 374,
    "date": "2012-02-25T08:00:00.000Z",
    "gender": "male",
    "hundredths_under_barrier": 90,
    "index": 411,
    "location": "Seattle",
    "name": "Chris Derrick",
    "readable_date": "2/25/2012",
    "result": "3:59.1"
  },
  {
    "catagory_index": "375",
    "category_index": 375,
    "date": "2012-03-03T08:00:00.000Z",
    "gender": "male",
    "hundredths_under_barrier": 10,
    "index": 412,
    "location": "New York",
    "name": "Joe Stilin",
    "readable_date": "3/3/2012",
    "result": "3:59.9"
  },
  {
    "catagory_index": "376",
    "category_index": 376,
    "date": "2012-03-03T08:00:00.000Z",
    "gender": "male",
    "hundredths_under_barrier": 120,
    "index": 413,
    "location": "Notre Dame",
    "name": "Kirubel Erassa",
    "readable_date": "3/3/2012",
    "result": "3:58.8"
  },
  {
    "catagory_index": "377",
    "category_index": 377,
    "date": "2012-03-03T08:00:00.000Z",
    "gender": "male",
    "hundredths_under_barrier": 20,
    "index": 414,
    "location": "Notre Dame",
    "name": "De’Sean Turner",
    "readable_date": "3/3/2012",
    "result": "3:59.8"
  },
  {
    "catagory_index": "378",
    "category_index": 378,
    "date": "2012-03-03T08:00:00.000Z",
    "gender": "male",
    "hundredths_under_barrier": 240,
    "index": 415,
    "location": "Seattle",
    "name": "John Mickowski",
    "readable_date": "3/3/2012",
    "result": "3:57.6"
  },
  {
    "catagory_index": "379",
    "category_index": 379,
    "date": "2012-03-03T08:00:00.000Z",
    "gender": "male",
    "hundredths_under_barrier": 180,
    "index": 416,
    "location": "Seattle",
    "name": "Dan Huling",
    "readable_date": "3/3/2012",
    "result": "3:58.2"
  },
  {
    "catagory_index": "380",
    "category_index": 380,
    "date": "2012-03-03T08:00:00.000Z",
    "gender": "male",
    "hundredths_under_barrier": 130,
    "index": 417,
    "location": "Seattle",
    "name": "Nick Happe",
    "readable_date": "3/3/2012",
    "result": "3:58.7"
  },
  {
    "catagory_index": "381",
    "category_index": 381,
    "date": "2012-04-21T07:00:00.000Z",
    "gender": "male",
    "hundredths_under_barrier": 160,
    "index": 418,
    "location": "Lawrence",
    "name": "David Adams",
    "readable_date": "4/21/2012",
    "result": "3:58.4"
  },
  {
    "catagory_index": "382",
    "category_index": 382,
    "date": "2012-05-10T07:00:00.000Z",
    "gender": "male",
    "hundredths_under_barrier": 10,
    "index": 419,
    "location": "Roanoke",
    "name": "Ryan Witt",
    "readable_date": "5/10/2012",
    "result": "3:59.9"
  },
  {
    "catagory_index": "383",
    "category_index": 383,
    "date": "2012-05-29T07:00:00.000Z",
    "gender": "male",
    "hundredths_under_barrier": 30,
    "index": 420,
    "location": "Warwick",
    "name": "Bobby Mack",
    "readable_date": "5/29/2012",
    "result": "3:59.7"
  },
  {
    "catagory_index": "384",
    "category_index": 384,
    "date": "2012-07-17T07:00:00.000Z",
    "gender": "male",
    "hundredths_under_barrier": 150,
    "index": 421,
    "location": "Cork",
    "name": "Elliott Heath",
    "readable_date": "7/17/2012",
    "result": "3:58.5"
  },
  {
    "catagory_index": "39",
    "category_index": 39,
    "date": "2012-08-11T07:00:00.000Z",
    "gender": "female",
    "hundredths_under_barrier": 320,
    "index": 422,
    "location": "Falmouth",
    "name": "Brenda Martinez",
    "readable_date": "8/11/2012",
    "result": "4:26.8"
  },
  {
    "catagory_index": "40",
    "category_index": 40,
    "date": "2012-08-11T07:00:00.000Z",
    "gender": "female",
    "hundredths_under_barrier": 210,
    "index": 423,
    "location": "Falmouth",
    "name": "Gabriele Anderson",
    "readable_date": "8/11/2012",
    "result": "4:27.9"
  },
  {
    "catagory_index": "41",
    "category_index": 41,
    "date": "2012-08-18T07:00:00.000Z",
    "gender": "female",
    "hundredths_under_barrier": 280,
    "index": 424,
    "location": "Leuven",
    "name": "im Colnley",
    "readable_date": "8/18/2012",
    "result": "4:27.2"
  },
  {
    "catagory_index": "385",
    "category_index": 385,
    "date": "2013-01-25T08:00:00.000Z",
    "gender": "male",
    "hundredths_under_barrier": 110,
    "index": 425,
    "location": "Bloomington",
    "name": "Andrew Poore",
    "readable_date": "1/25/2013",
    "result": "3:58.9"
  },
  {
    "catagory_index": "386",
    "category_index": 386,
    "date": "2013-01-26T08:00:00.000Z",
    "gender": "male",
    "hundredths_under_barrier": 50,
    "index": 426,
    "location": "University Park",
    "name": "Brannon Kidder",
    "readable_date": "1/26/2013",
    "result": "3:59.5"
  },
  {
    "catagory_index": "387",
    "category_index": 387,
    "date": "2013-01-26T08:00:00.000Z",
    "gender": "male",
    "hundredths_under_barrier": 50,
    "index": 427,
    "location": "Fayetteville",
    "name": "Shane Moskowitz",
    "readable_date": "1/26/2013",
    "result": "3:59.5"
  },
  {
    "catagory_index": "388",
    "category_index": 388,
    "date": "2013-02-02T08:00:00.000Z",
    "gender": "male",
    "hundredths_under_barrier": 70,
    "index": 428,
    "location": "Notre Dame",
    "name": "Austin Mudd",
    "readable_date": "2/2/2013",
    "result": "3:59.3"
  },
  {
    "catagory_index": "389",
    "category_index": 389,
    "date": "2013-02-08T08:00:00.000Z",
    "gender": "male",
    "hundredths_under_barrier": 90,
    "index": 429,
    "location": "Fayetteville",
    "name": "Ryan McNiff",
    "readable_date": "2/8/2013",
    "result": "3:59.1"
  },
  {
    "catagory_index": "390",
    "category_index": 390,
    "date": "2013-02-08T08:00:00.000Z",
    "gender": "male",
    "hundredths_under_barrier": 60,
    "index": 430,
    "location": "Fayetteville",
    "name": "Christopher Fallon",
    "readable_date": "2/8/2013",
    "result": "3:59.4"
  },
  {
    "catagory_index": "391",
    "category_index": 391,
    "date": "2013-02-09T08:00:00.000Z",
    "gender": "male",
    "hundredths_under_barrier": 40,
    "index": 431,
    "location": "Seattle",
    "name": "Chad Noelle",
    "readable_date": "2/9/2013",
    "result": "3:59.6"
  },
  {
    "catagory_index": "392",
    "category_index": 392,
    "date": "2013-02-09T08:00:00.000Z",
    "gender": "male",
    "hundredths_under_barrier": 360,
    "index": 432,
    "location": "Seattle",
    "name": "Donn Cabral",
    "readable_date": "2/9/2013",
    "result": "3:56.4"
  },
  {
    "catagory_index": "393",
    "category_index": 393,
    "date": "2013-02-09T08:00:00.000Z",
    "gender": "male",
    "hundredths_under_barrier": 140,
    "index": 433,
    "location": "Seattle",
    "name": "Brett Johnson",
    "readable_date": "2/9/2013",
    "result": "3:58.6"
  },
  {
    "catagory_index": "42",
    "category_index": 42,
    "date": "2013-02-16T08:00:00.000Z",
    "gender": "female",
    "hundredths_under_barrier": 170,
    "index": 434,
    "location": "New York",
    "name": "Mary Cain",
    "readable_date": "2/16/2013",
    "result": "4:28.3"
  },
  {
    "catagory_index": "43",
    "category_index": 43,
    "date": "2013-02-16T08:00:00.000Z",
    "gender": "female",
    "hundredths_under_barrier": 120,
    "index": 435,
    "location": "New York",
    "name": "Kate Grace",
    "readable_date": "2/16/2013",
    "result": "4:28.8"
  },
  {
    "catagory_index": "44",
    "category_index": 44,
    "date": "2013-02-16T08:00:00.000Z",
    "gender": "female",
    "hundredths_under_barrier": 10,
    "index": 436,
    "location": "New York",
    "name": "Emma Coburn",
    "readable_date": "2/16/2013",
    "result": "4:29.9"
  },
  {
    "catagory_index": "394",
    "category_index": 394,
    "date": "2013-02-23T08:00:00.000Z",
    "gender": "male",
    "hundredths_under_barrier": 110,
    "index": 437,
    "location": "Seattle",
    "name": "Tyler Stutzman",
    "readable_date": "2/23/2013",
    "result": "3:58.9"
  },
  {
    "catagory_index": "395",
    "category_index": 395,
    "date": "2013-02-23T08:00:00.000Z",
    "gender": "male",
    "hundredths_under_barrier": 100,
    "index": 438,
    "location": "Seattle",
    "name": "Matt Miner",
    "readable_date": "2/23/2013",
    "result": "3:59.0"
  },
  {
    "catagory_index": "396",
    "category_index": 396,
    "date": "2013-02-23T08:00:00.000Z",
    "gender": "male",
    "hundredths_under_barrier": 80,
    "index": 439,
    "location": "Seattle",
    "name": "Jeramy Elkaim",
    "readable_date": "2/23/2013",
    "result": "3:59.2"
  },
  {
    "catagory_index": "397",
    "category_index": 397,
    "date": "2013-03-02T08:00:00.000Z",
    "gender": "male",
    "hundredths_under_barrier": 70,
    "index": 440,
    "location": "Notre Dame",
    "name": "John Simons",
    "readable_date": "3/2/2013",
    "result": "3:59.3"
  },
  {
    "catagory_index": "398",
    "category_index": 398,
    "date": "2013-04-27T07:00:00.000Z",
    "gender": "male",
    "hundredths_under_barrier": 280,
    "index": 441,
    "location": "Philadelphia",
    "name": "Michael Rutt",
    "readable_date": "4/27/2013",
    "result": "3:57.2"
  },
  {
    "catagory_index": "399",
    "category_index": 399,
    "date": "2013-04-27T07:00:00.000Z",
    "gender": "male",
    "hundredths_under_barrier": 260,
    "index": 442,
    "location": "Philadelphia",
    "name": "Tyler Mulder",
    "readable_date": "4/27/2013",
    "result": "3:57.4"
  },
  {
    "catagory_index": "400",
    "category_index": 400,
    "date": "2013-04-27T07:00:00.000Z",
    "gender": "male",
    "hundredths_under_barrier": 220,
    "index": 443,
    "location": "Philadelphia",
    "name": "Robby Andrews",
    "readable_date": "4/27/2013",
    "result": "3:57.8"
  },
  {
    "catagory_index": "401",
    "category_index": 401,
    "date": "2013-04-27T07:00:00.000Z",
    "gender": "male",
    "hundredths_under_barrier": 30,
    "index": 444,
    "location": "Philadelphia",
    "name": "Owen Dawson",
    "readable_date": "4/27/2013",
    "result": "3:59.7"
  },
  {
    "catagory_index": "45",
    "category_index": 45,
    "date": "2013-05-05T07:00:00.000Z",
    "gender": "female",
    "hundredths_under_barrier": 110,
    "index": 445,
    "location": "San Diego",
    "name": "Brie Felnagle",
    "readable_date": "5/5/2013",
    "result": "4:28.9"
  },
  {
    "catagory_index": "402",
    "category_index": 402,
    "date": "2013-05-30T07:00:00.000Z",
    "gender": "male",
    "hundredths_under_barrier": 50,
    "index": 446,
    "location": "St. Louis",
    "name": "Dan Clark",
    "readable_date": "5/30/2013",
    "result": "3:59.5"
  },
  {
    "catagory_index": "403",
    "category_index": 403,
    "date": "2013-06-01T07:00:00.000Z",
    "gender": "male",
    "hundredths_under_barrier": 130,
    "index": 447,
    "location": "Nashville",
    "name": "Isaac Presson",
    "readable_date": "6/1/2013",
    "result": "3:58.7"
  },
  {
    "catagory_index": "404",
    "category_index": 404,
    "date": "2013-06-01T07:00:00.000Z",
    "gender": "male",
    "hundredths_under_barrier": 10,
    "index": 448,
    "location": "Nashville",
    "name": "Dey Dey",
    "readable_date": "6/1/2013",
    "result": "3:59.9"
  },
  {
    "catagory_index": "405",
    "category_index": 405,
    "date": "2013-07-15T07:00:00.000Z",
    "gender": "male",
    "hundredths_under_barrier": 90,
    "index": 449,
    "location": "Portland",
    "name": "Trevor Dunbar",
    "readable_date": "7/15/2013",
    "result": "3:59.1"
  },
  {
    "catagory_index": "406",
    "category_index": 406,
    "date": "2013-07-15T07:00:00.000Z",
    "gender": "male",
    "hundredths_under_barrier": 60,
    "index": 450,
    "location": "Portland",
    "name": "Rob Finnerty",
    "readable_date": "7/15/2013",
    "result": "3:59.4"
  },
  {
    "catagory_index": "407",
    "category_index": 407,
    "date": "2013-08-04T07:00:00.000Z",
    "gender": "male",
    "hundredths_under_barrier": 70,
    "index": 451,
    "location": "Saline",
    "name": "Dan Lowry",
    "readable_date": "8/4/2013",
    "result": "3:59.3"
  },
  {
    "catagory_index": "46",
    "category_index": 46,
    "date": "2014-01-24T08:00:00.000Z",
    "gender": "female",
    "hundredths_under_barrier": 170,
    "index": 452,
    "location": "Boston",
    "name": "Abbey D'Agostino",
    "readable_date": "1/24/2014",
    "result": "4:28.3"
  },
  {
    "catagory_index": "47",
    "category_index": 47,
    "date": "2014-01-24T08:00:00.000Z",
    "gender": "female",
    "hundredths_under_barrier": 160,
    "index": 453,
    "location": "Boston",
    "name": "Jordan Hasay",
    "readable_date": "1/24/2014",
    "result": "4:28.4"
  },
  {
    "catagory_index": "408",
    "category_index": 408,
    "date": "2014-01-25T08:00:00.000Z",
    "gender": "male",
    "hundredths_under_barrier": 200,
    "index": 454,
    "location": "Boston",
    "name": "Will Geoghegan",
    "readable_date": "1/25/2014",
    "result": "3:58.0"
  },
  {
    "catagory_index": "409",
    "category_index": 409,
    "date": "2014-02-01T08:00:00.000Z",
    "gender": "male",
    "hundredths_under_barrier": 50,
    "index": 455,
    "location": "Geneva",
    "name": "Jake Edwards",
    "readable_date": "2/1/2014",
    "result": "3:59.5"
  },
  {
    "catagory_index": "410",
    "category_index": 410,
    "date": "2014-02-01T08:00:00.000Z",
    "gender": "male",
    "hundredths_under_barrier": 40,
    "index": 456,
    "location": "Seattle",
    "name": "Daniel Quigley",
    "readable_date": "2/1/2014",
    "result": "3:59.6"
  },
  {
    "catagory_index": "411",
    "category_index": 411,
    "date": "2014-02-08T08:00:00.000Z",
    "gender": "male",
    "hundredths_under_barrier": 140,
    "index": 457,
    "location": "Boston",
    "name": "Travis Mahoney",
    "readable_date": "2/8/2014",
    "result": "3:58.6"
  },
  {
    "catagory_index": "412",
    "category_index": 412,
    "date": "2014-02-08T08:00:00.000Z",
    "gender": "male",
    "hundredths_under_barrier": 130,
    "index": 458,
    "location": "Boston",
    "name": "Pat McGregor",
    "readable_date": "2/8/2014",
    "result": "3:58.7"
  },
  {
    "catagory_index": "413",
    "category_index": 413,
    "date": "2014-02-08T08:00:00.000Z",
    "gender": "male",
    "hundredths_under_barrier": 120,
    "index": 459,
    "location": "Boston",
    "name": "Taylor Gilland",
    "readable_date": "2/8/2014",
    "result": "3:58.8"
  },
  {
    "catagory_index": "414",
    "category_index": 414,
    "date": "2014-02-08T08:00:00.000Z",
    "gender": "male",
    "hundredths_under_barrier": 40,
    "index": 460,
    "location": "Boston",
    "name": "Michael Williams",
    "readable_date": "2/8/2014",
    "result": "3:59.6"
  },
  {
    "catagory_index": "415",
    "category_index": 415,
    "date": "2014-02-08T08:00:00.000Z",
    "gender": "male",
    "hundredths_under_barrier": 180,
    "index": 461,
    "location": "Notre Dame",
    "name": "Sam Penzenstadler",
    "readable_date": "2/8/2014",
    "result": "3:58.2"
  },
  {
    "catagory_index": "48",
    "category_index": 48,
    "date": "2014-02-08T08:00:00.000Z",
    "gender": "female",
    "hundredths_under_barrier": 370,
    "index": 462,
    "location": "Boston",
    "name": "Amanda Winslow",
    "readable_date": "2/8/2014",
    "result": "4:26.3"
  },
  {
    "catagory_index": "416",
    "category_index": 416,
    "date": "2014-02-15T08:00:00.000Z",
    "gender": "male",
    "hundredths_under_barrier": 300,
    "index": 463,
    "location": "Ames",
    "name": "Matt Hillenbrand",
    "readable_date": "2/15/2014",
    "result": "3:57.0"
  },
  {
    "catagory_index": "417",
    "category_index": 417,
    "date": "2014-02-15T08:00:00.000Z",
    "gender": "male",
    "hundredths_under_barrier": 100,
    "index": 464,
    "location": "Seattle",
    "name": "Izaic Yorks",
    "readable_date": "2/15/2014",
    "result": "3:59.0"
  },
  {
    "catagory_index": "418",
    "category_index": 418,
    "date": "2014-03-02T08:00:00.000Z",
    "gender": "male",
    "hundredths_under_barrier": 60,
    "index": 465,
    "location": "Boston",
    "name": "Jesse Garn",
    "readable_date": "3/2/2014",
    "result": "3:59.4"
  },
  {
    "catagory_index": "419",
    "category_index": 419,
    "date": "2014-04-12T07:00:00.000Z",
    "gender": "male",
    "hundredths_under_barrier": 70,
    "index": 466,
    "location": "Greenville",
    "name": "Andrew Colley",
    "readable_date": "4/12/2014",
    "result": "3:59.3"
  },
  {
    "catagory_index": "420",
    "category_index": 420,
    "date": "2014-04-26T07:00:00.000Z",
    "gender": "male",
    "hundredths_under_barrier": 170,
    "index": 467,
    "location": "Philadelphia",
    "name": "Thomas Awad",
    "readable_date": "4/26/2014",
    "result": "3:58.3"
  },
  {
    "catagory_index": "421",
    "category_index": 421,
    "date": "2014-06-05T07:00:00.000Z",
    "gender": "male",
    "hundredths_under_barrier": 130,
    "index": 468,
    "location": "Concord",
    "name": "Eric Finan",
    "readable_date": "6/5/2014",
    "result": "3:58.7"
  },
  {
    "catagory_index": "422",
    "category_index": 422,
    "date": "2014-06-05T07:00:00.000Z",
    "gender": "male",
    "hundredths_under_barrier": 310,
    "index": 469,
    "location": "San Diego",
    "name": "Eric Avila",
    "readable_date": "6/5/2014",
    "result": "3:56.9"
  },
  {
    "catagory_index": "49",
    "category_index": 49,
    "date": "2014-06-05T07:00:00.000Z",
    "gender": "female",
    "hundredths_under_barrier": 10,
    "index": 470,
    "location": "Concord",
    "name": "Morgan Uceny",
    "readable_date": "6/5/2014",
    "result": "4:29.9"
  },
  {
    "catagory_index": "423",
    "category_index": 423,
    "date": "2014-07-10T07:00:00.000Z",
    "gender": "male",
    "hundredths_under_barrier": 30,
    "index": 471,
    "location": "Burnaby",
    "name": "Colby Alexander",
    "readable_date": "7/10/2014",
    "result": "3:59.7"
  },
  {
    "catagory_index": "50",
    "category_index": 50,
    "date": "2014-07-11T07:00:00.000Z",
    "gender": "female",
    "hundredths_under_barrier": 320,
    "index": 472,
    "location": "Dublin",
    "name": "Molly Huddle",
    "readable_date": "7/11/2014",
    "result": "4:26.8"
  },
  {
    "catagory_index": "51",
    "category_index": 51,
    "date": "2014-07-11T07:00:00.000Z",
    "gender": "female",
    "hundredths_under_barrier": 240,
    "index": 473,
    "location": "Dublin",
    "name": "Aisha Praught",
    "readable_date": "7/11/2014",
    "result": "4:27.6"
  },
  {
    "catagory_index": "52",
    "category_index": 52,
    "date": "2014-07-11T07:00:00.000Z",
    "gender": "female",
    "hundredths_under_barrier": 200,
    "index": 474,
    "location": "Dublin",
    "name": "Laruen Penney",
    "readable_date": "7/11/2014",
    "result": "4:28.0"
  },
  {
    "catagory_index": "424",
    "category_index": 424,
    "date": "2014-08-01T07:00:00.000Z",
    "gender": "male",
    "hundredths_under_barrier": 240,
    "index": 475,
    "location": "Raleigh",
    "name": "Ford Palmer",
    "readable_date": "8/1/2014",
    "result": "3:57.6"
  },
  {
    "catagory_index": "425",
    "category_index": 425,
    "date": "2014-08-01T07:00:00.000Z",
    "gender": "male",
    "hundredths_under_barrier": 160,
    "index": 476,
    "location": "Raleigh",
    "name": "Donnie Cowart",
    "readable_date": "8/1/2014",
    "result": "3:58.4"
  },
  {
    "catagory_index": "53",
    "category_index": 53,
    "date": "2014-08-16T07:00:00.000Z",
    "gender": "female",
    "hundredths_under_barrier": 220,
    "index": 477,
    "location": "Falmouth",
    "name": "Katie Mackey",
    "readable_date": "8/16/2014",
    "result": "4:27.8"
  },
  {
    "catagory_index": "426",
    "category_index": 426,
    "date": "2015-01-17T08:00:00.000Z",
    "gender": "male",
    "hundredths_under_barrier": 70,
    "index": 478,
    "location": "Seattle",
    "name": "Sean McGorty",
    "readable_date": "1/17/2015",
    "result": "3:59.3"
  },
  {
    "catagory_index": "427",
    "category_index": 427,
    "date": "2015-01-31T08:00:00.000Z",
    "gender": "male",
    "hundredths_under_barrier": 10,
    "index": 479,
    "location": "Boston",
    "name": "Mike Marsella",
    "readable_date": "1/31/2015",
    "result": "3:59.9"
  },
  {
    "catagory_index": "428",
    "category_index": 428,
    "date": "2015-01-31T08:00:00.000Z",
    "gender": "male",
    "hundredths_under_barrier": 100,
    "index": 480,
    "location": "University Park",
    "name": "Ahmed Bile",
    "readable_date": "1/31/2015",
    "result": "3:59.0"
  },
  {
    "catagory_index": "429",
    "category_index": 429,
    "date": "2015-01-31T08:00:00.000Z",
    "gender": "male",
    "hundredths_under_barrier": 20,
    "index": 481,
    "location": "University Park",
    "name": "Martin Hehir",
    "readable_date": "1/31/2015",
    "result": "3:59.8"
  },
  {
    "catagory_index": "54",
    "category_index": 54,
    "date": "2015-02-13T08:00:00.000Z",
    "gender": "female",
    "hundredths_under_barrier": 30,
    "index": 482,
    "location": "Boston",
    "name": "Colleen Quiqley",
    "readable_date": "2/13/2015",
    "result": "4:29.7"
  },
  {
    "catagory_index": "430",
    "category_index": 430,
    "date": "2015-02-14T08:00:00.000Z",
    "gender": "male",
    "hundredths_under_barrier": 180,
    "index": 483,
    "location": "Boston",
    "name": "Steve Mangan",
    "readable_date": "2/14/2015",
    "result": "3:58.2"
  },
  {
    "catagory_index": "431",
    "category_index": 431,
    "date": "2015-02-14T08:00:00.000Z",
    "gender": "male",
    "hundredths_under_barrier": 150,
    "index": 484,
    "location": "Boston",
    "name": "Amos Bartelsmeyer",
    "readable_date": "2/14/2015",
    "result": "3:58.5"
  },
  {
    "catagory_index": "432",
    "category_index": 432,
    "date": "2015-02-14T08:00:00.000Z",
    "gender": "male",
    "hundredths_under_barrier": 140,
    "index": 485,
    "location": "Boston",
    "name": "Ryan Manahan",
    "readable_date": "2/14/2015",
    "result": "3:58.6"
  },
  {
    "catagory_index": "433",
    "category_index": 433,
    "date": "2015-02-14T08:00:00.000Z",
    "gender": "male",
    "hundredths_under_barrier": 50,
    "index": 486,
    "location": "Boston",
    "name": "Michael Lederhouse",
    "readable_date": "2/14/2015",
    "result": "3:59.5"
  },
  {
    "catagory_index": "434",
    "category_index": 434,
    "date": "2015-02-14T08:00:00.000Z",
    "gender": "male",
    "hundredths_under_barrier": 250,
    "index": 487,
    "location": "New York",
    "name": "Johnny Gregorek",
    "readable_date": "2/14/2015",
    "result": "3:57.5"
  },
  {
    "catagory_index": "435",
    "category_index": 435,
    "date": "2015-02-14T08:00:00.000Z",
    "gender": "male",
    "hundredths_under_barrier": 10,
    "index": 488,
    "location": "Ames",
    "name": "Nate McClafferty",
    "readable_date": "2/14/2015",
    "result": "3:59.9"
  },
  {
    "catagory_index": "436",
    "category_index": 436,
    "date": "2015-02-14T08:00:00.000Z",
    "gender": "male",
    "hundredths_under_barrier": 470,
    "index": 489,
    "location": "Seattle",
    "name": "Cristian Soratos",
    "readable_date": "2/14/2015",
    "result": "3:55.3"
  },
  {
    "catagory_index": "437",
    "category_index": 437,
    "date": "2015-02-14T08:00:00.000Z",
    "gender": "male",
    "hundredths_under_barrier": 240,
    "index": 490,
    "location": "Seattle",
    "name": "Daniel Winn",
    "readable_date": "2/14/2015",
    "result": "3:57.6"
  },
  {
    "catagory_index": "438",
    "category_index": 438,
    "date": "2015-02-14T08:00:00.000Z",
    "gender": "male",
    "hundredths_under_barrier": 190,
    "index": 491,
    "location": "Seattle",
    "name": "Jake Hurysz",
    "readable_date": "2/14/2015",
    "result": "3:58.1"
  },
  {
    "catagory_index": "55",
    "category_index": 55,
    "date": "2015-02-14T08:00:00.000Z",
    "gender": "female",
    "hundredths_under_barrier": 200,
    "index": 492,
    "location": "New York",
    "name": "Stephanie Charnigo",
    "readable_date": "2/14/2015",
    "result": "4:28.0"
  },
  {
    "catagory_index": "439",
    "category_index": 439,
    "date": "2015-02-15T08:00:00.000Z",
    "gender": "male",
    "hundredths_under_barrier": 10,
    "index": 493,
    "location": "Seattle",
    "name": "Matt Daniels",
    "readable_date": "2/15/2015",
    "result": "3:59.9"
  },
  {
    "catagory_index": "440",
    "category_index": 440,
    "date": "2015-02-28T08:00:00.000Z",
    "gender": "male",
    "hundredths_under_barrier": 70,
    "index": 494,
    "location": "Seattle",
    "name": "Thomas Coyle",
    "readable_date": "2/28/2015",
    "result": "3:59.3"
  },
  {
    "catagory_index": "56",
    "category_index": 56,
    "date": "2015-03-14T07:00:00.000Z",
    "gender": "female",
    "hundredths_under_barrier": 280,
    "index": 495,
    "location": "Fayetteville",
    "name": "Leah O'Connor",
    "readable_date": "3/14/2015",
    "result": "4:27.2"
  },
  {
    "catagory_index": "57",
    "category_index": 57,
    "date": "2015-03-14T07:00:00.000Z",
    "gender": "female",
    "hundredths_under_barrier": 130,
    "index": 496,
    "location": "Fayetteville",
    "name": "Shelby Houlihan",
    "readable_date": "3/14/2015",
    "result": "4:28.7"
  },
  {
    "catagory_index": "441",
    "category_index": 441,
    "date": "2015-04-25T07:00:00.000Z",
    "gender": "male",
    "hundredths_under_barrier": 130,
    "index": 497,
    "location": "Berkeley",
    "name": "Thomas Joyce",
    "readable_date": "4/25/2015",
    "result": "3:58.7"
  },
  {
    "catagory_index": "442",
    "category_index": 442,
    "date": "2015-05-08T07:00:00.000Z",
    "gender": "male",
    "hundredths_under_barrier": 60,
    "index": 498,
    "location": "Eugene",
    "name": "Matthew Maton",
    "readable_date": "5/8/2015",
    "result": "3:59.4"
  },
  {
    "catagory_index": "443",
    "category_index": 443,
    "date": "2015-05-23T07:00:00.000Z",
    "gender": "male",
    "hundredths_under_barrier": 10,
    "index": 499,
    "location": "Lake Charles",
    "name": "Jarrett LeBlanc",
    "readable_date": "5/23/2015",
    "result": "3:59.9"
  },
  {
    "catagory_index": "444",
    "category_index": 444,
    "date": "2015-06-04T07:00:00.000Z",
    "gender": "male",
    "hundredths_under_barrier": 100,
    "index": 500,
    "location": "St. Louis",
    "name": "Tyler Pennel",
    "readable_date": "6/4/2015",
    "result": "3:59.0"
  },
  {
    "catagory_index": "445",
    "category_index": 445,
    "date": "2015-06-04T07:00:00.000Z",
    "gender": "male",
    "hundredths_under_barrier": 60,
    "index": 501,
    "location": "St. Louis",
    "name": "Grant Fisher",
    "readable_date": "6/4/2015",
    "result": "3:59.4"
  },
  {
    "catagory_index": "446",
    "category_index": 446,
    "date": "2015-06-06T07:00:00.000Z",
    "gender": "male",
    "hundredths_under_barrier": 80,
    "index": 502,
    "location": "Nashville",
    "name": "Brandon Lasater",
    "readable_date": "6/6/2015",
    "result": "3:59.2"
  },
  {
    "catagory_index": "447",
    "category_index": 447,
    "date": "2015-08-07T07:00:00.000Z",
    "gender": "male",
    "hundredths_under_barrier": 60,
    "index": 503,
    "location": "Raleigh",
    "name": "Lex Williams",
    "readable_date": "8/7/2015",
    "result": "3:59.4"
  },
  {
    "catagory_index": "448",
    "category_index": 448,
    "date": "2015-08-07T07:00:00.000Z",
    "gender": "male",
    "hundredths_under_barrier": 30,
    "index": 504,
    "location": "Raleigh",
    "name": "Brandon Hudgins",
    "readable_date": "8/7/2015",
    "result": "3:59.7"
  },
  {
    "catagory_index": "58",
    "category_index": 58,
    "date": "2015-08-07T07:00:00.000Z",
    "gender": "female",
    "hundredths_under_barrier": 120,
    "index": 505,
    "location": "Raleigh",
    "name": "Stephanie Garcia",
    "readable_date": "8/7/2015",
    "result": "4:28.8"
  },
  {
    "catagory_index": "59",
    "category_index": 59,
    "date": "2015-08-07T07:00:00.000Z",
    "gender": "female",
    "hundredths_under_barrier": 90,
    "index": 506,
    "location": "Raleigh",
    "name": "Amanda Eccleston",
    "readable_date": "8/7/2015",
    "result": "4:29.1"
  },
  {
    "catagory_index": "60",
    "category_index": 60,
    "date": "2015-08-07T07:00:00.000Z",
    "gender": "female",
    "hundredths_under_barrier": 60,
    "index": 507,
    "location": "Raleigh",
    "name": "Heather Wilson",
    "readable_date": "8/7/2015",
    "result": "4:29.4"
  },
  {
    "catagory_index": "449",
    "category_index": 449,
    "date": "2015-08-08T07:00:00.000Z",
    "gender": "male",
    "hundredths_under_barrier": 10,
    "index": 508,
    "location": "Portland",
    "name": "Hassan Mead",
    "readable_date": "8/8/2015",
    "result": "3:59.9"
  },
  {
    "catagory_index": "450",
    "category_index": 450,
    "date": "2016-01-30T08:00:00.000Z",
    "gender": "male",
    "hundredths_under_barrier": 130,
    "index": 509,
    "location": "Boston",
    "name": "Henry Wynne",
    "readable_date": "1/30/2016",
    "result": "3:58.7"
  },
  {
    "catagory_index": "451",
    "category_index": 451,
    "date": "2016-01-30T08:00:00.000Z",
    "gender": "male",
    "hundredths_under_barrier": 110,
    "index": 510,
    "location": "Boston",
    "name": "Joel Hubbard",
    "readable_date": "1/30/2016",
    "result": "3:58.9"
  },
  {
    "catagory_index": "452",
    "category_index": 452,
    "date": "2016-01-30T08:00:00.000Z",
    "gender": "male",
    "hundredths_under_barrier": 40,
    "index": 511,
    "location": "Boston",
    "name": "Coby Horowitz",
    "readable_date": "1/30/2016",
    "result": "3:59.6"
  },
  {
    "catagory_index": "453",
    "category_index": 453,
    "date": "2016-01-30T08:00:00.000Z",
    "gender": "male",
    "hundredths_under_barrier": 90,
    "index": 512,
    "location": "Fayetteville",
    "name": "Blake Haney",
    "readable_date": "1/30/2016",
    "result": "3:59.1"
  },
  {
    "catagory_index": "454",
    "category_index": 454,
    "date": "2016-01-30T08:00:00.000Z",
    "gender": "male",
    "hundredths_under_barrier": 20,
    "index": 513,
    "location": "Seattle",
    "name": "Colby Gilbert",
    "readable_date": "1/30/2016",
    "result": "3:59.8"
  },
  {
    "catagory_index": "455",
    "category_index": 455,
    "date": "2016-02-06T08:00:00.000Z",
    "gender": "male",
    "hundredths_under_barrier": 210,
    "index": 514,
    "location": "Boston",
    "name": "Cole Williams",
    "readable_date": "2/6/2016",
    "result": "3:57.9"
  },
  {
    "catagory_index": "456",
    "category_index": 456,
    "date": "2016-02-06T08:00:00.000Z",
    "gender": "male",
    "hundredths_under_barrier": 200,
    "index": 515,
    "location": "New York",
    "name": "Craig Forys",
    "readable_date": "2/6/2016",
    "result": "3:58.0"
  },
  {
    "catagory_index": "457",
    "category_index": 457,
    "date": "2016-02-06T08:00:00.000Z",
    "gender": "male",
    "hundredths_under_barrier": 170,
    "index": 516,
    "location": "New York",
    "name": "Drew Hunter",
    "readable_date": "2/6/2016",
    "result": "3:58.3"
  },
  {
    "catagory_index": "458",
    "category_index": 458,
    "date": "2016-02-06T08:00:00.000Z",
    "gender": "male",
    "hundredths_under_barrier": 290,
    "index": 517,
    "location": "Akron",
    "name": "Clayton Murphy",
    "readable_date": "2/6/2016",
    "result": "3:57.1"
  },
  {
    "catagory_index": "459",
    "category_index": 459,
    "date": "2016-02-12T08:00:00.000Z",
    "gender": "male",
    "hundredths_under_barrier": 180,
    "index": 518,
    "location": "New York",
    "name": "James Gowans",
    "readable_date": "2/12/2016",
    "result": "3:58.2"
  },
  {
    "catagory_index": "460",
    "category_index": 460,
    "date": "2016-02-12T08:00:00.000Z",
    "gender": "male",
    "hundredths_under_barrier": 100,
    "index": 519,
    "location": "New York",
    "name": "Rob Napolitano",
    "readable_date": "2/12/2016",
    "result": "3:59.0"
  },
  {
    "catagory_index": "61",
    "category_index": 61,
    "date": "2016-02-12T08:00:00.000Z",
    "gender": "female",
    "hundredths_under_barrier": 30,
    "index": 520,
    "location": "Boston",
    "name": "Elinor Purrier",
    "readable_date": "2/12/2016",
    "result": "4:29.7"
  },
  {
    "catagory_index": "461",
    "category_index": 461,
    "date": "2016-02-13T08:00:00.000Z",
    "gender": "male",
    "hundredths_under_barrier": 30,
    "index": 521,
    "location": "Seattle",
    "name": "Travis Burkstrand",
    "readable_date": "2/13/2016",
    "result": "3:59.7"
  },
  {
    "catagory_index": "462",
    "category_index": 462,
    "date": "2016-02-13T08:00:00.000Z",
    "gender": "male",
    "hundredths_under_barrier": 20,
    "index": 522,
    "location": "Seattle",
    "name": "Connor Winter",
    "readable_date": "2/13/2016",
    "result": "3:59.8"
  },
  {
    "catagory_index": "463",
    "category_index": 463,
    "date": "2016-02-13T08:00:00.000Z",
    "gender": "male",
    "hundredths_under_barrier": 260,
    "index": 523,
    "location": "Seattle",
    "name": "David Elliott",
    "readable_date": "2/13/2016",
    "result": "3:57.4"
  },
  {
    "catagory_index": "464",
    "category_index": 464,
    "date": "2016-02-13T08:00:00.000Z",
    "gender": "male",
    "hundredths_under_barrier": 250,
    "index": 524,
    "location": "Seattle",
    "name": "Jacob Burcham",
    "readable_date": "2/13/2016",
    "result": "3:57.5"
  },
  {
    "catagory_index": "465",
    "category_index": 465,
    "date": "2016-02-13T08:00:00.000Z",
    "gender": "male",
    "hundredths_under_barrier": 200,
    "index": 525,
    "location": "Seattle",
    "name": "Sam Prakel",
    "readable_date": "2/13/2016",
    "result": "3:58.0"
  },
  {
    "catagory_index": "466",
    "category_index": 466,
    "date": "2016-02-13T08:00:00.000Z",
    "gender": "male",
    "hundredths_under_barrier": 170,
    "index": 526,
    "location": "Seattle",
    "name": "Joshua Thompson",
    "readable_date": "2/13/2016",
    "result": "3:58.3"
  },
  {
    "catagory_index": "62",
    "category_index": 62,
    "date": "2016-02-20T08:00:00.000Z",
    "gender": "female",
    "hundredths_under_barrier": 380,
    "index": 527,
    "location": "New York",
    "name": "Kerri Gallagher",
    "readable_date": "2/20/2016",
    "result": "4:26.2"
  },
  {
    "catagory_index": "63",
    "category_index": 63,
    "date": "2016-02-20T08:00:00.000Z",
    "gender": "female",
    "hundredths_under_barrier": 270,
    "index": 528,
    "location": "New York",
    "name": "Heather Kampf",
    "readable_date": "2/20/2016",
    "result": "4:27.3"
  },
  {
    "catagory_index": "64",
    "category_index": 64,
    "date": "2016-02-20T08:00:00.000Z",
    "gender": "female",
    "hundredths_under_barrier": 110,
    "index": 529,
    "location": "New York",
    "name": "Alexa Efraimson",
    "readable_date": "2/20/2016",
    "result": "4:28.9"
  },
  {
    "catagory_index": "467",
    "category_index": 467,
    "date": "2016-02-27T08:00:00.000Z",
    "gender": "male",
    "hundredths_under_barrier": 100,
    "index": 530,
    "location": "Seattle",
    "name": "Zach Perrin",
    "readable_date": "2/27/2016",
    "result": "3:59.0"
  },
  {
    "catagory_index": "468",
    "category_index": 468,
    "date": "2016-02-27T08:00:00.000Z",
    "gender": "male",
    "hundredths_under_barrier": 20,
    "index": 531,
    "location": "Seattle",
    "name": "Garrett Corcoran",
    "readable_date": "2/27/2016",
    "result": "3:59.8"
  },
  {
    "catagory_index": "469",
    "category_index": 469,
    "date": "2016-02-28T08:00:00.000Z",
    "gender": "male",
    "hundredths_under_barrier": 10,
    "index": 532,
    "location": "Boston",
    "name": "Bryce Basting",
    "readable_date": "2/28/2016",
    "result": "3:59.9"
  },
  {
    "catagory_index": "65",
    "category_index": 65,
    "date": "2016-02-28T08:00:00.000Z",
    "gender": "female",
    "hundredths_under_barrier": 150,
    "index": 533,
    "location": "Boston",
    "name": "Rachel Schneider",
    "readable_date": "2/28/2016",
    "result": "4:28.5"
  },
  {
    "catagory_index": "470",
    "category_index": 470,
    "date": "2016-03-06T08:00:00.000Z",
    "gender": "male",
    "hundredths_under_barrier": 110,
    "index": 534,
    "location": "Boston",
    "name": "James Randon",
    "readable_date": "3/6/2016",
    "result": "3:58.9"
  },
  {
    "catagory_index": "471",
    "category_index": 471,
    "date": "2016-04-29T07:00:00.000Z",
    "gender": "male",
    "hundredths_under_barrier": 50,
    "index": 535,
    "location": "Portland",
    "name": "Michael Slagowski",
    "readable_date": "4/29/2016",
    "result": "3:59.5"
  },
  {
    "catagory_index": "472",
    "category_index": 472,
    "date": "2016-06-02T07:00:00.000Z",
    "gender": "male",
    "hundredths_under_barrier": 30,
    "index": 536,
    "location": "Concord",
    "name": "Nick Ross",
    "readable_date": "6/2/2016",
    "result": "3:59.7"
  },
  {
    "catagory_index": "66",
    "category_index": 66,
    "date": "2016-07-22T07:00:00.000Z",
    "gender": "female",
    "hundredths_under_barrier": 140,
    "index": 537,
    "location": "Dublin",
    "name": "Cory Mcgee",
    "readable_date": "7/22/2016",
    "result": "4:28.6"
  },
  {
    "catagory_index": "473",
    "category_index": 473,
    "date": "2016-08-05T07:00:00.000Z",
    "gender": "male",
    "hundredths_under_barrier": 390,
    "index": 538,
    "location": "Raleigh",
    "name": "Graham Crawford",
    "readable_date": "8/5/2016",
    "result": "3:56.1"
  },
  {
    "catagory_index": "474",
    "category_index": 474,
    "date": "2016-08-05T07:00:00.000Z",
    "gender": "male",
    "hundredths_under_barrier": 240,
    "index": 539,
    "location": "Raleigh",
    "name": "Mike Brannigan",
    "readable_date": "8/5/2016",
    "result": "3:57.6"
  },
  {
    "catagory_index": "67",
    "category_index": 67,
    "date": "2016-08-05T07:00:00.000Z",
    "gender": "female",
    "hundredths_under_barrier": 500,
    "index": 540,
    "location": "Raleigh",
    "name": "Lauren Johnson",
    "readable_date": "8/5/2016",
    "result": "4:25.0"
  },
  {
    "catagory_index": "68",
    "category_index": 68,
    "date": "2016-08-05T07:00:00.000Z",
    "gender": "female",
    "hundredths_under_barrier": 90,
    "index": 541,
    "location": "Raleigh",
    "name": "Stephanie Brown",
    "readable_date": "8/5/2016",
    "result": "4:29.1"
  },
  {
    "catagory_index": "69",
    "category_index": 69,
    "date": "2016-08-05T07:00:00.000Z",
    "gender": "female",
    "hundredths_under_barrier": 20,
    "index": 542,
    "location": "Raleigh",
    "name": "Nicole Tully",
    "readable_date": "8/5/2016",
    "result": "4:29.8"
  },
  {
    "catagory_index": "475",
    "category_index": 475,
    "date": "2016-08-11T07:00:00.000Z",
    "gender": "male",
    "hundredths_under_barrier": 40,
    "index": 543,
    "location": "West Chester",
    "name": "Reed Connor",
    "readable_date": "8/11/2016",
    "result": "3:59.6"
  },
  {
    "catagory_index": "70",
    "category_index": 70,
    "date": "2016-08-31T07:00:00.000Z",
    "gender": "female",
    "hundredths_under_barrier": 150,
    "index": 544,
    "location": "Huntington Station",
    "name": "Shannon Osika",
    "readable_date": "8/31/2016",
    "result": "4:28.5"
  },
  {
    "catagory_index": "476",
    "category_index": 476,
    "date": "2016-12-10T08:00:00.000Z",
    "gender": "male",
    "hundredths_under_barrier": 130,
    "index": 545,
    "location": "College Station",
    "name": "Brian Barraza",
    "readable_date": "12/10/2016",
    "result": "3:58.7"
  },
  {
    "catagory_index": "477",
    "category_index": 477,
    "date": "2017-01-28T08:00:00.000Z",
    "gender": "male",
    "hundredths_under_barrier": 190,
    "index": 546,
    "location": "Boston",
    "name": "Ned Willig",
    "readable_date": "1/28/2017",
    "result": "3:58.1"
  },
  {
    "catagory_index": "478",
    "category_index": 478,
    "date": "2017-01-28T08:00:00.000Z",
    "gender": "male",
    "hundredths_under_barrier": 80,
    "index": 547,
    "location": "Boston",
    "name": "William Sheeran",
    "readable_date": "1/28/2017",
    "result": "3:59.2"
  },
  {
    "catagory_index": "479",
    "category_index": 479,
    "date": "2017-01-28T08:00:00.000Z",
    "gender": "male",
    "hundredths_under_barrier": 60,
    "index": 548,
    "location": "Boston",
    "name": "Connor Mora",
    "readable_date": "1/28/2017",
    "result": "3:59.4"
  },
  {
    "catagory_index": "480",
    "category_index": 480,
    "date": "2017-01-28T08:00:00.000Z",
    "gender": "male",
    "hundredths_under_barrier": 40,
    "index": 549,
    "location": "University Park",
    "name": "Jack Keelan",
    "readable_date": "1/28/2017",
    "result": "3:59.6"
  },
  {
    "catagory_index": "481",
    "category_index": 481,
    "date": "2017-02-11T08:00:00.000Z",
    "gender": "male",
    "hundredths_under_barrier": 70,
    "index": 550,
    "location": "Boston",
    "name": "Paul Duffey",
    "readable_date": "2/11/2017",
    "result": "3:59.3"
  },
  {
    "catagory_index": "482",
    "category_index": 482,
    "date": "2017-02-11T08:00:00.000Z",
    "gender": "male",
    "hundredths_under_barrier": 80,
    "index": 551,
    "location": "New York",
    "name": "Chris Hatler",
    "readable_date": "2/11/2017",
    "result": "3:59.2"
  },
  {
    "catagory_index": "483",
    "category_index": 483,
    "date": "2017-02-11T08:00:00.000Z",
    "gender": "male",
    "hundredths_under_barrier": 10,
    "index": 552,
    "location": "Seattle",
    "name": "Craig Nowak",
    "readable_date": "2/11/2017",
    "result": "3:59.9"
  },
  {
    "catagory_index": "484",
    "category_index": 484,
    "date": "2017-02-11T08:00:00.000Z",
    "gender": "male",
    "hundredths_under_barrier": 120,
    "index": 553,
    "location": "Seattle",
    "name": "Tim Gorman",
    "readable_date": "2/11/2017",
    "result": "3:58.8"
  },
  {
    "catagory_index": "485",
    "category_index": 485,
    "date": "2017-02-11T08:00:00.000Z",
    "gender": "male",
    "hundredths_under_barrier": 40,
    "index": 554,
    "location": "Seattle",
    "name": "Cole Rockhold",
    "readable_date": "2/11/2017",
    "result": "3:59.6"
  },
  {
    "catagory_index": "71",
    "category_index": 71,
    "date": "2017-02-11T08:00:00.000Z",
    "gender": "female",
    "hundredths_under_barrier": 120,
    "index": 555,
    "location": "New York",
    "name": "Kaela Edwards",
    "readable_date": "2/11/2017",
    "result": "4:28.8"
  },
  {
    "catagory_index": "486",
    "category_index": 486,
    "date": "2017-06-01T07:00:00.000Z",
    "gender": "male",
    "hundredths_under_barrier": 530,
    "index": 556,
    "location": "Concord",
    "name": "Robert Domanic",
    "readable_date": "6/1/2017",
    "result": "3:54.7"
  },
  {
    "catagory_index": "487",
    "category_index": 487,
    "date": "2017-06-01T07:00:00.000Z",
    "gender": "male",
    "hundredths_under_barrier": 70,
    "index": 557,
    "location": "St. Louis",
    "name": "Reed Brown",
    "readable_date": "6/1/2017",
    "result": "3:59.3"
  },
  {
    "catagory_index": "488",
    "category_index": 488,
    "date": "2017-06-10T07:00:00.000Z",
    "gender": "male",
    "hundredths_under_barrier": 90,
    "index": 558,
    "location": "Nashville",
    "name": "Andy Trouard",
    "readable_date": "6/10/2017",
    "result": "3:59.1"
  },
  {
    "catagory_index": "489",
    "category_index": 489,
    "date": "2017-08-04T07:00:00.000Z",
    "gender": "male",
    "hundredths_under_barrier": 230,
    "index": 559,
    "location": "Raleigh",
    "name": "Craig Engels",
    "readable_date": "8/4/2017",
    "result": "3:57.7"
  },
  {
    "catagory_index": "490",
    "category_index": 490,
    "date": "2017-08-04T07:00:00.000Z",
    "gender": "male",
    "hundredths_under_barrier": 100,
    "index": 560,
    "location": "Raleigh",
    "name": "Drew Piazza",
    "readable_date": "8/4/2017",
    "result": "3:59.0"
  },
  {
    "catagory_index": "491",
    "category_index": 491,
    "date": "2017-08-04T07:00:00.000Z",
    "gender": "male",
    "hundredths_under_barrier": 90,
    "index": 561,
    "location": "Raleigh",
    "name": "Andrew Dusing",
    "readable_date": "8/4/2017",
    "result": "3:59.1"
  },
  {
    "catagory_index": "492",
    "category_index": 492,
    "date": "2017-08-04T07:00:00.000Z",
    "gender": "male",
    "hundredths_under_barrier": 50,
    "index": 562,
    "location": "Raleigh",
    "name": "Tripp Hurt",
    "readable_date": "8/4/2017",
    "result": "3:59.5"
  },
  {
    "catagory_index": "72",
    "category_index": 72,
    "date": "2017-08-19T07:00:00.000Z",
    "gender": "female",
    "hundredths_under_barrier": 170,
    "index": 563,
    "location": "Falmouth",
    "name": "Hannah Fields",
    "readable_date": "8/19/2017",
    "result": "4:28.3"
  },
  {
    "catagory_index": "73",
    "category_index": 73,
    "date": "2017-09-06T07:00:00.000Z",
    "gender": "female",
    "hundredths_under_barrier": 120,
    "index": 564,
    "location": "Huntington Station",
    "name": "Emily Lipari",
    "readable_date": "9/6/2017",
    "result": "4:28.8"
  },
  {
    "catagory_index": "493",
    "category_index": 493,
    "date": "2017-12-09T08:00:00.000Z",
    "gender": "male",
    "hundredths_under_barrier": 70,
    "index": 565,
    "location": "College Station",
    "name": "Donavan Brazier",
    "readable_date": "12/9/2017",
    "result": "3:59.3"
  },
  {
    "catagory_index": "494",
    "category_index": 494,
    "date": "2018-01-19T08:00:00.000Z",
    "gender": "male",
    "hundredths_under_barrier": 60,
    "index": 566,
    "location": "Birmingham",
    "name": "Brian Shrader",
    "readable_date": "1/19/2018",
    "result": "3:59.4"
  },
  {
    "catagory_index": "495",
    "category_index": 495,
    "date": "2018-01-27T08:00:00.000Z",
    "gender": "male",
    "hundredths_under_barrier": 210,
    "index": 567,
    "location": "New York",
    "name": "Mick Stanovsek",
    "readable_date": "1/27/2018",
    "result": "3:57.9"
  },
  {
    "catagory_index": "496",
    "category_index": 496,
    "date": "2018-01-27T08:00:00.000Z",
    "gender": "male",
    "hundredths_under_barrier": 70,
    "index": 568,
    "location": "New York",
    "name": "Cooper Teare",
    "readable_date": "1/27/2018",
    "result": "3:59.3"
  },
  {
    "catagory_index": "497",
    "category_index": 497,
    "date": "2018-01-27T08:00:00.000Z",
    "gender": "male",
    "hundredths_under_barrier": 80,
    "index": 569,
    "location": "Bloomington",
    "name": "Kyle Mau",
    "readable_date": "1/27/2018",
    "result": "3:59.2"
  },
  {
    "catagory_index": "498",
    "category_index": 498,
    "date": "2018-01-27T08:00:00.000Z",
    "gender": "male",
    "hundredths_under_barrier": 150,
    "index": 570,
    "location": "Champaign",
    "name": "Jon Davis",
    "readable_date": "1/27/2018",
    "result": "3:58.5"
  },
  {
    "catagory_index": "499",
    "category_index": 499,
    "date": "2018-01-27T08:00:00.000Z",
    "gender": "male",
    "hundredths_under_barrier": 450,
    "index": 571,
    "location": "Boston",
    "name": "Shadrack Kipchirchir",
    "readable_date": "1/27/2018",
    "result": "3:55.5"
  },
  {
    "catagory_index": "500",
    "category_index": 500,
    "date": "2018-01-27T08:00:00.000Z",
    "gender": "male",
    "hundredths_under_barrier": 120,
    "index": 572,
    "location": "Boston",
    "name": "Emmanuel Bor",
    "readable_date": "1/27/2018",
    "result": "3:58.8"
  },
  {
    "catagory_index": "501",
    "category_index": 501,
    "date": "2018-01-27T08:00:00.000Z",
    "gender": "male",
    "hundredths_under_barrier": 110,
    "index": 573,
    "location": "Seattle",
    "name": "David Ribich",
    "readable_date": "1/27/2018",
    "result": "3:58.9"
  },
  {
    "catagory_index": "74",
    "category_index": 74,
    "date": "2018-01-27T08:00:00.000Z",
    "gender": "female",
    "hundredths_under_barrier": 250,
    "index": 574,
    "location": "New York",
    "name": "Karissa Schweizer",
    "readable_date": "1/27/2018",
    "result": "4:27.5"
  },
  {
    "catagory_index": "502",
    "category_index": 502,
    "date": "2018-02-03T08:00:00.000Z",
    "gender": "male",
    "hundredths_under_barrier": 50,
    "index": 575,
    "location": "University Park",
    "name": "Colin Abert",
    "readable_date": "2/3/2018",
    "result": "3:59.5"
  },
  {
    "catagory_index": "503",
    "category_index": 503,
    "date": "2018-02-03T08:00:00.000Z",
    "gender": "male",
    "hundredths_under_barrier": 140,
    "index": 576,
    "location": "Winston-Salem",
    "name": "Paul Chelimo",
    "readable_date": "2/3/2018",
    "result": "3:58.6"
  },
  {
    "catagory_index": "504",
    "category_index": 504,
    "date": "2018-02-03T08:00:00.000Z",
    "gender": "male",
    "hundredths_under_barrier": 40,
    "index": 577,
    "location": "Winston-Salem",
    "name": "Vincent Ciattei",
    "readable_date": "2/3/2018",
    "result": "3:59.6"
  },
  {
    "catagory_index": "505",
    "category_index": 505,
    "date": "2018-02-03T08:00:00.000Z",
    "gender": "male",
    "hundredths_under_barrier": 40,
    "index": 578,
    "location": "Winston-Salem",
    "name": "Patrick Joseph",
    "readable_date": "2/3/2018",
    "result": "3:59.6"
  },
  {
    "catagory_index": "506",
    "category_index": 506,
    "date": "2018-02-09T08:00:00.000Z",
    "gender": "male",
    "hundredths_under_barrier": 90,
    "index": 579,
    "location": "Clemson",
    "name": "Alex Riba",
    "readable_date": "2/9/2018",
    "result": "3:59.1"
  },
  {
    "catagory_index": "507",
    "category_index": 507,
    "date": "2018-02-09T08:00:00.000Z",
    "gender": "male",
    "hundredths_under_barrier": 40,
    "index": 580,
    "location": "Clemson",
    "name": "Benjamin Young",
    "readable_date": "2/9/2018",
    "result": "3:59.6"
  },
  {
    "catagory_index": "508",
    "category_index": 508,
    "date": "2018-02-10T08:00:00.000Z",
    "gender": "male",
    "hundredths_under_barrier": 60,
    "index": 581,
    "location": "Boston",
    "name": "Michael Hall",
    "readable_date": "2/10/2018",
    "result": "3:59.4"
  },
  {
    "catagory_index": "509",
    "category_index": 509,
    "date": "2018-02-10T08:00:00.000Z",
    "gender": "male",
    "hundredths_under_barrier": 60,
    "index": 582,
    "location": "Boston",
    "name": "Martin Martinez",
    "readable_date": "2/10/2018",
    "result": "3:59.4"
  },
  {
    "catagory_index": "510",
    "category_index": 510,
    "date": "2018-02-10T08:00:00.000Z",
    "gender": "male",
    "hundredths_under_barrier": 200,
    "index": 583,
    "location": "Seattle",
    "name": "Sam Worley",
    "readable_date": "2/10/2018",
    "result": "3:58.0"
  },
  {
    "catagory_index": "511",
    "category_index": 511,
    "date": "2018-02-25T08:00:00.000Z",
    "gender": "male",
    "hundredths_under_barrier": 110,
    "index": 584,
    "location": "Boston",
    "name": "Jordan Mann",
    "readable_date": "2/25/2018",
    "result": "3:58.9"
  },
  {
    "catagory_index": "512",
    "category_index": 512,
    "date": "2018-02-25T08:00:00.000Z",
    "gender": "male",
    "hundredths_under_barrier": 100,
    "index": 585,
    "location": "Boston",
    "name": "Jeremy Hernandez",
    "readable_date": "2/25/2018",
    "result": "3:59.0"
  },
  {
    "catagory_index": "513",
    "category_index": 513,
    "date": "2018-02-25T08:00:00.000Z",
    "gender": "male",
    "hundredths_under_barrier": 80,
    "index": 586,
    "location": "Boston",
    "name": "Reid Buchanan",
    "readable_date": "2/25/2018",
    "result": "3:59.2"
  },
  {
    "catagory_index": "514",
    "category_index": 514,
    "date": "2018-02-25T08:00:00.000Z",
    "gender": "male",
    "hundredths_under_barrier": 70,
    "index": 587,
    "location": "Boston",
    "name": "Louis Serafini",
    "readable_date": "2/25/2018",
    "result": "3:59.3"
  },
  {
    "catagory_index": "515",
    "category_index": 515,
    "date": "2018-05-22T07:00:00.000Z",
    "gender": "male",
    "hundredths_under_barrier": 60,
    "index": 588,
    "location": "Atlanta",
    "name": "Willy Fink",
    "readable_date": "5/22/2018",
    "result": "3:59.4"
  },
  {
    "catagory_index": "516",
    "category_index": 516,
    "date": "2018-05-31T07:00:00.000Z",
    "gender": "male",
    "hundredths_under_barrier": 110,
    "index": 589,
    "location": "St. Louis",
    "name": "Nick Harris",
    "readable_date": "5/31/2018",
    "result": "3:58.9"
  },
  {
    "catagory_index": "517",
    "category_index": 517,
    "date": "2018-05-31T07:00:00.000Z",
    "gender": "male",
    "hundredths_under_barrier": 50,
    "index": 590,
    "location": "St. Louis",
    "name": "Derek Gutierrez",
    "readable_date": "5/31/2018",
    "result": "3:59.5"
  },
  {
    "catagory_index": "518",
    "category_index": 518,
    "date": "2018-05-31T07:00:00.000Z",
    "gender": "male",
    "hundredths_under_barrier": 20,
    "index": 591,
    "location": "St. Louis",
    "name": "Brett Meyer",
    "readable_date": "5/31/2018",
    "result": "3:59.8"
  },
  {
    "catagory_index": "519",
    "category_index": 519,
    "date": "2018-06-07T07:00:00.000Z",
    "gender": "male",
    "hundredths_under_barrier": 230,
    "index": 592,
    "location": "Concord",
    "name": "David Timlin",
    "readable_date": "6/7/2018",
    "result": "3:57.7"
  },
  {
    "catagory_index": "75",
    "category_index": 75,
    "date": "2018-06-07T07:00:00.000Z",
    "gender": "female",
    "hundredths_under_barrier": 290,
    "index": 593,
    "location": "Concord",
    "name": "Helan Schlachtenhaufen",
    "readable_date": "6/7/2018",
    "result": "4:27.1"
  },
  {
    "catagory_index": "520",
    "category_index": 520,
    "date": "2018-08-03T07:00:00.000Z",
    "gender": "male",
    "hundredths_under_barrier": 400,
    "index": 594,
    "location": "Raleigh",
    "name": "Charlie Marquardt",
    "readable_date": "8/3/2018",
    "result": "3:56.0"
  },
  {
    "catagory_index": "521",
    "category_index": 521,
    "date": "2018-08-03T07:00:00.000Z",
    "gender": "male",
    "hundredths_under_barrier": 290,
    "index": 595,
    "location": "Raleigh",
    "name": "Jacob Thomson",
    "readable_date": "8/3/2018",
    "result": "3:57.1"
  },
  {
    "catagory_index": "76",
    "category_index": 76,
    "date": "2018-08-03T07:00:00.000Z",
    "gender": "female",
    "hundredths_under_barrier": 270,
    "index": 596,
    "location": "Raleigh",
    "name": "Charlene Lipsey",
    "readable_date": "8/3/2018",
    "result": "4:27.3"
  },
  {
    "catagory_index": "77",
    "category_index": 77,
    "date": "2018-08-03T07:00:00.000Z",
    "gender": "female",
    "hundredths_under_barrier": 270,
    "index": 597,
    "location": "Raleigh",
    "name": "Sara Vaughn",
    "readable_date": "8/3/2018",
    "result": "4:27.3"
  },
  {
    "catagory_index": "522",
    "category_index": 522,
    "date": "2018-09-05T07:00:00.000Z",
    "gender": "male",
    "hundredths_under_barrier": 30,
    "index": 598,
    "location": "Bay Shore",
    "name": "Sam Parsons",
    "readable_date": "9/5/2018",
    "result": "3:59.7"
  },
  {
    "catagory_index": "523",
    "category_index": 523,
    "date": "2019-01-12T08:00:00.000Z",
    "gender": "male",
    "hundredths_under_barrier": 10,
    "index": 599,
    "location": "Seattle",
    "name": "Logan Orndorf",
    "readable_date": "1/12/2019",
    "result": "3:59.9"
  },
  {
    "catagory_index": "524",
    "category_index": 524,
    "date": "2019-01-18T08:00:00.000Z",
    "gender": "male",
    "hundredths_under_barrier": 100,
    "index": 600,
    "location": "Clemson",
    "name": "Alex Rogers",
    "readable_date": "1/18/2019",
    "result": "3:59.0"
  },
  {
    "catagory_index": "525",
    "category_index": 525,
    "date": "2019-01-26T08:00:00.000Z",
    "gender": "male",
    "hundredths_under_barrier": 110,
    "index": 601,
    "location": "Boston",
    "name": "Ben Groleau",
    "readable_date": "1/26/2019",
    "result": "3:58.9"
  },
  {
    "catagory_index": "526",
    "category_index": 526,
    "date": "2019-01-26T08:00:00.000Z",
    "gender": "male",
    "hundredths_under_barrier": 60,
    "index": 602,
    "location": "Boston",
    "name": "Aidan Tooker",
    "readable_date": "1/26/2019",
    "result": "3:59.4"
  },
  {
    "catagory_index": "527",
    "category_index": 527,
    "date": "2019-01-26T08:00:00.000Z",
    "gender": "male",
    "hundredths_under_barrier": 150,
    "index": 603,
    "location": "Seattle",
    "name": "Kasey Knevelbaard",
    "readable_date": "1/26/2019",
    "result": "3:58.5"
  },
  {
    "catagory_index": "529",
    "category_index": 528,
    "date": "2019-01-26T08:00:00.000Z",
    "gender": "male",
    "hundredths_under_barrier": 40,
    "index": 604,
    "location": "Seattle",
    "name": "Talon Hull",
    "readable_date": "1/26/2019",
    "result": "3:59.6"
  },
  {
    "catagory_index": "530",
    "category_index": 529,
    "date": "2019-02-09T08:00:00.000Z",
    "gender": "male",
    "hundredths_under_barrier": 220,
    "index": 605,
    "location": "Boston",
    "name": "Casey Comber",
    "readable_date": "2/9/2019",
    "result": "3:57.8"
  },
  {
    "catagory_index": "531",
    "category_index": 530,
    "date": "2019-02-09T08:00:00.000Z",
    "gender": "male",
    "hundredths_under_barrier": 110,
    "index": 606,
    "location": "Boston",
    "name": "Ben Malone",
    "readable_date": "2/9/2019",
    "result": "3:58.9"
  },
  {
    "catagory_index": "532",
    "category_index": 531,
    "date": "2019-02-09T08:00:00.000Z",
    "gender": "male",
    "hundredths_under_barrier": 60,
    "index": 607,
    "location": "Boston",
    "name": "Sam Ritz",
    "readable_date": "2/9/2019",
    "result": "3:59.4"
  },
  {
    "catagory_index": "533",
    "category_index": 532,
    "date": "2019-02-09T08:00:00.000Z",
    "gender": "male",
    "hundredths_under_barrier": 50,
    "index": 608,
    "location": "Boston",
    "name": "Collin Leibold",
    "readable_date": "2/9/2019",
    "result": "3:59.5"
  },
  {
    "catagory_index": "534",
    "category_index": 533,
    "date": "2019-02-09T08:00:00.000Z",
    "gender": "male",
    "hundredths_under_barrier": 10,
    "index": 609,
    "location": "Boston",
    "name": "Spencer Brown",
    "readable_date": "2/9/2019",
    "result": "3:59.9"
  },
  {
    "catagory_index": "535",
    "category_index": 534,
    "date": "2019-02-09T08:00:00.000Z",
    "gender": "male",
    "hundredths_under_barrier": 10,
    "index": 610,
    "location": "Ames",
    "name": "Jeff Thies",
    "readable_date": "2/9/2019",
    "result": "3:59.9"
  },
  {
    "catagory_index": "78",
    "category_index": 78,
    "date": "2019-02-09T08:00:00.000Z",
    "gender": "female",
    "hundredths_under_barrier": 50,
    "index": 611,
    "location": "New York",
    "name": "Danae Rivers",
    "readable_date": "2/9/2019",
    "result": "4:29.5"
  },
  {
    "catagory_index": "536",
    "category_index": 535,
    "date": "2019-02-16T08:00:00.000Z",
    "gender": "male",
    "hundredths_under_barrier": 20,
    "index": 612,
    "location": "Seattle",
    "name": "Jackson Mestler",
    "readable_date": "2/16/2019",
    "result": "3:59.8"
  },
  {
    "catagory_index": "537",
    "category_index": 536,
    "date": "2019-02-23T08:00:00.000Z",
    "gender": "male",
    "hundredths_under_barrier": 210,
    "index": 613,
    "location": "Blacksburg",
    "name": "Yared Nuguse",
    "readable_date": "2/23/2019",
    "result": "3:57.9"
  },
  {
    "catagory_index": "538",
    "category_index": 537,
    "date": "2019-02-23T08:00:00.000Z",
    "gender": "male",
    "hundredths_under_barrier": 150,
    "index": 614,
    "location": "Seattle",
    "name": "Joe Klecker",
    "readable_date": "2/23/2019",
    "result": "3:58.5"
  },
  {
    "catagory_index": "539",
    "category_index": 538,
    "date": "2019-02-23T08:00:00.000Z",
    "gender": "male",
    "hundredths_under_barrier": 120,
    "index": 615,
    "location": "Seattle",
    "name": "Paul Ryan",
    "readable_date": "2/23/2019",
    "result": "3:58.8"
  },
  {
    "catagory_index": "79",
    "category_index": 79,
    "date": "2019-03-03T08:00:00.000Z",
    "gender": "female",
    "hundredths_under_barrier": 190,
    "index": 616,
    "location": "Boston",
    "name": "Ce'Aira Brown",
    "readable_date": "3/3/2019",
    "result": "4:28.1"
  },
  {
    "catagory_index": "80",
    "category_index": 80,
    "date": "2019-03-03T08:00:00.000Z",
    "gender": "female",
    "hundredths_under_barrier": 30,
    "index": 617,
    "location": "Boston",
    "name": "Heather MacLean",
    "readable_date": "3/3/2019",
    "result": "4:29.7"
  },
  {
    "catagory_index": "540",
    "category_index": 539,
    "date": "2019-05-30T07:00:00.000Z",
    "gender": "male",
    "hundredths_under_barrier": 130,
    "index": 618,
    "location": "St. Louis",
    "name": "Josef Tessema",
    "readable_date": "5/30/2019",
    "result": "3:58.7"
  },
  {
    "catagory_index": "541",
    "category_index": 540,
    "date": "2019-05-31T07:00:00.000Z",
    "gender": "male",
    "hundredths_under_barrier": 10,
    "index": 619,
    "location": "Nashville",
    "name": "Troy Reeder",
    "readable_date": "5/31/2019",
    "result": "3:59.9"
  },
  {
    "catagory_index": "542",
    "category_index": 541,
    "date": "2019-08-01T07:00:00.000Z",
    "gender": "male",
    "hundredths_under_barrier": 110,
    "index": 620,
    "location": "West Long Branch",
    "name": "Eric Holt",
    "readable_date": "8/1/2019",
    "result": "3:58.9"
  },
  {
    "catagory_index": "543",
    "category_index": 542,
    "date": "2019-08-02T07:00:00.000Z",
    "gender": "male",
    "hundredths_under_barrier": 140,
    "index": 621,
    "location": "Raleigh",
    "name": "James Quattlebaum",
    "readable_date": "8/2/2019",
    "result": "3:58.6"
  },
  {
    "catagory_index": "544",
    "category_index": 543,
    "date": "2019-09-04T07:00:00.000Z",
    "gender": "male",
    "hundredths_under_barrier": 220,
    "index": 622,
    "location": "Bay Shore",
    "name": "Dillon Maggard",
    "readable_date": "9/4/2019",
    "result": "3:57.8"
  },
  {
    "catagory_index": "545",
    "category_index": 544,
    "date": "2020-01-18T08:00:00.000Z",
    "gender": "male",
    "hundredths_under_barrier": 300,
    "index": 623,
    "location": "Nashville",
    "name": "Waleed Suliman",
    "readable_date": "1/18/2020",
    "result": "3:57.0"
  },
  {
    "catagory_index": "546",
    "category_index": 545,
    "date": "2020-01-18T08:00:00.000Z",
    "gender": "male",
    "hundredths_under_barrier": 230,
    "index": 624,
    "location": "Nashville",
    "name": "Ryan Adams",
    "readable_date": "1/18/2020",
    "result": "3:57.7"
  },
  {
    "catagory_index": "547",
    "category_index": 546,
    "date": "2020-01-18T08:00:00.000Z",
    "gender": "male",
    "hundredths_under_barrier": 30,
    "index": 625,
    "location": "Nashville",
    "name": "Abraham Alvarado",
    "readable_date": "1/18/2020",
    "result": "3:59.7"
  },
  {
    "catagory_index": "548",
    "category_index": 547,
    "date": "2020-01-25T08:00:00.000Z",
    "gender": "male",
    "hundredths_under_barrier": 20,
    "index": 626,
    "location": "Boston",
    "name": "Crayton Carrozza",
    "readable_date": "1/25/2020",
    "result": "3:59.8"
  },
  {
    "catagory_index": "549",
    "category_index": 548,
    "date": "2020-01-25T08:00:00.000Z",
    "gender": "male",
    "hundredths_under_barrier": 10,
    "index": 627,
    "location": "Boston",
    "name": "Jake Brophy",
    "readable_date": "1/25/2020",
    "result": "3:59.9"
  },
  {
    "catagory_index": "1",
    "category_index": 1,
    "date": "2020-01-25T08:00:00.000Z",
    "gender": "non-binary",
    "hundredths_under_barrier": 70,
    "index": 628,
    "location": "New York",
    "name": "Nikki Hiltz",
    "readable_date": "1/25/2020",
    "result": "4:29.3"
  },
  {
    "catagory_index": "81",
    "category_index": 81,
    "date": "2020-01-25T08:00:00.000Z",
    "gender": "female",
    "hundredths_under_barrier": 20,
    "index": 629,
    "location": "New York",
    "name": "Whittni Orton",
    "readable_date": "1/25/2020",
    "result": "4:29.8"
  },
  {
    "catagory_index": "550",
    "category_index": 549,
    "date": "2020-02-01T08:00:00.000Z",
    "gender": "male",
    "hundredths_under_barrier": 190,
    "index": 630,
    "location": "Seattle",
    "name": "Talem Franco",
    "readable_date": "2/1/2020",
    "result": "3:58.1"
  },
  {
    "catagory_index": "551",
    "category_index": 550,
    "date": "2020-02-01T08:00:00.000Z",
    "gender": "male",
    "hundredths_under_barrier": 20,
    "index": 631,
    "location": "Seattle",
    "name": "Dustin Nading",
    "readable_date": "2/1/2020",
    "result": "3:59.8"
  },
  {
    "catagory_index": "82",
    "category_index": 82,
    "date": "2020-02-01T08:00:00.000Z",
    "gender": "female",
    "hundredths_under_barrier": 190,
    "index": 632,
    "location": "Seattle",
    "name": "Hanna Green",
    "readable_date": "2/1/2020",
    "result": "4:28.1"
  },
  {
    "catagory_index": "83",
    "category_index": 83,
    "date": "2020-02-08T08:00:00.000Z",
    "gender": "female",
    "hundredths_under_barrier": 210,
    "index": 633,
    "location": "New York",
    "name": "Dani Jones",
    "readable_date": "2/8/2020",
    "result": "4:27.9"
  },
  {
    "catagory_index": "552",
    "category_index": 551,
    "date": "2020-02-15T08:00:00.000Z",
    "gender": "male",
    "hundredths_under_barrier": 230,
    "index": 634,
    "location": "Boston",
    "name": "Sam Ellis",
    "readable_date": "2/15/2020",
    "result": "3:57.7"
  },
  {
    "catagory_index": "553",
    "category_index": 552,
    "date": "2020-02-15T08:00:00.000Z",
    "gender": "male",
    "hundredths_under_barrier": 150,
    "index": 635,
    "location": "Boston",
    "name": "Matthew Schadler",
    "readable_date": "2/15/2020",
    "result": "3:58.5"
  },
  {
    "catagory_index": "554",
    "category_index": 553,
    "date": "2020-02-15T08:00:00.000Z",
    "gender": "male",
    "hundredths_under_barrier": 60,
    "index": 636,
    "location": "Boston",
    "name": "AJ Ernst",
    "readable_date": "2/15/2020",
    "result": "3:59.4"
  },
  {
    "catagory_index": "555",
    "category_index": 554,
    "date": "2020-02-15T08:00:00.000Z",
    "gender": "male",
    "hundredths_under_barrier": 30,
    "index": 637,
    "location": "Boston",
    "name": "Colin Daly",
    "readable_date": "2/15/2020",
    "result": "3:59.7"
  },
  {
    "catagory_index": "556",
    "category_index": 555,
    "date": "2020-02-21T08:00:00.000Z",
    "gender": "male",
    "hundredths_under_barrier": 70,
    "index": 638,
    "location": "Seattle",
    "name": "Dan Curts",
    "readable_date": "2/21/2020",
    "result": "3:59.3"
  },
  {
    "catagory_index": "557",
    "category_index": 556,
    "date": "2020-02-28T08:00:00.000Z",
    "gender": "male",
    "hundredths_under_barrier": 190,
    "index": 639,
    "location": "Boston",
    "name": "Kenneth Hagen",
    "readable_date": "2/28/2020",
    "result": "3:58.1"
  },
  {
    "catagory_index": "558",
    "category_index": 557,
    "date": "2020-02-28T08:00:00.000Z",
    "gender": "male",
    "hundredths_under_barrier": 180,
    "index": 640,
    "location": "Boston",
    "name": "Cole Hocker",
    "readable_date": "2/28/2020",
    "result": "3:58.2"
  },
  {
    "catagory_index": "559",
    "category_index": 558,
    "date": "2020-02-28T08:00:00.000Z",
    "gender": "male",
    "hundredths_under_barrier": 80,
    "index": 641,
    "location": "Boston",
    "name": "Woody Kincaid",
    "readable_date": "2/28/2020",
    "result": "3:59.2"
  },
  {
    "catagory_index": "560",
    "category_index": 559,
    "date": "2020-05-23T07:00:00.000Z",
    "gender": "male",
    "hundredths_under_barrier": 50,
    "index": 642,
    "location": "El Dorado Hills",
    "name": "Leo Daschbach",
    "readable_date": "5/23/2020",
    "result": "3:59.5"
  },
  {
    "catagory_index": "561",
    "category_index": 560,
    "date": "2020-07-25T07:00:00.000Z",
    "gender": "male",
    "hundredths_under_barrier": 110,
    "index": 643,
    "location": "Marion",
    "name": "Mason Ferlic",
    "readable_date": "7/25/2020",
    "result": "3:58.9"
  },
  {
    "catagory_index": "562",
    "category_index": 561,
    "date": "2020-08-15T07:00:00.000Z",
    "gender": "male",
    "hundredths_under_barrier": 40,
    "index": 644,
    "location": "Nashville",
    "name": "Jacob Dumford",
    "readable_date": "8/15/2020",
    "result": "3:59.6"
  },
  {
    "catagory_index": "563",
    "category_index": 562,
    "date": "2020-12-12T08:00:00.000Z",
    "gender": "male",
    "hundredths_under_barrier": 120,
    "index": 645,
    "location": "Columbia",
    "name": "Victor Palumbo",
    "readable_date": "12/12/2020",
    "result": "3:58.8"
  },
  {
    "catagory_index": "564",
    "category_index": 563,
    "date": "2021-01-22T08:00:00.000Z",
    "gender": "male",
    "hundredths_under_barrier": 70,
    "index": 646,
    "location": "Birmingham",
    "name": "Cameron Ponder",
    "readable_date": "1/22/2021",
    "result": "3:59.3"
  },
  {
    "catagory_index": "565",
    "category_index": 564,
    "date": "2021-01-30T08:00:00.000Z",
    "gender": "male",
    "hundredths_under_barrier": 110,
    "index": 647,
    "location": "Fayetteville",
    "name": "Everett Smulders",
    "readable_date": "1/30/2021",
    "result": "3:58.9"
  },
  {
    "catagory_index": "566",
    "category_index": 565,
    "date": "2021-01-30T08:00:00.000Z",
    "gender": "male",
    "hundredths_under_barrier": 50,
    "index": 648,
    "location": "Seattle",
    "name": "Cruz Culpepper",
    "readable_date": "1/30/2021",
    "result": "3:59.5"
  },
  {
    "catagory_index": "567",
    "category_index": 566,
    "date": "2021-02-06T08:00:00.000Z",
    "gender": "male",
    "hundredths_under_barrier": 250,
    "index": 649,
    "location": "Blacksburg",
    "name": "Diego Zarate",
    "readable_date": "2/6/2021",
    "result": "3:57.5"
  },
  {
    "catagory_index": "568",
    "category_index": 567,
    "date": "2021-02-06T08:00:00.000Z",
    "gender": "male",
    "hundredths_under_barrier": 100,
    "index": 650,
    "location": "Blacksburg",
    "name": "Bashir Mosavel-Lo",
    "readable_date": "2/6/2021",
    "result": "3:59.0"
  },
  {
    "catagory_index": "569",
    "category_index": 568,
    "date": "2021-02-06T08:00:00.000Z",
    "gender": "male",
    "hundredths_under_barrier": 100,
    "index": 651,
    "location": "Blacksburg",
    "name": "Benjamin Nibbelink",
    "readable_date": "2/6/2021",
    "result": "3:59.0"
  },
  {
    "catagory_index": "570",
    "category_index": 569,
    "date": "2021-02-06T08:00:00.000Z",
    "gender": "male",
    "hundredths_under_barrier": 50,
    "index": 652,
    "location": "Blacksburg",
    "name": "Ben Fleming",
    "readable_date": "2/6/2021",
    "result": "3:59.5"
  },
  {
    "catagory_index": "571",
    "category_index": 570,
    "date": "2021-02-07T08:00:00.000Z",
    "gender": "male",
    "hundredths_under_barrier": 230,
    "index": 653,
    "location": "Fayetteville",
    "name": "Hobbs Kessler",
    "readable_date": "2/7/2021",
    "result": "3:57.7"
  },
  {
    "catagory_index": "572",
    "category_index": 571,
    "date": "2021-02-12T08:00:00.000Z",
    "gender": "male",
    "hundredths_under_barrier": 250,
    "index": 654,
    "location": "Nashville",
    "name": "Davis Bove",
    "readable_date": "2/12/2021",
    "result": "3:57.5"
  },
  {
    "catagory_index": "573",
    "category_index": 572,
    "date": "2021-02-12T08:00:00.000Z",
    "gender": "male",
    "hundredths_under_barrier": 90,
    "index": 655,
    "location": "Nashville",
    "name": "Baylor Franklin",
    "readable_date": "2/12/2021",
    "result": "3:59.1"
  },
  {
    "catagory_index": "574",
    "category_index": 573,
    "date": "2021-02-13T08:00:00.000Z",
    "gender": "male",
    "hundredths_under_barrier": 70,
    "index": 656,
    "location": "Ames",
    "name": "Cole Lindhorst",
    "readable_date": "2/13/2021",
    "result": "3:59.3"
  },
  {
    "catagory_index": "575",
    "category_index": 574,
    "date": "2021-02-13T08:00:00.000Z",
    "gender": "male",
    "hundredths_under_barrier": 10,
    "index": 657,
    "location": "Fayetteville",
    "name": "EJ Holland",
    "readable_date": "2/13/2021",
    "result": "3:59.9"
  },
  {
    "catagory_index": "576",
    "category_index": 575,
    "date": "2021-02-13T08:00:00.000Z",
    "gender": "male",
    "hundredths_under_barrier": 260,
    "index": 658,
    "location": "Seattle",
    "name": "Colton Johnsen",
    "readable_date": "2/13/2021",
    "result": "3:57.4"
  },
  {
    "catagory_index": "577",
    "category_index": 576,
    "date": "2021-02-13T08:00:00.000Z",
    "gender": "male",
    "hundredths_under_barrier": 190,
    "index": 659,
    "location": "Seattle",
    "name": "Zach Stallings",
    "readable_date": "2/13/2021",
    "result": "3:58.1"
  },
  {
    "catagory_index": "578",
    "category_index": 577,
    "date": "2021-02-27T08:00:00.000Z",
    "gender": "male",
    "hundredths_under_barrier": 220,
    "index": 660,
    "location": "Clemson",
    "name": "Brandon Tubby",
    "readable_date": "2/27/2021",
    "result": "3:57.8"
  },
  {
    "catagory_index": "579",
    "category_index": 578,
    "date": "2021-02-27T08:00:00.000Z",
    "gender": "male",
    "hundredths_under_barrier": 70,
    "index": 661,
    "location": "Clemson",
    "name": "Thomas Ratcliffe",
    "readable_date": "2/27/2021",
    "result": "3:59.3"
  },
  {
    "catagory_index": "580",
    "category_index": 579,
    "date": "2021-02-27T08:00:00.000Z",
    "gender": "male",
    "hundredths_under_barrier": 450,
    "index": 662,
    "location": "Seattle",
    "name": "Lucas Bons",
    "readable_date": "2/27/2021",
    "result": "3:55.5"
  },
  {
    "catagory_index": "581",
    "category_index": 580,
    "date": "2021-03-12T08:00:00.000Z",
    "gender": "male",
    "hundredths_under_barrier": 280,
    "index": 663,
    "location": "Fayetteville",
    "name": "Sean Dolan",
    "readable_date": "3/12/2021",
    "result": "3:57.2"
  },
  {
    "catagory_index": "582",
    "category_index": 581,
    "date": "2021-04-24T07:00:00.000Z",
    "gender": "male",
    "hundredths_under_barrier": 100,
    "index": 664,
    "location": "Provo",
    "name": "Casey Clinger",
    "readable_date": "4/24/2021",
    "result": "3:59.0"
  },
  {
    "catagory_index": "583",
    "category_index": 582,
    "date": "2021-05-01T07:00:00.000Z",
    "gender": "male",
    "hundredths_under_barrier": 380,
    "index": 665,
    "location": "Charlottesville",
    "name": "Jack Salisbury",
    "readable_date": "5/1/2021",
    "result": "3:56.2"
  },
  {
    "catagory_index": "584",
    "category_index": 583,
    "date": "2021-05-01T07:00:00.000Z",
    "gender": "male",
    "hundredths_under_barrier": 10,
    "index": 666,
    "location": "Charlottesville",
    "name": "Parker Stokes",
    "readable_date": "5/1/2021",
    "result": "3:59.9"
  },
  {
    "catagory_index": "585",
    "category_index": 584,
    "date": "2021-05-15T07:00:00.000Z",
    "gender": "male",
    "hundredths_under_barrier": 160,
    "index": 667,
    "location": "Toledo",
    "name": "Dan Schaffer",
    "readable_date": "5/15/2021",
    "result": "3:58.4"
  },
  {
    "catagory_index": "586",
    "category_index": 585,
    "date": "2021-06-03T07:00:00.000Z",
    "gender": "male",
    "hundredths_under_barrier": 240,
    "index": 668,
    "location": "St. Louis",
    "name": "Bryce Richards",
    "readable_date": "6/3/2021",
    "result": "3:57.6"
  },
  {
    "catagory_index": "587",
    "category_index": 586,
    "date": "2021-06-06T07:00:00.000Z",
    "gender": "male",
    "hundredths_under_barrier": 100,
    "index": 669,
    "location": "Nashville",
    "name": "Sean Torpy",
    "readable_date": "6/6/2021",
    "result": "3:59.0"
  },
  {
    "catagory_index": "588",
    "category_index": 587,
    "date": "2021-06-06T07:00:00.000Z",
    "gender": "male",
    "hundredths_under_barrier": 30,
    "index": 670,
    "location": "Nashville",
    "name": "Wesley Meyer",
    "readable_date": "6/6/2021",
    "result": "3:59.7"
  },
  {
    "catagory_index": "589",
    "category_index": 588,
    "date": "2021-07-01T07:00:00.000Z",
    "gender": "male",
    "hundredths_under_barrier": 200,
    "index": 671,
    "location": "Milwaukee",
    "name": "Shane Streich",
    "readable_date": "7/1/2021",
    "result": "3:58.0"
  },
  {
    "catagory_index": "590",
    "category_index": 589,
    "date": "2021-07-01T07:00:00.000Z",
    "gender": "male",
    "hundredths_under_barrier": 100,
    "index": 672,
    "location": "Milwaukee",
    "name": "Olin Hacker",
    "readable_date": "7/1/2021",
    "result": "3:59.0"
  },
  {
    "catagory_index": "591",
    "category_index": 590,
    "date": "2021-07-18T07:00:00.000Z",
    "gender": "male",
    "hundredths_under_barrier": 170,
    "index": 673,
    "location": "Mission Viejo",
    "name": "Isaac Updike",
    "readable_date": "7/18/2021",
    "result": "3:58.3"
  },
  {
    "catagory_index": "592",
    "category_index": 591,
    "date": "2021-07-18T07:00:00.000Z",
    "gender": "male",
    "hundredths_under_barrier": 60,
    "index": 674,
    "location": "Mission Viejo",
    "name": "Liam Meirow",
    "readable_date": "7/18/2021",
    "result": "3:59.4"
  },
  {
    "catagory_index": "593",
    "category_index": 592,
    "date": "2021-07-18T07:00:00.000Z",
    "gender": "male",
    "hundredths_under_barrier": 220,
    "index": 675,
    "location": "Mission Viejo",
    "name": "Andrew Rafla",
    "readable_date": "7/18/2021",
    "result": "3:57.8"
  },
  {
    "catagory_index": "594",
    "category_index": 593,
    "date": "2021-07-18T07:00:00.000Z",
    "gender": "male",
    "hundredths_under_barrier": 70,
    "index": 676,
    "location": "Mission Viejo",
    "name": "Obsa Ali",
    "readable_date": "7/18/2021",
    "result": "3:59.3"
  },
  {
    "catagory_index": "84",
    "category_index": 84,
    "date": "2021-07-18T07:00:00.000Z",
    "gender": "female",
    "hundredths_under_barrier": 110,
    "index": 677,
    "location": "Mission Viejo",
    "name": "Taryn Rawlings",
    "readable_date": "7/18/2021",
    "result": "4:28.9"
  },
  {
    "catagory_index": "85",
    "category_index": 85,
    "date": "2021-07-18T07:00:00.000Z",
    "gender": "female",
    "hundredths_under_barrier": 70,
    "index": 678,
    "location": "Mission Viejo",
    "name": "Raevyn Rogers",
    "readable_date": "7/18/2021",
    "result": "4:29.3"
  },
  {
    "catagory_index": "595",
    "category_index": 594,
    "date": "2021-08-06T07:00:00.000Z",
    "gender": "male",
    "hundredths_under_barrier": 230,
    "index": 679,
    "location": "Raleigh",
    "name": "Tai Dinger",
    "readable_date": "8/6/2021",
    "result": "3:57.7"
  },
  {
    "catagory_index": "596",
    "category_index": 595,
    "date": "2021-08-06T07:00:00.000Z",
    "gender": "male",
    "hundredths_under_barrier": 170,
    "index": 680,
    "location": "Raleigh",
    "name": "Isaiah Harris",
    "readable_date": "8/6/2021",
    "result": "3:58.3"
  },
  {
    "catagory_index": "597",
    "category_index": 596,
    "date": "2021-08-06T07:00:00.000Z",
    "gender": "male",
    "hundredths_under_barrier": 130,
    "index": 681,
    "location": "Raleigh",
    "name": "Biya Simbassa",
    "readable_date": "8/6/2021",
    "result": "3:58.7"
  },
  {
    "catagory_index": "86",
    "category_index": 86,
    "date": "2021-08-06T07:00:00.000Z",
    "gender": "female",
    "hundredths_under_barrier": 410,
    "index": 682,
    "location": "Raleigh",
    "name": "Josette Norries",
    "readable_date": "8/6/2021",
    "result": "4:25.9"
  },
  {
    "catagory_index": "87",
    "category_index": 87,
    "date": "2021-08-06T07:00:00.000Z",
    "gender": "female",
    "hundredths_under_barrier": 320,
    "index": 683,
    "location": "Raleigh",
    "name": "Sage Hurta",
    "readable_date": "8/6/2021",
    "result": "4:26.8"
  },
  {
    "catagory_index": "88",
    "category_index": 88,
    "date": "2021-08-06T07:00:00.000Z",
    "gender": "female",
    "hundredths_under_barrier": 200,
    "index": 684,
    "location": "Raleigh",
    "name": "Rebecca Mehra",
    "readable_date": "8/6/2021",
    "result": "4:28.0"
  },
  {
    "catagory_index": "89",
    "category_index": 89,
    "date": "2021-08-06T07:00:00.000Z",
    "gender": "female",
    "hundredths_under_barrier": 80,
    "index": 685,
    "location": "Raleigh",
    "name": "Michaela Meyer",
    "readable_date": "8/6/2021",
    "result": "4:29.2"
  },
  {
    "catagory_index": "90",
    "category_index": 90,
    "date": "2021-08-06T07:00:00.000Z",
    "gender": "female",
    "hundredths_under_barrier": 50,
    "index": 686,
    "location": "Raleigh",
    "name": "Eleanor Fulton",
    "readable_date": "8/6/2021",
    "result": "4:29.5"
  },
  {
    "catagory_index": "91",
    "category_index": 91,
    "date": "2021-08-06T07:00:00.000Z",
    "gender": "female",
    "hundredths_under_barrier": 10,
    "index": 687,
    "location": "Raleigh",
    "name": "Grace Barnett",
    "readable_date": "8/6/2021",
    "result": "4:29.9"
  },
  {
    "catagory_index": "598",
    "category_index": 597,
    "date": "2021-08-12T07:00:00.000Z",
    "gender": "male",
    "hundredths_under_barrier": 130,
    "index": 688,
    "location": "West Chester",
    "name": "Brian Crimmins",
    "readable_date": "8/12/2021",
    "result": "3:58.7"
  },
  {
    "catagory_index": "92",
    "category_index": 92,
    "date": "2021-09-03T07:00:00.000Z",
    "gender": "female",
    "hundredths_under_barrier": 810,
    "index": 689,
    "location": "Brussels",
    "name": "Elise Cranny",
    "readable_date": "9/3/2021",
    "result": "4:21.9"
  },
  {
    "catagory_index": "599",
    "category_index": 598,
    "date": "2021-12-11T08:00:00.000Z",
    "gender": "male",
    "hundredths_under_barrier": 110,
    "index": 690,
    "location": "Ames",
    "name": "Isaac Basten",
    "readable_date": "12/11/2021",
    "result": "3:58.9"
  },
  {
    "catagory_index": "528",
    "category_index": 599,
    "date": "2029-01-26T08:00:00.000Z",
    "gender": "male",
    "hundredths_under_barrier": 70,
    "index": 691,
    "location": "Seattle",
    "name": "Alex Ostberg",
    "readable_date": "1/26/2029",
    "result": "3:59.3"
  }
]